Not a conda environment: /scratch.global/inoue019/myenv
load nci
unique drugs: 177
unique genes: 251
DTI unique genes:  251
Top 90% variable genes:  2383
Total:  2582
Final gene exp shape: (60, 2582)
Final drug Act shape: (1005, 60)
  0%|          | 0/25 [00:00<?, ?it/s]  4%|▍         | 1/25 [00:02<00:59,  2.47s/it]  8%|▊         | 2/25 [00:02<00:25,  1.12s/it] 12%|█▏        | 3/25 [00:02<00:14,  1.48it/s] 16%|█▌        | 4/25 [00:02<00:10,  2.06it/s] 20%|██        | 5/25 [00:03<00:07,  2.70it/s] 24%|██▍       | 6/25 [00:03<00:05,  3.31it/s] 28%|██▊       | 7/25 [00:03<00:05,  3.55it/s] 32%|███▏      | 8/25 [00:03<00:04,  3.65it/s] 36%|███▌      | 9/25 [00:03<00:03,  4.11it/s] 40%|████      | 10/25 [00:04<00:03,  4.51it/s] 44%|████▍     | 11/25 [00:04<00:02,  5.01it/s] 48%|████▊     | 12/25 [00:04<00:02,  5.31it/s] 52%|█████▏    | 13/25 [00:04<00:02,  4.91it/s] 56%|█████▌    | 14/25 [00:04<00:02,  5.29it/s] 60%|██████    | 15/25 [00:05<00:01,  5.72it/s] 64%|██████▍   | 16/25 [00:05<00:01,  5.66it/s] 68%|██████▊   | 17/25 [00:05<00:01,  5.85it/s] 72%|███████▏  | 18/25 [00:05<00:01,  5.82it/s] 76%|███████▌  | 19/25 [00:05<00:01,  5.78it/s] 80%|████████  | 20/25 [00:05<00:00,  5.29it/s] 84%|████████▍ | 21/25 [00:06<00:00,  5.20it/s] 88%|████████▊ | 22/25 [00:06<00:00,  5.45it/s] 92%|█████████▏| 23/25 [00:06<00:00,  5.50it/s] 96%|█████████▌| 24/25 [00:06<00:00,  5.20it/s]100%|██████████| 25/25 [00:06<00:00,  5.38it/s]100%|██████████| 25/25 [00:06<00:00,  3.65it/s]
[I 2025-04-19 12:08:06,790] Using an existing study with name 'GAT' instead of creating a new one.
Done!
0it [00:00, ?it/s]1it [08:31, 511.41s/it]2it [16:40, 498.18s/it]3it [24:59, 498.65s/it]4it [33:06, 493.89s/it]5it [40:48, 482.58s/it]5it [40:48, 489.73s/it]
[I 2025-04-19 12:48:58,997] Trial 3 finished with values: [0.7185312429029297, 0.7100859298100668, 0.6362287074306326, 0.6580351643932595] and parameters: {'dropout1': 0.15000000000000002, 'dropout2': 0.25, 'hidden1': 682, 'hidden2': 475, 'hidden3': 64, 'epochs': 1800, 'heads': 4, 'activation': 'relu', 'optimizer': 'AdamW', 'lr': 7.977552835134468e-05, 'weight_decay': 0.0003614214768268277, 'scheduler': None}.
Using device: cuda
Best model found at epoch 1800
Using device: cuda
Best model found at epoch 1800
Using device: cuda
Best model found at epoch 1800
Using device: cuda
Best model found at epoch 1800
Using device: cuda
Best model found at epoch 1800
ACC_mean: 0.6580
ACC_std: 0.0048
F1_mean: 0.6362
F1_std: 0.0122
AUROC_mean: 0.7185
AUROC_std: 0.0028
AUPR_mean: 0.7101
AUPR_std: 0.0019
0it [00:00, ?it/s]1it [35:23, 2123.46s/it]2it [1:11:17, 2141.42s/it]3it [1:45:50, 2110.22s/it]4it [2:23:15, 2163.50s/it]5it [3:00:38, 2192.26s/it]5it [3:00:38, 2167.80s/it]
[I 2025-04-19 15:49:39,580] Trial 14 finished with values: [0.6934811062423089, 0.6761763573481583, 0.641708225237059, 0.6418135599340105] and parameters: {'dropout1': 0.2, 'dropout2': 0.4, 'hidden1': 970, 'hidden2': 135, 'hidden3': 52, 'epochs': 9800, 'heads': 3, 'activation': 'relu', 'optimizer': 'AdamW', 'lr': 0.003478587536582385, 'weight_decay': 1.5805031658241907e-06, 'scheduler': 'Cosine', 'T_max': 4059}.
Using device: cuda
Best model found at epoch 9800
Using device: cuda
Best model found at epoch 9800
Using device: cuda
Best model found at epoch 9800
Using device: cuda
Best model found at epoch 9800
Using device: cuda
Best model found at epoch 9800
ACC_mean: 0.6418
ACC_std: 0.0311
F1_mean: 0.6417
F1_std: 0.0221
AUROC_mean: 0.6935
AUROC_std: 0.0406
AUPR_mean: 0.6762
AUPR_std: 0.0508
0it [00:00, ?it/s]1it [25:45, 1545.90s/it]2it [51:49, 1556.12s/it]3it [1:18:04, 1564.81s/it]4it [1:44:40, 1577.00s/it]5it [2:11:24, 1586.85s/it]5it [2:11:24, 1576.87s/it]
[I 2025-04-19 18:01:05,506] Trial 29 finished with values: [0.7210465275311777, 0.7127861276583147, 0.6229768193347766, 0.6565500319791563] and parameters: {'dropout1': 0.45000000000000007, 'dropout2': 0.4, 'hidden1': 501, 'hidden2': 145, 'hidden3': 69, 'epochs': 6600, 'heads': 3, 'activation': 'relu', 'optimizer': 'AdamW', 'lr': 0.0009049504722041574, 'weight_decay': 2.942697922874157e-06, 'scheduler': 'Cosine', 'T_max': 3004}.
Using device: cuda
Best model found at epoch 6600
Using device: cuda
Best model found at epoch 6600
Using device: cuda
Best model found at epoch 6600
Using device: cuda
Best model found at epoch 6600
Using device: cuda
Best model found at epoch 6600
ACC_mean: 0.6566
ACC_std: 0.0105
F1_mean: 0.6230
F1_std: 0.0392
AUROC_mean: 0.7210
AUROC_std: 0.0027
AUPR_mean: 0.7128
AUPR_std: 0.0023
0it [00:00, ?it/s]1it [38:57, 2337.71s/it]2it [1:18:47, 2368.52s/it]3it [1:58:42, 2380.59s/it]4it [2:38:46, 2389.54s/it]5it [3:18:51, 2395.43s/it]5it [3:18:51, 2386.38s/it]
[I 2025-04-19 21:19:59,082] Trial 40 finished with values: [0.6388068201422475, 0.6274626688056628, 0.5232586964756938, 0.5869809416355937] and parameters: {'dropout1': 0.15000000000000002, 'dropout2': 0.30000000000000004, 'hidden1': 347, 'hidden2': 314, 'hidden3': 251, 'epochs': 6700, 'heads': 8, 'activation': 'relu', 'optimizer': 'Adam', 'lr': 0.005387914063693335, 'weight_decay': 0.00014902922844771117, 'scheduler': 'Cosine', 'T_max': 2925}.
Using device: cuda
Best model found at epoch 6700
Using device: cuda
Best model found at epoch 6700
Using device: cuda
Best model found at epoch 6700
Using device: cuda
Best model found at epoch 6700
Using device: cuda
Best model found at epoch 6700
ACC_mean: 0.5870
ACC_std: 0.0082
F1_mean: 0.5233
F1_std: 0.0517
AUROC_mean: 0.6388
AUROC_std: 0.0051
AUPR_mean: 0.6275
AUPR_std: 0.0076
0it [00:00, ?it/s]1it [32:12, 1932.30s/it]2it [1:05:43, 1978.89s/it]3it [1:39:57, 2013.23s/it]4it [2:14:15, 2030.80s/it]5it [2:48:33, 2040.59s/it]5it [2:48:33, 2022.71s/it]
[I 2025-04-20 00:08:34,335] Trial 59 finished with values: [0.7288767414756416, 0.7201204530061556, 0.6491364249135461, 0.6672418022490559] and parameters: {'dropout1': 0.1, 'dropout2': 0.15000000000000002, 'hidden1': 658, 'hidden2': 269, 'hidden3': 133, 'epochs': 6900, 'heads': 6, 'activation': 'relu', 'optimizer': 'Adam', 'lr': 0.0009194447861487209, 'weight_decay': 0.002166818111314377, 'scheduler': 'Cosine', 'T_max': 2440}.
Using device: cuda
Best model found at epoch 6900
Using device: cuda
Best model found at epoch 6900
Using device: cuda
Best model found at epoch 6900
Using device: cuda
Best model found at epoch 6900
Using device: cuda
Best model found at epoch 6900
ACC_mean: 0.6672
ACC_std: 0.0062
F1_mean: 0.6491
F1_std: 0.0147
AUROC_mean: 0.7289
AUROC_std: 0.0021
AUPR_mean: 0.7201
AUPR_std: 0.0026
0it [00:00, ?it/s]1it [06:41, 401.68s/it]2it [13:21, 400.42s/it]3it [20:00, 400.10s/it]4it [26:41, 400.33s/it]5it [33:22, 400.41s/it]5it [33:22, 400.44s/it]
[I 2025-04-20 00:41:58,605] Trial 72 finished with values: [0.6830365703994825, 0.6633174151530741, 0.6591608483004942, 0.6200556648170986] and parameters: {'dropout1': 0.4, 'dropout2': 0.1, 'hidden1': 880, 'hidden2': 85, 'hidden3': 58, 'epochs': 1700, 'heads': 2, 'activation': 'gelu', 'optimizer': 'Adam', 'lr': 0.0002561521211005575, 'weight_decay': 0.000421621905922159, 'scheduler': 'Cosine', 'T_max': 825}.
Using device: cuda
Best model found at epoch 1700
Using device: cuda
Best model found at epoch 1700
Using device: cuda
Best model found at epoch 1700
Using device: cuda
Best model found at epoch 1700
Using device: cuda
Best model found at epoch 1700
ACC_mean: 0.6201
ACC_std: 0.0398
F1_mean: 0.6592
F1_std: 0.0257
AUROC_mean: 0.6830
AUROC_std: 0.0313
AUPR_mean: 0.6633
AUPR_std: 0.0328
0it [00:00, ?it/s]1it [45:37, 2737.55s/it]2it [1:31:03, 2730.84s/it]3it [2:15:20, 2697.03s/it]4it [3:01:17, 2720.76s/it]5it [3:46:08, 2710.01s/it]5it [3:46:08, 2713.72s/it]
[I 2025-04-20 04:28:09,115] Trial 75 finished with values: [0.6986948898090033, 0.6877431942463519, 0.6076228973231413, 0.6388605628855191] and parameters: {'dropout1': 0.15000000000000002, 'dropout2': 0.5, 'hidden1': 791, 'hidden2': 443, 'hidden3': 172, 'epochs': 8900, 'heads': 5, 'activation': 'relu', 'optimizer': 'Adam', 'lr': 0.0017381371795862056, 'weight_decay': 7.21280114285163e-05, 'scheduler': None}.
Using device: cuda
Best model found at epoch 8900
Using device: cuda
Best model found at epoch 8900
Using device: cuda
Best model found at epoch 8900
Using device: cuda
Best model found at epoch 8900
Using device: cuda
Best model found at epoch 8900
ACC_mean: 0.6389
ACC_std: 0.0270
F1_mean: 0.6076
F1_std: 0.0676
AUROC_mean: 0.6987
AUROC_std: 0.0239
AUPR_mean: 0.6877
AUPR_std: 0.0254
0it [00:00, ?it/s]1it [33:05, 1985.57s/it]2it [1:06:15, 1988.15s/it]3it [1:39:47, 1999.24s/it]4it [2:14:38, 2035.29s/it]5it [2:47:49, 2019.27s/it]5it [2:47:49, 2013.88s/it]
[I 2025-04-20 07:16:01,842] Trial 97 finished with values: [0.7227849688765124, 0.7135456882620231, 0.6353493756562167, 0.6601511013411951] and parameters: {'dropout1': 0.5, 'dropout2': 0.1, 'hidden1': 562, 'hidden2': 101, 'hidden3': 50, 'epochs': 8400, 'heads': 3, 'activation': 'gelu', 'optimizer': 'Adam', 'lr': 1.7390762284817006e-05, 'weight_decay': 0.002460469770153113, 'scheduler': None}.
Using device: cuda
Best model found at epoch 8400
Using device: cuda
Best model found at epoch 8400
Using device: cuda
Best model found at epoch 8400
Using device: cuda
Best model found at epoch 8400
Using device: cuda
Best model found at epoch 8400
ACC_mean: 0.6602
ACC_std: 0.0076
F1_mean: 0.6353
F1_std: 0.0157
AUROC_mean: 0.7228
AUROC_std: 0.0060
AUPR_mean: 0.7135
AUPR_std: 0.0033
0it [00:00, ?it/s]1it [49:09, 2949.01s/it]2it [1:39:03, 2976.02s/it]3it [2:28:05, 2960.42s/it]4it [3:16:10, 2930.64s/it]5it [4:04:00, 2908.65s/it]5it [4:04:00, 2928.09s/it]
[I 2025-04-20 11:20:04,358] Trial 113 finished with values: [0.710145584749607, 0.7015191070140656, 0.6298249916625961, 0.6517241044285861] and parameters: {'dropout1': 0.15000000000000002, 'dropout2': 0.35, 'hidden1': 442, 'hidden2': 325, 'hidden3': 86, 'epochs': 9500, 'heads': 8, 'activation': 'relu', 'optimizer': 'AdamW', 'lr': 0.0001583425078038282, 'weight_decay': 0.002714287381963854, 'scheduler': None}.
[W 2025-04-20 11:20:04,772] Trial 134 failed with parameters: {} because of the following error: ValueError('setting an array element with a sequence. The requested array has an inhomogeneous shape after 1 dimensions. The detected shape was (110,) + inhomogeneous part.').
Traceback (most recent call last):
  File "/panfs/jay/groups/33/kuangr/inoue019/conda-envs/myenv/lib/python3.10/site-packages/optuna/study/_optimize.py", line 197, in _run_trial
    value_or_values = func(trial)
  File "/users/4/inoue019/drGAT/zero_pad/t_small_GAT.py", line 40, in objective
    "dropout1": trial.suggest_float("dropout1", 0.1, 0.5, step=0.05),
  File "/panfs/jay/groups/33/kuangr/inoue019/conda-envs/myenv/lib/python3.10/site-packages/optuna/trial/_trial.py", line 161, in suggest_float
    suggested_value = self._suggest(name, distribution)
  File "/panfs/jay/groups/33/kuangr/inoue019/conda-envs/myenv/lib/python3.10/site-packages/optuna/trial/_trial.py", line 627, in _suggest
    elif self._is_relative_param(name, distribution):
  File "/panfs/jay/groups/33/kuangr/inoue019/conda-envs/myenv/lib/python3.10/site-packages/optuna/trial/_trial.py", line 659, in _is_relative_param
    if name not in self.relative_params:
  File "/panfs/jay/groups/33/kuangr/inoue019/conda-envs/myenv/lib/python3.10/site-packages/optuna/trial/_trial.py", line 71, in relative_params
    self._relative_params = self.study.sampler.sample_relative(
  File "/panfs/jay/groups/33/kuangr/inoue019/conda-envs/myenv/lib/python3.10/site-packages/optuna/samplers/nsgaii/_sampler.py", line 269, in sample_relative
    parent_population = self.get_parent_population(study, generation)
  File "/panfs/jay/groups/33/kuangr/inoue019/conda-envs/myenv/lib/python3.10/site-packages/optuna/samplers/_ga/_base.py", line 176, in get_parent_population
    parent_population = self.select_parent(study, generation)
  File "/panfs/jay/groups/33/kuangr/inoue019/conda-envs/myenv/lib/python3.10/site-packages/optuna/samplers/nsgaii/_sampler.py", line 256, in select_parent
    return self._elite_population_selection_strategy(
  File "/panfs/jay/groups/33/kuangr/inoue019/conda-envs/myenv/lib/python3.10/site-packages/optuna/samplers/nsgaii/_elite_population_selection_strategy.py", line 47, in __call__
    population_per_rank = _rank_population(
  File "/panfs/jay/groups/33/kuangr/inoue019/conda-envs/myenv/lib/python3.10/site-packages/optuna/samplers/nsgaii/_elite_population_selection_strategy.py", line 126, in _rank_population
    objective_values = np.array([trial.values for trial in population], dtype=np.float64)
ValueError: setting an array element with a sequence. The requested array has an inhomogeneous shape after 1 dimensions. The detected shape was (110,) + inhomogeneous part.
[W 2025-04-20 11:20:04,831] Trial 134 failed with value None.
Using device: cuda
Best model found at epoch 9500
Using device: cuda
Best model found at epoch 9500
Using device: cuda
Best model found at epoch 9500
Using device: cuda
Best model found at epoch 9500
Using device: cuda
Best model found at epoch 9500
ACC_mean: 0.6517
ACC_std: 0.0042
F1_mean: 0.6298
F1_std: 0.0044
AUROC_mean: 0.7101
AUROC_std: 0.0023
AUPR_mean: 0.7015
AUPR_std: 0.0015
Traceback (most recent call last):
  File "/users/4/inoue019/drGAT/zero_pad/t_small_GAT.py", line 162, in <module>
    study.optimize(objective, n_trials=1000)
  File "/panfs/jay/groups/33/kuangr/inoue019/conda-envs/myenv/lib/python3.10/site-packages/optuna/study/study.py", line 475, in optimize
    _optimize(
  File "/panfs/jay/groups/33/kuangr/inoue019/conda-envs/myenv/lib/python3.10/site-packages/optuna/study/_optimize.py", line 63, in _optimize
    _optimize_sequential(
  File "/panfs/jay/groups/33/kuangr/inoue019/conda-envs/myenv/lib/python3.10/site-packages/optuna/study/_optimize.py", line 160, in _optimize_sequential
    frozen_trial = _run_trial(study, func, catch)
  File "/panfs/jay/groups/33/kuangr/inoue019/conda-envs/myenv/lib/python3.10/site-packages/optuna/study/_optimize.py", line 248, in _run_trial
    raise func_err
  File "/panfs/jay/groups/33/kuangr/inoue019/conda-envs/myenv/lib/python3.10/site-packages/optuna/study/_optimize.py", line 197, in _run_trial
    value_or_values = func(trial)
  File "/users/4/inoue019/drGAT/zero_pad/t_small_GAT.py", line 40, in objective
    "dropout1": trial.suggest_float("dropout1", 0.1, 0.5, step=0.05),
  File "/panfs/jay/groups/33/kuangr/inoue019/conda-envs/myenv/lib/python3.10/site-packages/optuna/trial/_trial.py", line 161, in suggest_float
    suggested_value = self._suggest(name, distribution)
  File "/panfs/jay/groups/33/kuangr/inoue019/conda-envs/myenv/lib/python3.10/site-packages/optuna/trial/_trial.py", line 627, in _suggest
    elif self._is_relative_param(name, distribution):
  File "/panfs/jay/groups/33/kuangr/inoue019/conda-envs/myenv/lib/python3.10/site-packages/optuna/trial/_trial.py", line 659, in _is_relative_param
    if name not in self.relative_params:
  File "/panfs/jay/groups/33/kuangr/inoue019/conda-envs/myenv/lib/python3.10/site-packages/optuna/trial/_trial.py", line 71, in relative_params
    self._relative_params = self.study.sampler.sample_relative(
  File "/panfs/jay/groups/33/kuangr/inoue019/conda-envs/myenv/lib/python3.10/site-packages/optuna/samplers/nsgaii/_sampler.py", line 269, in sample_relative
    parent_population = self.get_parent_population(study, generation)
  File "/panfs/jay/groups/33/kuangr/inoue019/conda-envs/myenv/lib/python3.10/site-packages/optuna/samplers/_ga/_base.py", line 176, in get_parent_population
    parent_population = self.select_parent(study, generation)
  File "/panfs/jay/groups/33/kuangr/inoue019/conda-envs/myenv/lib/python3.10/site-packages/optuna/samplers/nsgaii/_sampler.py", line 256, in select_parent
    return self._elite_population_selection_strategy(
  File "/panfs/jay/groups/33/kuangr/inoue019/conda-envs/myenv/lib/python3.10/site-packages/optuna/samplers/nsgaii/_elite_population_selection_strategy.py", line 47, in __call__
    population_per_rank = _rank_population(
  File "/panfs/jay/groups/33/kuangr/inoue019/conda-envs/myenv/lib/python3.10/site-packages/optuna/samplers/nsgaii/_elite_population_selection_strategy.py", line 126, in _rank_population
    objective_values = np.array([trial.values for trial in population], dtype=np.float64)
ValueError: setting an array element with a sequence. The requested array has an inhomogeneous shape after 1 dimensions. The detected shape was (110,) + inhomogeneous part.
