Not a conda environment: /scratch.global/inoue019/myenv
load nci
unique drugs: 177
unique genes: 251
DTI unique genes:  251
Top 90% variable genes:  2383
Total:  2582
Final gene exp shape: (60, 2582)
Final drug Act shape: (1005, 60)
  0%|          | 0/25 [00:00<?, ?it/s]  4%|▍         | 1/25 [00:03<01:24,  3.50s/it]  8%|▊         | 2/25 [00:03<00:35,  1.56s/it] 12%|█▏        | 3/25 [00:03<00:20,  1.07it/s] 16%|█▌        | 4/25 [00:04<00:13,  1.55it/s] 20%|██        | 5/25 [00:04<00:09,  2.07it/s] 24%|██▍       | 6/25 [00:04<00:07,  2.64it/s] 28%|██▊       | 7/25 [00:04<00:05,  3.28it/s] 32%|███▏      | 8/25 [00:04<00:04,  3.82it/s] 36%|███▌      | 9/25 [00:04<00:03,  4.20it/s] 40%|████      | 10/25 [00:05<00:03,  4.51it/s] 44%|████▍     | 11/25 [00:05<00:02,  4.73it/s] 48%|████▊     | 12/25 [00:05<00:02,  4.88it/s] 52%|█████▏    | 13/25 [00:05<00:02,  5.05it/s] 56%|█████▌    | 14/25 [00:05<00:02,  4.99it/s] 60%|██████    | 15/25 [00:06<00:01,  5.06it/s] 64%|██████▍   | 16/25 [00:06<00:01,  5.24it/s] 68%|██████▊   | 17/25 [00:06<00:01,  5.33it/s] 72%|███████▏  | 18/25 [00:06<00:01,  5.53it/s] 76%|███████▌  | 19/25 [00:06<00:01,  5.39it/s] 80%|████████  | 20/25 [00:07<00:00,  5.49it/s] 84%|████████▍ | 21/25 [00:07<00:00,  5.66it/s] 88%|████████▊ | 22/25 [00:07<00:00,  5.69it/s] 92%|█████████▏| 23/25 [00:07<00:00,  5.92it/s] 96%|█████████▌| 24/25 [00:07<00:00,  5.95it/s]100%|██████████| 25/25 [00:07<00:00,  5.94it/s]100%|██████████| 25/25 [00:07<00:00,  3.19it/s]
[I 2025-04-19 12:08:06,758] Using an existing study with name 'GAT' instead of creating a new one.
Done!
0it [00:00, ?it/s]1it [11:10, 670.46s/it]2it [21:43, 648.46s/it]3it [32:16, 641.54s/it]4it [42:46, 636.94s/it]5it [53:21, 636.34s/it]5it [53:21, 640.40s/it]
[I 2025-04-19 13:01:31,115] Trial 2 finished with values: [0.7276851618307869, 0.7178427389080897, 0.6467051812961315, 0.6659982292601632] and parameters: {'dropout1': 0.25, 'dropout2': 0.35, 'hidden1': 300, 'hidden2': 92, 'hidden3': 57, 'epochs': 2500, 'heads': 3, 'activation': 'relu', 'optimizer': 'AdamW', 'lr': 0.0005324431805646393, 'weight_decay': 0.0036042850505756154, 'scheduler': 'Cosine', 'T_max': 710}.
Using device: cuda
Best model found at epoch 2500
Using device: cuda
Best model found at epoch 2500
Using device: cuda
Best model found at epoch 2500
Using device: cuda
Best model found at epoch 2500
Using device: cuda
Best model found at epoch 2500
ACC_mean: 0.6660
ACC_std: 0.0035
F1_mean: 0.6467
F1_std: 0.0098
AUROC_mean: 0.7277
AUROC_std: 0.0027
AUPR_mean: 0.7178
AUPR_std: 0.0021
0it [00:00, ?it/s]1it [35:23, 2123.61s/it]2it [1:08:50, 2054.79s/it]3it [1:43:11, 2057.67s/it]4it [2:16:38, 2037.78s/it]5it [2:52:48, 2085.42s/it]5it [2:52:48, 2073.70s/it]
[I 2025-04-19 15:54:21,039] Trial 15 finished with values: [0.670321609659273, 0.6581917396282845, 0.630827529491879, 0.6162177732998231] and parameters: {'dropout1': 0.45000000000000007, 'dropout2': 0.35, 'hidden1': 550, 'hidden2': 147, 'hidden3': 49, 'epochs': 7500, 'heads': 5, 'activation': 'relu', 'optimizer': 'Adam', 'lr': 0.0063360232109641035, 'weight_decay': 2.059111311326702e-06, 'scheduler': None}.
Using device: cuda
Best model found at epoch 7500
Using device: cuda
Best model found at epoch 7500
Using device: cuda
Best model found at epoch 7500
Using device: cuda
Best model found at epoch 7500
Using device: cuda
Best model found at epoch 7500
ACC_mean: 0.6162
ACC_std: 0.0319
F1_mean: 0.6308
F1_std: 0.0343
AUROC_mean: 0.6703
AUROC_std: 0.0417
AUPR_mean: 0.6582
AUPR_std: 0.0419
0it [00:00, ?it/s]1it [06:18, 378.83s/it]2it [12:19, 368.17s/it]3it [18:10, 360.40s/it]4it [24:00, 356.34s/it]5it [29:50, 354.08s/it]5it [29:50, 358.18s/it]
[I 2025-04-19 16:24:13,564] Trial 31 finished with values: [0.6741965012575653, 0.6629382913304233, 0.6349929719154594, 0.6252716264470722] and parameters: {'dropout1': 0.5, 'dropout2': 0.45000000000000007, 'hidden1': 906, 'hidden2': 253, 'hidden3': 242, 'epochs': 1200, 'heads': 4, 'activation': 'relu', 'optimizer': 'AdamW', 'lr': 0.0007504194596814497, 'weight_decay': 0.0009213968009047652, 'scheduler': 'Cosine', 'T_max': 431}.
Using device: cuda
Best model found at epoch 1200
Using device: cuda
Best model found at epoch 1200
Using device: cuda
Best model found at epoch 1200
Using device: cuda
Best model found at epoch 1200
Using device: cuda
Best model found at epoch 1200
ACC_mean: 0.6253
ACC_std: 0.0698
F1_mean: 0.6350
F1_std: 0.0374
AUROC_mean: 0.6742
AUROC_std: 0.0964
AUPR_mean: 0.6629
AUPR_std: 0.0958
0it [00:00, ?it/s]1it [35:31, 2131.17s/it]2it [1:10:07, 2098.87s/it]3it [1:45:20, 2105.29s/it]4it [2:20:11, 2099.71s/it]5it [2:52:56, 2051.15s/it]5it [2:52:56, 2075.31s/it]
[I 2025-04-19 19:17:12,079] Trial 34 finished with values: [0.7224222285473683, 0.71290501620569, 0.6427159799964085, 0.6620630945101552] and parameters: {'dropout1': 0.30000000000000004, 'dropout2': 0.4, 'hidden1': 449, 'hidden2': 272, 'hidden3': 145, 'epochs': 7700, 'heads': 3, 'activation': 'relu', 'optimizer': 'AdamW', 'lr': 3.858725079930244e-05, 'weight_decay': 0.0012475813987487567, 'scheduler': 'Cosine', 'T_max': 3802}.
Using device: cuda
Best model found at epoch 7700
Using device: cuda
Best model found at epoch 7700
Using device: cuda
Best model found at epoch 7700
Using device: cuda
Best model found at epoch 7700
Using device: cuda
Best model found at epoch 7700
ACC_mean: 0.6621
ACC_std: 0.0046
F1_mean: 0.6427
F1_std: 0.0097
AUROC_mean: 0.7224
AUROC_std: 0.0020
AUPR_mean: 0.7129
AUPR_std: 0.0014
0it [00:00, ?it/s]1it [22:50, 1370.26s/it]2it [45:28, 1363.01s/it]3it [1:07:21, 1340.14s/it]4it [1:28:58, 1323.13s/it]5it [1:50:35, 1313.85s/it]5it [1:50:35, 1327.12s/it]
[I 2025-04-19 21:07:49,531] Trial 48 finished with values: [0.722512262706884, 0.7145583308297764, 0.6350819775587284, 0.66035554813211] and parameters: {'dropout1': 0.25, 'dropout2': 0.1, 'hidden1': 825, 'hidden2': 256, 'hidden3': 117, 'epochs': 5900, 'heads': 2, 'activation': 'relu', 'optimizer': 'AdamW', 'lr': 2.1061654237878127e-05, 'weight_decay': 0.0005075389588757406, 'scheduler': None}.
Using device: cuda
Best model found at epoch 5900
Using device: cuda
Best model found at epoch 5900
Using device: cuda
Best model found at epoch 5900
Using device: cuda
Best model found at epoch 5900
Using device: cuda
Best model found at epoch 5900
ACC_mean: 0.6604
ACC_std: 0.0021
F1_mean: 0.6351
F1_std: 0.0062
AUROC_mean: 0.7225
AUROC_std: 0.0030
AUPR_mean: 0.7146
AUPR_std: 0.0026
0it [00:00, ?it/s]1it [02:13, 133.63s/it]2it [04:26, 133.14s/it]3it [06:39, 133.10s/it]4it [08:52, 133.02s/it]5it [11:05, 133.07s/it]5it [11:05, 133.11s/it]
[I 2025-04-19 21:18:56,719] Trial 54 finished with values: [0.7251044060083667, 0.7152967205922495, 0.626566732062044, 0.6614316525981807] and parameters: {'dropout1': 0.25, 'dropout2': 0.45000000000000007, 'hidden1': 854, 'hidden2': 360, 'hidden3': 221, 'epochs': 400, 'heads': 7, 'activation': 'gelu', 'optimizer': 'AdamW', 'lr': 0.00035814340786004354, 'weight_decay': 7.048135339940457e-05, 'scheduler': 'Cosine', 'T_max': 134}.
Using device: cuda
Best model found at epoch 400
Using device: cuda
Best model found at epoch 400
Using device: cuda
Best model found at epoch 400
Using device: cuda
Best model found at epoch 400
Using device: cuda
Best model found at epoch 400
ACC_mean: 0.6614
ACC_std: 0.0091
F1_mean: 0.6266
F1_std: 0.0173
AUROC_mean: 0.7251
AUROC_std: 0.0044
AUPR_mean: 0.7153
AUPR_std: 0.0063
0it [00:00, ?it/s]1it [15:52, 952.62s/it]2it [31:38, 948.60s/it]3it [47:18, 944.51s/it]4it [1:03:02, 944.29s/it]5it [1:18:48, 945.13s/it]5it [1:18:48, 945.72s/it]
[I 2025-04-19 22:37:46,960] Trial 58 finished with values: [0.6299082457987847, 0.613983042149641, 0.3405570149412913, 0.5628336123326951] and parameters: {'dropout1': 0.30000000000000004, 'dropout2': 0.15000000000000002, 'hidden1': 707, 'hidden2': 146, 'hidden3': 63, 'epochs': 3700, 'heads': 8, 'activation': 'gelu', 'optimizer': 'Adam', 'lr': 0.0013616770766333788, 'weight_decay': 0.004564334015089915, 'scheduler': 'Cosine', 'T_max': 1009}.
Using device: cuda
Best model found at epoch 3700
Using device: cuda
Best model found at epoch 3700
Using device: cuda
Best model found at epoch 3700
Using device: cuda
Best model found at epoch 3700
Using device: cuda
Best model found at epoch 3700
ACC_mean: 0.5628
ACC_std: 0.0628
F1_mean: 0.3406
F1_std: 0.3142
AUROC_mean: 0.6299
AUROC_std: 0.0490
AUPR_mean: 0.6140
AUPR_std: 0.0514
0it [00:00, ?it/s]1it [08:25, 505.96s/it]2it [17:01, 511.79s/it]3it [25:36, 513.24s/it]4it [34:04, 511.19s/it]5it [42:35, 511.08s/it]5it [42:35, 511.15s/it]
[I 2025-04-19 23:20:24,442] Trial 67 finished with values: [0.712283341798191, 0.7040956544477331, 0.6325102599545402, 0.6538773056034566] and parameters: {'dropout1': 0.1, 'dropout2': 0.2, 'hidden1': 886, 'hidden2': 192, 'hidden3': 176, 'epochs': 1700, 'heads': 8, 'activation': 'relu', 'optimizer': 'AdamW', 'lr': 0.0001583425078038282, 'weight_decay': 0.000421621905922159, 'scheduler': None}.
Using device: cuda
Best model found at epoch 1700
Using device: cuda
Best model found at epoch 1700
Using device: cuda
Best model found at epoch 1700
Using device: cuda
Best model found at epoch 1700
Using device: cuda
Best model found at epoch 1700
ACC_mean: 0.6539
ACC_std: 0.0050
F1_mean: 0.6325
F1_std: 0.0067
AUROC_mean: 0.7123
AUROC_std: 0.0028
AUPR_mean: 0.7041
AUPR_std: 0.0018
0it [00:00, ?it/s]1it [35:00, 2100.14s/it]2it [1:11:15, 2144.38s/it]3it [1:47:54, 2169.37s/it]4it [2:24:05, 2170.07s/it]5it [3:00:33, 2176.61s/it]5it [3:00:33, 2166.79s/it]
[I 2025-04-20 02:21:00,088] Trial 69 finished with values: [0.6901503962123294, 0.6818001153427008, 0.5108710561504879, 0.6283524712149695] and parameters: {'dropout1': 0.45000000000000007, 'dropout2': 0.1, 'hidden1': 567, 'hidden2': 129, 'hidden3': 59, 'epochs': 8800, 'heads': 5, 'activation': 'gelu', 'optimizer': 'AdamW', 'lr': 0.004494761682820952, 'weight_decay': 1.2709685428193883e-05, 'scheduler': 'Cosine', 'T_max': 2735}.
Using device: cuda
Best model found at epoch 8800
Using device: cuda
Best model found at epoch 8800
Using device: cuda
Best model found at epoch 8800
Using device: cuda
Best model found at epoch 8800
Using device: cuda
Best model found at epoch 8800
ACC_mean: 0.6284
ACC_std: 0.0716
F1_mean: 0.5109
F1_std: 0.2831
AUROC_mean: 0.6902
AUROC_std: 0.0718
AUPR_mean: 0.6818
AUPR_std: 0.0712
0it [00:00, ?it/s]1it [19:26, 1166.43s/it]2it [38:50, 1165.07s/it]3it [58:13, 1164.02s/it]4it [1:17:43, 1166.56s/it]5it [1:36:58, 1162.19s/it]5it [1:36:58, 1163.64s/it]
[I 2025-04-20 03:57:59,802] Trial 86 finished with values: [0.7124281867166993, 0.7043096199409302, 0.6275617471468647, 0.6531904531365826] and parameters: {'dropout1': 0.15000000000000002, 'dropout2': 0.35, 'hidden1': 562, 'hidden2': 485, 'hidden3': 174, 'epochs': 3500, 'heads': 5, 'activation': 'gelu', 'optimizer': 'Adam', 'lr': 0.0001583425078038282, 'weight_decay': 3.992832247553223e-06, 'scheduler': None}.
Using device: cuda
Best model found at epoch 3500
Using device: cuda
Best model found at epoch 3500
Using device: cuda
Best model found at epoch 3500
Using device: cuda
Best model found at epoch 3500
Using device: cuda
Best model found at epoch 3500
ACC_mean: 0.6532
ACC_std: 0.0047
F1_mean: 0.6276
F1_std: 0.0088
AUROC_mean: 0.7124
AUROC_std: 0.0028
AUPR_mean: 0.7043
AUPR_std: 0.0017
0it [00:00, ?it/s]1it [32:47, 1967.19s/it]2it [1:05:23, 1960.96s/it]3it [1:38:14, 1965.33s/it]4it [2:11:05, 1967.50s/it]5it [2:44:50, 1988.43s/it]5it [2:44:50, 1978.14s/it]
[I 2025-04-20 06:42:52,164] Trial 92 finished with values: [0.7163031470591611, 0.7053599199515317, 0.6487422633875837, 0.6599101999658503] and parameters: {'dropout1': 0.15000000000000002, 'dropout2': 0.30000000000000004, 'hidden1': 843, 'hidden2': 330, 'hidden3': 72, 'epochs': 7100, 'heads': 4, 'activation': 'relu', 'optimizer': 'AdamW', 'lr': 0.004255255967172728, 'weight_decay': 0.007566286908553132, 'scheduler': None}.
Using device: cuda
Best model found at epoch 7100
Using device: cuda
Best model found at epoch 7100
Using device: cuda
Best model found at epoch 7100
Using device: cuda
Best model found at epoch 7100
Using device: cuda
Best model found at epoch 7100
ACC_mean: 0.6599
ACC_std: 0.0066
F1_mean: 0.6487
F1_std: 0.0142
AUROC_mean: 0.7163
AUROC_std: 0.0079
AUPR_mean: 0.7054
AUPR_std: 0.0103
0it [00:00, ?it/s]1it [03:12, 192.16s/it]2it [06:28, 194.87s/it]3it [09:42, 194.28s/it]4it [12:55, 193.59s/it]5it [16:15, 196.14s/it]5it [16:15, 195.14s/it]
[I 2025-04-20 06:59:09,412] Trial 105 finished with values: [0.708547928865608, 0.6975218644416358, 0.6548709720943435, 0.6519096813812129] and parameters: {'dropout1': 0.15000000000000002, 'dropout2': 0.45000000000000007, 'hidden1': 323, 'hidden2': 222, 'hidden3': 121, 'epochs': 700, 'heads': 4, 'activation': 'gelu', 'optimizer': 'AdamW', 'lr': 3.092589555013167e-05, 'weight_decay': 0.0024592916416834817, 'scheduler': 'Cosine', 'T_max': 176}.
Using device: cuda
Best model found at epoch 700
Using device: cuda
Best model found at epoch 700
Using device: cuda
Best model found at epoch 700
Using device: cuda
Best model found at epoch 700
Using device: cuda
Best model found at epoch 700
ACC_mean: 0.6519
ACC_std: 0.0067
F1_mean: 0.6549
F1_std: 0.0227
AUROC_mean: 0.7085
AUROC_std: 0.0053
AUPR_mean: 0.6975
AUPR_std: 0.0037
0it [00:00, ?it/s]1it [40:05, 2405.71s/it]2it [1:19:14, 2372.03s/it]3it [1:56:20, 2305.62s/it]4it [2:31:52, 2236.84s/it]5it [3:05:21, 2154.81s/it]5it [3:05:21, 2224.30s/it]
[I 2025-04-20 10:04:32,414] Trial 111 finished with values: [0.6371158351340173, 0.6216692312850479, 0.471017642837767, 0.5743023327764372] and parameters: {'dropout1': 0.25, 'dropout2': 0.25, 'hidden1': 497, 'hidden2': 65, 'hidden3': 35, 'epochs': 8700, 'heads': 7, 'activation': 'relu', 'optimizer': 'Adam', 'lr': 0.004370398499200365, 'weight_decay': 0.002780092403337655, 'scheduler': None}.
[W 2025-04-20 10:04:32,794] Trial 127 failed with parameters: {} because of the following error: ValueError('setting an array element with a sequence. The requested array has an inhomogeneous shape after 1 dimensions. The detected shape was (103,) + inhomogeneous part.').
Traceback (most recent call last):
  File "/panfs/jay/groups/33/kuangr/inoue019/conda-envs/myenv/lib/python3.10/site-packages/optuna/study/_optimize.py", line 197, in _run_trial
    value_or_values = func(trial)
  File "/users/4/inoue019/drGAT/zero_pad/t_small_GAT.py", line 40, in objective
    "dropout1": trial.suggest_float("dropout1", 0.1, 0.5, step=0.05),
  File "/panfs/jay/groups/33/kuangr/inoue019/conda-envs/myenv/lib/python3.10/site-packages/optuna/trial/_trial.py", line 161, in suggest_float
    suggested_value = self._suggest(name, distribution)
  File "/panfs/jay/groups/33/kuangr/inoue019/conda-envs/myenv/lib/python3.10/site-packages/optuna/trial/_trial.py", line 627, in _suggest
    elif self._is_relative_param(name, distribution):
  File "/panfs/jay/groups/33/kuangr/inoue019/conda-envs/myenv/lib/python3.10/site-packages/optuna/trial/_trial.py", line 659, in _is_relative_param
    if name not in self.relative_params:
  File "/panfs/jay/groups/33/kuangr/inoue019/conda-envs/myenv/lib/python3.10/site-packages/optuna/trial/_trial.py", line 71, in relative_params
    self._relative_params = self.study.sampler.sample_relative(
  File "/panfs/jay/groups/33/kuangr/inoue019/conda-envs/myenv/lib/python3.10/site-packages/optuna/samplers/nsgaii/_sampler.py", line 269, in sample_relative
    parent_population = self.get_parent_population(study, generation)
  File "/panfs/jay/groups/33/kuangr/inoue019/conda-envs/myenv/lib/python3.10/site-packages/optuna/samplers/_ga/_base.py", line 176, in get_parent_population
    parent_population = self.select_parent(study, generation)
  File "/panfs/jay/groups/33/kuangr/inoue019/conda-envs/myenv/lib/python3.10/site-packages/optuna/samplers/nsgaii/_sampler.py", line 256, in select_parent
    return self._elite_population_selection_strategy(
  File "/panfs/jay/groups/33/kuangr/inoue019/conda-envs/myenv/lib/python3.10/site-packages/optuna/samplers/nsgaii/_elite_population_selection_strategy.py", line 47, in __call__
    population_per_rank = _rank_population(
  File "/panfs/jay/groups/33/kuangr/inoue019/conda-envs/myenv/lib/python3.10/site-packages/optuna/samplers/nsgaii/_elite_population_selection_strategy.py", line 126, in _rank_population
    objective_values = np.array([trial.values for trial in population], dtype=np.float64)
ValueError: setting an array element with a sequence. The requested array has an inhomogeneous shape after 1 dimensions. The detected shape was (103,) + inhomogeneous part.
[W 2025-04-20 10:04:32,822] Trial 127 failed with value None.
Using device: cuda
Best model found at epoch 8700
Using device: cuda
Best model found at epoch 8700
Using device: cuda
Best model found at epoch 8700
Using device: cuda
Best model found at epoch 8700
Using device: cuda
Best model found at epoch 8700
ACC_mean: 0.5743
ACC_std: 0.0269
F1_mean: 0.4710
F1_std: 0.1591
AUROC_mean: 0.6371
AUROC_std: 0.0079
AUPR_mean: 0.6217
AUPR_std: 0.0176
Traceback (most recent call last):
  File "/users/4/inoue019/drGAT/zero_pad/t_small_GAT.py", line 162, in <module>
    study.optimize(objective, n_trials=1000)
  File "/panfs/jay/groups/33/kuangr/inoue019/conda-envs/myenv/lib/python3.10/site-packages/optuna/study/study.py", line 475, in optimize
    _optimize(
  File "/panfs/jay/groups/33/kuangr/inoue019/conda-envs/myenv/lib/python3.10/site-packages/optuna/study/_optimize.py", line 63, in _optimize
    _optimize_sequential(
  File "/panfs/jay/groups/33/kuangr/inoue019/conda-envs/myenv/lib/python3.10/site-packages/optuna/study/_optimize.py", line 160, in _optimize_sequential
    frozen_trial = _run_trial(study, func, catch)
  File "/panfs/jay/groups/33/kuangr/inoue019/conda-envs/myenv/lib/python3.10/site-packages/optuna/study/_optimize.py", line 248, in _run_trial
    raise func_err
  File "/panfs/jay/groups/33/kuangr/inoue019/conda-envs/myenv/lib/python3.10/site-packages/optuna/study/_optimize.py", line 197, in _run_trial
    value_or_values = func(trial)
  File "/users/4/inoue019/drGAT/zero_pad/t_small_GAT.py", line 40, in objective
    "dropout1": trial.suggest_float("dropout1", 0.1, 0.5, step=0.05),
  File "/panfs/jay/groups/33/kuangr/inoue019/conda-envs/myenv/lib/python3.10/site-packages/optuna/trial/_trial.py", line 161, in suggest_float
    suggested_value = self._suggest(name, distribution)
  File "/panfs/jay/groups/33/kuangr/inoue019/conda-envs/myenv/lib/python3.10/site-packages/optuna/trial/_trial.py", line 627, in _suggest
    elif self._is_relative_param(name, distribution):
  File "/panfs/jay/groups/33/kuangr/inoue019/conda-envs/myenv/lib/python3.10/site-packages/optuna/trial/_trial.py", line 659, in _is_relative_param
    if name not in self.relative_params:
  File "/panfs/jay/groups/33/kuangr/inoue019/conda-envs/myenv/lib/python3.10/site-packages/optuna/trial/_trial.py", line 71, in relative_params
    self._relative_params = self.study.sampler.sample_relative(
  File "/panfs/jay/groups/33/kuangr/inoue019/conda-envs/myenv/lib/python3.10/site-packages/optuna/samplers/nsgaii/_sampler.py", line 269, in sample_relative
    parent_population = self.get_parent_population(study, generation)
  File "/panfs/jay/groups/33/kuangr/inoue019/conda-envs/myenv/lib/python3.10/site-packages/optuna/samplers/_ga/_base.py", line 176, in get_parent_population
    parent_population = self.select_parent(study, generation)
  File "/panfs/jay/groups/33/kuangr/inoue019/conda-envs/myenv/lib/python3.10/site-packages/optuna/samplers/nsgaii/_sampler.py", line 256, in select_parent
    return self._elite_population_selection_strategy(
  File "/panfs/jay/groups/33/kuangr/inoue019/conda-envs/myenv/lib/python3.10/site-packages/optuna/samplers/nsgaii/_elite_population_selection_strategy.py", line 47, in __call__
    population_per_rank = _rank_population(
  File "/panfs/jay/groups/33/kuangr/inoue019/conda-envs/myenv/lib/python3.10/site-packages/optuna/samplers/nsgaii/_elite_population_selection_strategy.py", line 126, in _rank_population
    objective_values = np.array([trial.values for trial in population], dtype=np.float64)
ValueError: setting an array element with a sequence. The requested array has an inhomogeneous shape after 1 dimensions. The detected shape was (103,) + inhomogeneous part.
