Not a conda environment: /scratch.global/inoue019/myenv
load nci
unique drugs: 177
unique genes: 251
DTI unique genes:  251
Top 90% variable genes:  2383
Total:  2582
Final gene exp shape: (60, 2582)
Final drug Act shape: (1005, 60)
  0%|          | 0/25 [00:00<?, ?it/s]  4%|▍         | 1/25 [00:01<00:46,  1.95s/it]  8%|▊         | 2/25 [00:02<00:20,  1.11it/s] 12%|█▏        | 3/25 [00:02<00:12,  1.78it/s] 16%|█▌        | 4/25 [00:02<00:08,  2.47it/s] 20%|██        | 5/25 [00:02<00:06,  3.16it/s] 24%|██▍       | 6/25 [00:02<00:05,  3.79it/s] 28%|██▊       | 7/25 [00:02<00:04,  4.39it/s] 32%|███▏      | 8/25 [00:03<00:03,  4.88it/s] 36%|███▌      | 9/25 [00:03<00:03,  5.23it/s] 40%|████      | 10/25 [00:03<00:02,  5.70it/s] 44%|████▍     | 11/25 [00:03<00:02,  6.18it/s] 48%|████▊     | 12/25 [00:03<00:01,  6.54it/s] 52%|█████▏    | 13/25 [00:03<00:01,  6.60it/s] 56%|█████▌    | 14/25 [00:03<00:01,  6.83it/s] 60%|██████    | 15/25 [00:04<00:01,  6.81it/s] 64%|██████▍   | 16/25 [00:04<00:01,  6.79it/s] 68%|██████▊   | 17/25 [00:04<00:01,  6.64it/s] 72%|███████▏  | 18/25 [00:04<00:01,  6.67it/s] 76%|███████▌  | 19/25 [00:04<00:00,  6.57it/s] 80%|████████  | 20/25 [00:04<00:00,  6.76it/s] 84%|████████▍ | 21/25 [00:04<00:00,  6.69it/s] 88%|████████▊ | 22/25 [00:05<00:00,  6.55it/s] 92%|█████████▏| 23/25 [00:05<00:00,  6.48it/s] 96%|█████████▌| 24/25 [00:05<00:00,  6.39it/s]100%|██████████| 25/25 [00:05<00:00,  6.80it/s]100%|██████████| 25/25 [00:05<00:00,  4.48it/s]
[I 2025-04-19 12:08:07,812] Using an existing study with name 'GAT' instead of creating a new one.
Done!
0it [00:00, ?it/s]1it [04:05, 245.50s/it]2it [08:02, 240.69s/it]3it [12:03, 240.77s/it]4it [16:05, 241.06s/it]5it [20:07, 241.37s/it]5it [20:07, 241.42s/it]
[I 2025-04-19 12:28:17,489] Trial 5 finished with values: [0.6891817984324197, 0.6800514969691119, 0.5667145527627454, 0.6313417161306557] and parameters: {'dropout1': 0.1, 'dropout2': 0.45000000000000007, 'hidden1': 929, 'hidden2': 446, 'hidden3': 45, 'epochs': 700, 'heads': 6, 'activation': 'gelu', 'optimizer': 'AdamW', 'lr': 0.006475175365917727, 'weight_decay': 0.0024318438653983046, 'scheduler': 'Cosine', 'T_max': 318}.
Using device: cuda
Best model found at epoch 700
Using device: cuda
Best model found at epoch 700
Using device: cuda
Best model found at epoch 700
Using device: cuda
Best model found at epoch 700
Using device: cuda
Best model found at epoch 700
ACC_mean: 0.6313
ACC_std: 0.0559
F1_mean: 0.5667
F1_std: 0.1571
AUROC_mean: 0.6892
AUROC_std: 0.0600
AUPR_mean: 0.6801
AUPR_std: 0.0616
0it [00:00, ?it/s]1it [18:12, 1092.32s/it]2it [36:45, 1104.62s/it]3it [55:16, 1107.50s/it]4it [1:13:58, 1113.10s/it]5it [1:32:47, 1119.07s/it]5it [1:32:47, 1113.56s/it]
[I 2025-04-19 14:01:06,764] Trial 9 finished with values: [0.7252762826261886, 0.7163616509227388, 0.6379799261705559, 0.6633252582690684] and parameters: {'dropout1': 0.15000000000000002, 'dropout2': 0.5, 'hidden1': 825, 'hidden2': 317, 'hidden3': 78, 'epochs': 3700, 'heads': 3, 'activation': 'gelu', 'optimizer': 'AdamW', 'lr': 2.1588499571372436e-05, 'weight_decay': 0.0003371199760465471, 'scheduler': 'Cosine', 'T_max': 1554}.
Using device: cuda
Best model found at epoch 3700
Using device: cuda
Best model found at epoch 3700
Using device: cuda
Best model found at epoch 3700
Using device: cuda
Best model found at epoch 3700
Using device: cuda
Best model found at epoch 3700
ACC_mean: 0.6633
ACC_std: 0.0046
F1_mean: 0.6380
F1_std: 0.0094
AUROC_mean: 0.7253
AUROC_std: 0.0022
AUPR_mean: 0.7164
AUPR_std: 0.0012
0it [00:00, ?it/s]1it [42:40, 2560.24s/it]2it [1:25:11, 2555.11s/it]3it [2:08:00, 2561.37s/it]4it [2:50:59, 2568.20s/it]5it [3:34:18, 2579.26s/it]5it [3:34:18, 2571.64s/it]
[I 2025-04-19 17:35:27,225] Trial 19 finished with values: [0.7277041089611826, 0.7207539386173678, 0.6390391722419067, 0.664197725586729] and parameters: {'dropout1': 0.5, 'dropout2': 0.1, 'hidden1': 562, 'hidden2': 230, 'hidden3': 52, 'epochs': 8400, 'heads': 5, 'activation': 'gelu', 'optimizer': 'Adam', 'lr': 0.0001069973533366749, 'weight_decay': 0.002460469770153113, 'scheduler': 'Cosine', 'T_max': 2500}.
Using device: cuda
Best model found at epoch 8400
Using device: cuda
Best model found at epoch 8400
Using device: cuda
Best model found at epoch 8400
Using device: cuda
Best model found at epoch 8400
Using device: cuda
Best model found at epoch 8400
ACC_mean: 0.6642
ACC_std: 0.0049
F1_mean: 0.6390
F1_std: 0.0136
AUROC_mean: 0.7277
AUROC_std: 0.0020
AUPR_mean: 0.7208
AUPR_std: 0.0017
0it [00:00, ?it/s]1it [35:06, 2106.69s/it]2it [1:10:09, 2104.34s/it]3it [1:45:08, 2101.87s/it]4it [2:20:35, 2111.78s/it]5it [2:56:07, 2119.29s/it]5it [2:56:07, 2113.58s/it]
[I 2025-04-19 20:31:36,938] Trial 38 finished with values: [0.5, 0.5, 0.0, 0.5] and parameters: {'dropout1': 0.1, 'dropout2': 0.30000000000000004, 'hidden1': 890, 'hidden2': 207, 'hidden3': 105, 'epochs': 6700, 'heads': 6, 'activation': 'gelu', 'optimizer': 'Adam', 'lr': 0.006136402573030231, 'weight_decay': 0.004531439710155097, 'scheduler': None}.
Using device: cuda
Best model found at epoch 6700
Using device: cuda
Best model found at epoch 6700
Using device: cuda
Best model found at epoch 6700
Using device: cuda
Best model found at epoch 6700
Using device: cuda
Best model found at epoch 6700
ACC_mean: 0.5000
ACC_std: 0.0000
F1_mean: 0.0000
F1_std: 0.0000
AUROC_mean: 0.5000
AUROC_std: 0.0000
AUPR_mean: 0.5000
AUPR_std: 0.0000
0it [00:00, ?it/s]1it [50:50, 3050.43s/it]2it [1:41:43, 3051.97s/it]3it [2:32:49, 3058.39s/it]4it [3:24:24, 3072.67s/it]5it [4:16:16, 3087.04s/it]5it [4:16:16, 3075.32s/it]
[I 2025-04-20 00:47:55,501] Trial 52 finished with values: [0.7222695027942476, 0.7133026844239406, 0.6439027700971005, 0.660856634155558] and parameters: {'dropout1': 0.35, 'dropout2': 0.25, 'hidden1': 280, 'hidden2': 209, 'hidden3': 155, 'epochs': 8900, 'heads': 7, 'activation': 'relu', 'optimizer': 'Adam', 'lr': 0.00011133917227532192, 'weight_decay': 0.0009824446725382456, 'scheduler': None}.
Using device: cuda
Best model found at epoch 8900
Using device: cuda
Best model found at epoch 8900
Using device: cuda
Best model found at epoch 8900
Using device: cuda
Best model found at epoch 8900
Using device: cuda
Best model found at epoch 8900
ACC_mean: 0.6609
ACC_std: 0.0039
F1_mean: 0.6439
F1_std: 0.0130
AUROC_mean: 0.7223
AUROC_std: 0.0019
AUPR_mean: 0.7133
AUPR_std: 0.0019
0it [00:00, ?it/s]1it [08:07, 487.11s/it]2it [16:16, 488.44s/it]3it [24:29, 490.75s/it]4it [32:43, 491.67s/it]5it [40:55, 491.79s/it]5it [40:55, 491.01s/it]
[I 2025-04-20 01:28:52,254] Trial 77 finished with values: [0.6870294198859161, 0.6743806090122059, 0.626423378117738, 0.6340743663875571] and parameters: {'dropout1': 0.4, 'dropout2': 0.1, 'hidden1': 679, 'hidden2': 137, 'hidden3': 95, 'epochs': 1700, 'heads': 2, 'activation': 'relu', 'optimizer': 'Adam', 'lr': 0.004494761682820952, 'weight_decay': 1.2709685428193883e-05, 'scheduler': None}.
Using device: cuda
Best model found at epoch 1700
Using device: cuda
Best model found at epoch 1700
Using device: cuda
Best model found at epoch 1700
Using device: cuda
Best model found at epoch 1700
Using device: cuda
Best model found at epoch 1700
ACC_mean: 0.6341
ACC_std: 0.0458
F1_mean: 0.6264
F1_std: 0.0254
AUROC_mean: 0.6870
AUROC_std: 0.0566
AUPR_mean: 0.6744
AUPR_std: 0.0571
0it [00:00, ?it/s]1it [39:08, 2348.86s/it]2it [1:18:43, 2364.08s/it]3it [1:58:21, 2370.58s/it]4it [2:38:46, 2391.99s/it]5it [3:18:54, 2397.65s/it]5it [3:18:54, 2386.88s/it]
[I 2025-04-20 04:47:48,603] Trial 79 finished with values: [0.7261990237406709, 0.717283932065847, 0.6244403990259203, 0.6603369194639298] and parameters: {'dropout1': 0.35, 'dropout2': 0.25, 'hidden1': 550, 'hidden2': 153, 'hidden3': 122, 'epochs': 7500, 'heads': 5, 'activation': 'relu', 'optimizer': 'Adam', 'lr': 0.00011133917227532192, 'weight_decay': 0.0009824446725382456, 'scheduler': None}.
Using device: cuda
Best model found at epoch 7500
Using device: cuda
Best model found at epoch 7500
Using device: cuda
Best model found at epoch 7500
Using device: cuda
Best model found at epoch 7500
Using device: cuda
Best model found at epoch 7500
ACC_mean: 0.6603
ACC_std: 0.0040
F1_mean: 0.6244
F1_std: 0.0130
AUROC_mean: 0.7262
AUROC_std: 0.0020
AUPR_mean: 0.7173
AUPR_std: 0.0011
0it [00:00, ?it/s]1it [46:30, 2790.29s/it]2it [1:32:20, 2766.95s/it]3it [2:18:15, 2761.34s/it]4it [3:02:01, 2708.05s/it]5it [3:46:23, 2691.45s/it]5it [3:46:23, 2716.79s/it]
[I 2025-04-20 08:34:14,681] Trial 99 finished with values: [0.5765992188640892, 0.5611766067521705, 0.15362243626996266, 0.5240022275849266] and parameters: {'dropout1': 0.25, 'dropout2': 0.1, 'hidden1': 497, 'hidden2': 274, 'hidden3': 137, 'epochs': 7800, 'heads': 7, 'activation': 'gelu', 'optimizer': 'Adam', 'lr': 0.004370398499200365, 'weight_decay': 0.003943078712087763, 'scheduler': None}.
Using device: cuda
Best model found at epoch 7800
Using device: cuda
Best model found at epoch 7800
Using device: cuda
Best model found at epoch 7800
Using device: cuda
Best model found at epoch 7800
Using device: cuda
Best model found at epoch 7800
ACC_mean: 0.5240
ACC_std: 0.0343
F1_mean: 0.1536
F1_std: 0.2132
AUROC_mean: 0.5766
AUROC_std: 0.0704
AUPR_mean: 0.5612
AUPR_std: 0.0586
0it [00:00, ?it/s]1it [18:36, 1116.64s/it]2it [37:28, 1125.43s/it]3it [57:01, 1147.49s/it]4it [1:16:38, 1158.81s/it]5it [1:36:13, 1164.67s/it]5it [1:36:13, 1154.64s/it]
[I 2025-04-20 10:10:30,202] Trial 122 finished with values: [0.708757588144698, 0.7008897969670194, 0.618628942532556, 0.647604829410736] and parameters: {'dropout1': 0.1, 'dropout2': 0.15000000000000002, 'hidden1': 442, 'hidden2': 78, 'hidden3': 49, 'epochs': 3800, 'heads': 7, 'activation': 'relu', 'optimizer': 'Adam', 'lr': 0.0023575519005312223, 'weight_decay': 0.002714287381963854, 'scheduler': 'Cosine', 'T_max': 825}.
[W 2025-04-20 10:10:30,738] Trial 128 failed with parameters: {} because of the following error: ValueError('setting an array element with a sequence. The requested array has an inhomogeneous shape after 1 dimensions. The detected shape was (104,) + inhomogeneous part.').
Traceback (most recent call last):
  File "/panfs/jay/groups/33/kuangr/inoue019/conda-envs/myenv/lib/python3.10/site-packages/optuna/study/_optimize.py", line 197, in _run_trial
    value_or_values = func(trial)
  File "/users/4/inoue019/drGAT/zero_pad/t_small_GAT.py", line 40, in objective
    "dropout1": trial.suggest_float("dropout1", 0.1, 0.5, step=0.05),
  File "/panfs/jay/groups/33/kuangr/inoue019/conda-envs/myenv/lib/python3.10/site-packages/optuna/trial/_trial.py", line 161, in suggest_float
    suggested_value = self._suggest(name, distribution)
  File "/panfs/jay/groups/33/kuangr/inoue019/conda-envs/myenv/lib/python3.10/site-packages/optuna/trial/_trial.py", line 627, in _suggest
    elif self._is_relative_param(name, distribution):
  File "/panfs/jay/groups/33/kuangr/inoue019/conda-envs/myenv/lib/python3.10/site-packages/optuna/trial/_trial.py", line 659, in _is_relative_param
    if name not in self.relative_params:
  File "/panfs/jay/groups/33/kuangr/inoue019/conda-envs/myenv/lib/python3.10/site-packages/optuna/trial/_trial.py", line 71, in relative_params
    self._relative_params = self.study.sampler.sample_relative(
  File "/panfs/jay/groups/33/kuangr/inoue019/conda-envs/myenv/lib/python3.10/site-packages/optuna/samplers/nsgaii/_sampler.py", line 269, in sample_relative
    parent_population = self.get_parent_population(study, generation)
  File "/panfs/jay/groups/33/kuangr/inoue019/conda-envs/myenv/lib/python3.10/site-packages/optuna/samplers/_ga/_base.py", line 176, in get_parent_population
    parent_population = self.select_parent(study, generation)
  File "/panfs/jay/groups/33/kuangr/inoue019/conda-envs/myenv/lib/python3.10/site-packages/optuna/samplers/nsgaii/_sampler.py", line 256, in select_parent
    return self._elite_population_selection_strategy(
  File "/panfs/jay/groups/33/kuangr/inoue019/conda-envs/myenv/lib/python3.10/site-packages/optuna/samplers/nsgaii/_elite_population_selection_strategy.py", line 47, in __call__
    population_per_rank = _rank_population(
  File "/panfs/jay/groups/33/kuangr/inoue019/conda-envs/myenv/lib/python3.10/site-packages/optuna/samplers/nsgaii/_elite_population_selection_strategy.py", line 126, in _rank_population
    objective_values = np.array([trial.values for trial in population], dtype=np.float64)
ValueError: setting an array element with a sequence. The requested array has an inhomogeneous shape after 1 dimensions. The detected shape was (104,) + inhomogeneous part.
[W 2025-04-20 10:10:31,255] Trial 128 failed with value None.
Using device: cuda
Best model found at epoch 3800
Using device: cuda
Best model found at epoch 3800
Using device: cuda
Best model found at epoch 3800
Using device: cuda
Best model found at epoch 3800
Using device: cuda
Best model found at epoch 3800
ACC_mean: 0.6476
ACC_std: 0.0285
F1_mean: 0.6186
F1_std: 0.0253
AUROC_mean: 0.7088
AUROC_std: 0.0362
AUPR_mean: 0.7009
AUPR_std: 0.0382
Traceback (most recent call last):
  File "/users/4/inoue019/drGAT/zero_pad/t_small_GAT.py", line 162, in <module>
    study.optimize(objective, n_trials=1000)
  File "/panfs/jay/groups/33/kuangr/inoue019/conda-envs/myenv/lib/python3.10/site-packages/optuna/study/study.py", line 475, in optimize
    _optimize(
  File "/panfs/jay/groups/33/kuangr/inoue019/conda-envs/myenv/lib/python3.10/site-packages/optuna/study/_optimize.py", line 63, in _optimize
    _optimize_sequential(
  File "/panfs/jay/groups/33/kuangr/inoue019/conda-envs/myenv/lib/python3.10/site-packages/optuna/study/_optimize.py", line 160, in _optimize_sequential
    frozen_trial = _run_trial(study, func, catch)
  File "/panfs/jay/groups/33/kuangr/inoue019/conda-envs/myenv/lib/python3.10/site-packages/optuna/study/_optimize.py", line 248, in _run_trial
    raise func_err
  File "/panfs/jay/groups/33/kuangr/inoue019/conda-envs/myenv/lib/python3.10/site-packages/optuna/study/_optimize.py", line 197, in _run_trial
    value_or_values = func(trial)
  File "/users/4/inoue019/drGAT/zero_pad/t_small_GAT.py", line 40, in objective
    "dropout1": trial.suggest_float("dropout1", 0.1, 0.5, step=0.05),
  File "/panfs/jay/groups/33/kuangr/inoue019/conda-envs/myenv/lib/python3.10/site-packages/optuna/trial/_trial.py", line 161, in suggest_float
    suggested_value = self._suggest(name, distribution)
  File "/panfs/jay/groups/33/kuangr/inoue019/conda-envs/myenv/lib/python3.10/site-packages/optuna/trial/_trial.py", line 627, in _suggest
    elif self._is_relative_param(name, distribution):
  File "/panfs/jay/groups/33/kuangr/inoue019/conda-envs/myenv/lib/python3.10/site-packages/optuna/trial/_trial.py", line 659, in _is_relative_param
    if name not in self.relative_params:
  File "/panfs/jay/groups/33/kuangr/inoue019/conda-envs/myenv/lib/python3.10/site-packages/optuna/trial/_trial.py", line 71, in relative_params
    self._relative_params = self.study.sampler.sample_relative(
  File "/panfs/jay/groups/33/kuangr/inoue019/conda-envs/myenv/lib/python3.10/site-packages/optuna/samplers/nsgaii/_sampler.py", line 269, in sample_relative
    parent_population = self.get_parent_population(study, generation)
  File "/panfs/jay/groups/33/kuangr/inoue019/conda-envs/myenv/lib/python3.10/site-packages/optuna/samplers/_ga/_base.py", line 176, in get_parent_population
    parent_population = self.select_parent(study, generation)
  File "/panfs/jay/groups/33/kuangr/inoue019/conda-envs/myenv/lib/python3.10/site-packages/optuna/samplers/nsgaii/_sampler.py", line 256, in select_parent
    return self._elite_population_selection_strategy(
  File "/panfs/jay/groups/33/kuangr/inoue019/conda-envs/myenv/lib/python3.10/site-packages/optuna/samplers/nsgaii/_elite_population_selection_strategy.py", line 47, in __call__
    population_per_rank = _rank_population(
  File "/panfs/jay/groups/33/kuangr/inoue019/conda-envs/myenv/lib/python3.10/site-packages/optuna/samplers/nsgaii/_elite_population_selection_strategy.py", line 126, in _rank_population
    objective_values = np.array([trial.values for trial in population], dtype=np.float64)
ValueError: setting an array element with a sequence. The requested array has an inhomogeneous shape after 1 dimensions. The detected shape was (104,) + inhomogeneous part.
