Not a conda environment: /scratch.global/inoue019/myenv
load nci
unique drugs: 177
unique genes: 251
DTI unique genes:  251
Top 90% variable genes:  2383
Total:  2582
Final gene exp shape: (60, 2582)
Final drug Act shape: (1005, 60)
  0%|          | 0/25 [00:00<?, ?it/s]  4%|▍         | 1/25 [00:02<00:52,  2.20s/it]  8%|▊         | 2/25 [00:02<00:23,  1.01s/it] 12%|█▏        | 3/25 [00:02<00:13,  1.60it/s] 16%|█▌        | 4/25 [00:03<00:11,  1.77it/s] 20%|██        | 5/25 [00:03<00:08,  2.32it/s] 24%|██▍       | 6/25 [00:03<00:06,  2.99it/s] 28%|██▊       | 7/25 [00:03<00:04,  3.61it/s] 32%|███▏      | 8/25 [00:03<00:04,  4.20it/s] 36%|███▌      | 9/25 [00:03<00:03,  4.43it/s] 40%|████      | 10/25 [00:04<00:03,  4.61it/s] 44%|████▍     | 11/25 [00:04<00:02,  4.93it/s] 48%|████▊     | 12/25 [00:04<00:02,  5.00it/s] 52%|█████▏    | 13/25 [00:04<00:02,  5.07it/s] 56%|█████▌    | 14/25 [00:04<00:02,  5.10it/s] 60%|██████    | 15/25 [00:04<00:01,  5.23it/s] 64%|██████▍   | 16/25 [00:05<00:01,  5.47it/s] 68%|██████▊   | 17/25 [00:05<00:01,  5.61it/s] 72%|███████▏  | 18/25 [00:05<00:01,  5.94it/s] 76%|███████▌  | 19/25 [00:05<00:00,  6.10it/s] 80%|████████  | 20/25 [00:05<00:00,  5.83it/s] 84%|████████▍ | 21/25 [00:05<00:00,  5.87it/s] 88%|████████▊ | 22/25 [00:06<00:00,  5.91it/s] 92%|█████████▏| 23/25 [00:06<00:00,  6.01it/s] 96%|█████████▌| 24/25 [00:06<00:00,  6.35it/s]100%|██████████| 25/25 [00:06<00:00,  6.22it/s]100%|██████████| 25/25 [00:06<00:00,  3.78it/s]
[I 2025-04-19 12:03:05,171] A new study created in RDB with name: GAT
Done!
0it [00:00, ?it/s]1it [31:51, 1911.25s/it]2it [1:03:18, 1896.95s/it]3it [1:34:46, 1893.17s/it]4it [2:06:20, 1893.33s/it]5it [2:37:39, 1888.32s/it]5it [2:37:39, 1891.97s/it]
[I 2025-04-19 14:40:47,161] Trial 0 finished with values: [0.5, 0.5, 0.0, 0.5] and parameters: {'dropout1': 0.35, 'dropout2': 0.2, 'hidden1': 896, 'hidden2': 500, 'hidden3': 249, 'epochs': 7500, 'heads': 3, 'activation': 'relu', 'optimizer': 'Adam', 'lr': 0.006585790517508706, 'weight_decay': 0.005692929738606352, 'scheduler': 'Cosine', 'T_max': 2616}.
Using device: cuda
Best model found at epoch 7500
Using device: cuda
Best model found at epoch 7500
Using device: cuda
Best model found at epoch 7500
Using device: cuda
Best model found at epoch 7500
Using device: cuda
Best model found at epoch 7500
ACC_mean: 0.5000
ACC_std: 0.0000
F1_mean: 0.0000
F1_std: 0.0000
AUROC_mean: 0.5000
AUROC_std: 0.0000
AUPR_mean: 0.5000
AUPR_std: 0.0000
0it [00:00, ?it/s]1it [28:39, 1719.01s/it]2it [57:48, 1737.18s/it]3it [1:27:25, 1755.23s/it]4it [1:56:31, 1751.69s/it]5it [2:26:20, 1765.05s/it]5it [2:26:20, 1756.12s/it]
[I 2025-04-19 17:07:09,237] Trial 21 finished with values: [0.7061911300907262, 0.6968326428803301, 0.624459714299358, 0.649533328950928] and parameters: {'dropout1': 0.1, 'dropout2': 0.2, 'hidden1': 741, 'hidden2': 156, 'hidden3': 37, 'epochs': 7600, 'heads': 6, 'activation': 'relu', 'optimizer': 'Adam', 'lr': 0.0025998860239908467, 'weight_decay': 8.324341864928246e-06, 'scheduler': 'Cosine', 'T_max': 1798}.
Using device: cuda
Best model found at epoch 7600
Using device: cuda
Best model found at epoch 7600
Using device: cuda
Best model found at epoch 7600
Using device: cuda
Best model found at epoch 7600
Using device: cuda
Best model found at epoch 7600
ACC_mean: 0.6495
ACC_std: 0.0221
F1_mean: 0.6245
F1_std: 0.0287
AUROC_mean: 0.7062
AUROC_std: 0.0258
AUPR_mean: 0.6968
AUPR_std: 0.0264
0it [00:00, ?it/s]1it [27:28, 1648.15s/it]2it [54:36, 1636.42s/it]3it [1:21:49, 1635.07s/it]4it [1:49:05, 1635.17s/it]5it [2:15:13, 1610.93s/it]5it [2:15:13, 1622.62s/it]
[I 2025-04-19 19:22:24,300] Trial 37 finished with values: [0.7226811805810253, 0.711973274742351, 0.6128292995234492, 0.653767328589035] and parameters: {'dropout1': 0.4, 'dropout2': 0.1, 'hidden1': 266, 'hidden2': 104, 'hidden3': 44, 'epochs': 7300, 'heads': 4, 'activation': 'gelu', 'optimizer': 'Adam', 'lr': 0.0004538207464496907, 'weight_decay': 0.0011552040499760736, 'scheduler': 'Cosine', 'T_max': 2048}.
Using device: cuda
Best model found at epoch 7300
Using device: cuda
Best model found at epoch 7300
Using device: cuda
Best model found at epoch 7300
Using device: cuda
Best model found at epoch 7300
Using device: cuda
Best model found at epoch 7300
ACC_mean: 0.6538
ACC_std: 0.0229
F1_mean: 0.6128
F1_std: 0.0798
AUROC_mean: 0.7227
AUROC_std: 0.0057
AUPR_mean: 0.7120
AUPR_std: 0.0075
0it [00:00, ?it/s]1it [14:27, 867.98s/it]2it [28:56, 868.09s/it]3it [43:26, 869.06s/it]4it [57:54, 868.52s/it]5it [1:12:23, 868.75s/it]5it [1:12:23, 868.64s/it]
[I 2025-04-19 20:34:49,379] Trial 49 finished with values: [0.7161509692758774, 0.7067038736291554, 0.6439200047129864, 0.6587220065242716] and parameters: {'dropout1': 0.4, 'dropout2': 0.35, 'hidden1': 562, 'hidden2': 181, 'hidden3': 170, 'epochs': 3500, 'heads': 5, 'activation': 'relu', 'optimizer': 'Adam', 'lr': 0.001354467551711223, 'weight_decay': 3.992832247553223e-06, 'scheduler': None}.
Using device: cuda
Best model found at epoch 3500
Using device: cuda
Best model found at epoch 3500
Using device: cuda
Best model found at epoch 3500
Using device: cuda
Best model found at epoch 3500
Using device: cuda
Best model found at epoch 3500
ACC_mean: 0.6587
ACC_std: 0.0040
F1_mean: 0.6439
F1_std: 0.0064
AUROC_mean: 0.7162
AUROC_std: 0.0044
AUPR_mean: 0.7067
AUPR_std: 0.0037
0it [00:00, ?it/s]1it [20:43, 1243.43s/it]2it [41:35, 1248.79s/it]3it [1:02:36, 1254.17s/it]4it [1:23:23, 1251.45s/it]5it [1:44:49, 1263.74s/it]5it [1:44:49, 1257.87s/it]
[I 2025-04-19 22:19:40,522] Trial 53 finished with values: [0.7099871087684528, 0.6998122785299168, 0.5541995115132673, 0.6370073566529667] and parameters: {'dropout1': 0.5, 'dropout2': 0.30000000000000004, 'hidden1': 371, 'hidden2': 173, 'hidden3': 133, 'epochs': 5700, 'heads': 3, 'activation': 'relu', 'optimizer': 'Adam', 'lr': 0.0021198517459151815, 'weight_decay': 0.00015561048917765537, 'scheduler': 'Cosine', 'T_max': 2620}.
Using device: cuda
Best model found at epoch 5700
Using device: cuda
Best model found at epoch 5700
Using device: cuda
Best model found at epoch 5700
Using device: cuda
Best model found at epoch 5700
Using device: cuda
Best model found at epoch 5700
ACC_mean: 0.6370
ACC_std: 0.0533
F1_mean: 0.5542
F1_std: 0.1888
AUROC_mean: 0.7100
AUROC_std: 0.0263
AUPR_mean: 0.6998
AUPR_std: 0.0280
0it [00:00, ?it/s]1it [35:04, 2104.79s/it]2it [1:11:43, 2160.06s/it]3it [1:53:21, 2314.45s/it]4it [2:32:38, 2331.05s/it]5it [3:10:45, 2315.45s/it]5it [3:10:45, 2289.20s/it]
[I 2025-04-20 01:30:28,322] Trial 66 finished with values: [0.7053065334525119, 0.6956785875779473, 0.631370085318858, 0.6492917833068665] and parameters: {'dropout1': 0.2, 'dropout2': 0.5, 'hidden1': 569, 'hidden2': 92, 'hidden3': 59, 'epochs': 9500, 'heads': 6, 'activation': 'relu', 'optimizer': 'AdamW', 'lr': 0.0023575519005312223, 'weight_decay': 0.002714287381963854, 'scheduler': None}.
Using device: cuda
Best model found at epoch 9500
Using device: cuda
Best model found at epoch 9500
Using device: cuda
Best model found at epoch 9500
Using device: cuda
Best model found at epoch 9500
Using device: cuda
Best model found at epoch 9500
ACC_mean: 0.6493
ACC_std: 0.0291
F1_mean: 0.6314
F1_std: 0.0358
AUROC_mean: 0.7053
AUROC_std: 0.0372
AUPR_mean: 0.6957
AUPR_std: 0.0378
0it [00:00, ?it/s]1it [37:17, 2237.20s/it]2it [1:13:17, 2192.15s/it]3it [1:48:48, 2164.04s/it]4it [2:26:34, 2204.37s/it]5it [3:07:16, 2290.05s/it]5it [3:07:16, 2247.32s/it]
[I 2025-04-20 04:37:46,740] Trial 80 finished with values: [0.6614370225332674, 0.6441704641738204, 0.541226979127173, 0.6015521639229088] and parameters: {'dropout1': 0.25, 'dropout2': 0.5, 'hidden1': 679, 'hidden2': 124, 'hidden3': 44, 'epochs': 8400, 'heads': 8, 'activation': 'gelu', 'optimizer': 'Adam', 'lr': 0.002459172432071324, 'weight_decay': 0.00010425555396446954, 'scheduler': None}.
Using device: cuda
Best model found at epoch 8400
Using device: cuda
Best model found at epoch 8400
Using device: cuda
Best model found at epoch 8400
Using device: cuda
Best model found at epoch 8400
Using device: cuda
Best model found at epoch 8400
ACC_mean: 0.6016
ACC_std: 0.0511
F1_mean: 0.5412
F1_std: 0.1620
AUROC_mean: 0.6614
AUROC_std: 0.0451
AUPR_mean: 0.6442
AUPR_std: 0.0549
0it [00:00, ?it/s]1it [07:09, 429.65s/it]2it [14:15, 427.40s/it]3it [21:00, 417.14s/it]4it [27:54, 415.78s/it]5it [34:55, 417.90s/it]5it [34:55, 419.15s/it]
[I 2025-04-20 05:12:44,390] Trial 98 finished with values: [0.7248838920792934, 0.7155732895935161, 0.6544098477679416, 0.6643090393726049] and parameters: {'dropout1': 0.25, 'dropout2': 0.45000000000000007, 'hidden1': 567, 'hidden2': 417, 'hidden3': 89, 'epochs': 1400, 'heads': 3, 'activation': 'gelu', 'optimizer': 'AdamW', 'lr': 0.00026233854610656484, 'weight_decay': 1.5005362223903923e-05, 'scheduler': None}.
Using device: cuda
Best model found at epoch 1400
Using device: cuda
Best model found at epoch 1400
Using device: cuda
Best model found at epoch 1400
Using device: cuda
Best model found at epoch 1400
Using device: cuda
Best model found at epoch 1400
ACC_mean: 0.6643
ACC_std: 0.0043
F1_mean: 0.6544
F1_std: 0.0170
AUROC_mean: 0.7249
AUROC_std: 0.0024
AUPR_mean: 0.7156
AUPR_std: 0.0025
0it [00:00, ?it/s]1it [39:11, 2351.62s/it]2it [1:12:09, 2131.53s/it]3it [1:48:14, 2146.80s/it]4it [2:25:26, 2180.75s/it]5it [3:04:27, 2238.28s/it]5it [3:04:27, 2213.43s/it]
[I 2025-04-20 08:17:13,397] Trial 101 finished with values: [0.7253290356277785, 0.7159265868993845, 0.6483840058741415, 0.6650886355270579] and parameters: {'dropout1': 0.35, 'dropout2': 0.5, 'hidden1': 280, 'hidden2': 232, 'hidden3': 111, 'epochs': 8900, 'heads': 3, 'activation': 'relu', 'optimizer': 'Adam', 'lr': 2.1588499571372436e-05, 'weight_decay': 0.0009824446725382456, 'scheduler': 'Cosine', 'T_max': 4164}.
Using device: cuda
Best model found at epoch 8900
Using device: cuda
Best model found at epoch 8900
Using device: cuda
Best model found at epoch 8900
Using device: cuda
Best model found at epoch 8900
Using device: cuda
Best model found at epoch 8900
ACC_mean: 0.6651
ACC_std: 0.0038
F1_mean: 0.6484
F1_std: 0.0067
AUROC_mean: 0.7253
AUROC_std: 0.0023
AUPR_mean: 0.7159
AUPR_std: 0.0021
0it [00:00, ?it/s]1it [09:20, 560.79s/it]2it [18:35, 557.31s/it]3it [28:10, 565.09s/it]4it [37:55, 573.28s/it]5it [47:37, 576.21s/it]5it [47:37, 571.45s/it]
[I 2025-04-20 09:04:52,290] Trial 121 finished with values: [0.652045787759508, 0.639050090380952, 0.40289524835911655, 0.5921105333594072] and parameters: {'dropout1': 0.4, 'dropout2': 0.25, 'hidden1': 555, 'hidden2': 84, 'hidden3': 80, 'epochs': 2200, 'heads': 3, 'activation': 'relu', 'optimizer': 'Adam', 'lr': 0.004182166110082852, 'weight_decay': 8.814928064510283e-05, 'scheduler': 'Cosine', 'T_max': 777}.
[W 2025-04-20 09:04:52,766] Trial 125 failed with parameters: {} because of the following error: ValueError('setting an array element with a sequence. The requested array has an inhomogeneous shape after 1 dimensions. The detected shape was (101,) + inhomogeneous part.').
Traceback (most recent call last):
  File "/panfs/jay/groups/33/kuangr/inoue019/conda-envs/myenv/lib/python3.10/site-packages/optuna/study/_optimize.py", line 197, in _run_trial
    value_or_values = func(trial)
  File "/users/4/inoue019/drGAT/zero_pad/t_small_GAT.py", line 40, in objective
    "dropout1": trial.suggest_float("dropout1", 0.1, 0.5, step=0.05),
  File "/panfs/jay/groups/33/kuangr/inoue019/conda-envs/myenv/lib/python3.10/site-packages/optuna/trial/_trial.py", line 161, in suggest_float
    suggested_value = self._suggest(name, distribution)
  File "/panfs/jay/groups/33/kuangr/inoue019/conda-envs/myenv/lib/python3.10/site-packages/optuna/trial/_trial.py", line 627, in _suggest
    elif self._is_relative_param(name, distribution):
  File "/panfs/jay/groups/33/kuangr/inoue019/conda-envs/myenv/lib/python3.10/site-packages/optuna/trial/_trial.py", line 659, in _is_relative_param
    if name not in self.relative_params:
  File "/panfs/jay/groups/33/kuangr/inoue019/conda-envs/myenv/lib/python3.10/site-packages/optuna/trial/_trial.py", line 71, in relative_params
    self._relative_params = self.study.sampler.sample_relative(
  File "/panfs/jay/groups/33/kuangr/inoue019/conda-envs/myenv/lib/python3.10/site-packages/optuna/samplers/nsgaii/_sampler.py", line 269, in sample_relative
    parent_population = self.get_parent_population(study, generation)
  File "/panfs/jay/groups/33/kuangr/inoue019/conda-envs/myenv/lib/python3.10/site-packages/optuna/samplers/_ga/_base.py", line 176, in get_parent_population
    parent_population = self.select_parent(study, generation)
  File "/panfs/jay/groups/33/kuangr/inoue019/conda-envs/myenv/lib/python3.10/site-packages/optuna/samplers/nsgaii/_sampler.py", line 256, in select_parent
    return self._elite_population_selection_strategy(
  File "/panfs/jay/groups/33/kuangr/inoue019/conda-envs/myenv/lib/python3.10/site-packages/optuna/samplers/nsgaii/_elite_population_selection_strategy.py", line 47, in __call__
    population_per_rank = _rank_population(
  File "/panfs/jay/groups/33/kuangr/inoue019/conda-envs/myenv/lib/python3.10/site-packages/optuna/samplers/nsgaii/_elite_population_selection_strategy.py", line 126, in _rank_population
    objective_values = np.array([trial.values for trial in population], dtype=np.float64)
ValueError: setting an array element with a sequence. The requested array has an inhomogeneous shape after 1 dimensions. The detected shape was (101,) + inhomogeneous part.
[W 2025-04-20 09:04:52,806] Trial 125 failed with value None.
Using device: cuda
Best model found at epoch 2200
Using device: cuda
Best model found at epoch 2200
Using device: cuda
Best model found at epoch 2200
Using device: cuda
Best model found at epoch 2200
Using device: cuda
Best model found at epoch 2200
ACC_mean: 0.5921
ACC_std: 0.0829
F1_mean: 0.4029
F1_std: 0.3441
AUROC_mean: 0.6520
AUROC_std: 0.0863
AUPR_mean: 0.6391
AUPR_std: 0.0896
Traceback (most recent call last):
  File "/users/4/inoue019/drGAT/zero_pad/t_small_GAT.py", line 162, in <module>
    study.optimize(objective, n_trials=1000)
  File "/panfs/jay/groups/33/kuangr/inoue019/conda-envs/myenv/lib/python3.10/site-packages/optuna/study/study.py", line 475, in optimize
    _optimize(
  File "/panfs/jay/groups/33/kuangr/inoue019/conda-envs/myenv/lib/python3.10/site-packages/optuna/study/_optimize.py", line 63, in _optimize
    _optimize_sequential(
  File "/panfs/jay/groups/33/kuangr/inoue019/conda-envs/myenv/lib/python3.10/site-packages/optuna/study/_optimize.py", line 160, in _optimize_sequential
    frozen_trial = _run_trial(study, func, catch)
  File "/panfs/jay/groups/33/kuangr/inoue019/conda-envs/myenv/lib/python3.10/site-packages/optuna/study/_optimize.py", line 248, in _run_trial
    raise func_err
  File "/panfs/jay/groups/33/kuangr/inoue019/conda-envs/myenv/lib/python3.10/site-packages/optuna/study/_optimize.py", line 197, in _run_trial
    value_or_values = func(trial)
  File "/users/4/inoue019/drGAT/zero_pad/t_small_GAT.py", line 40, in objective
    "dropout1": trial.suggest_float("dropout1", 0.1, 0.5, step=0.05),
  File "/panfs/jay/groups/33/kuangr/inoue019/conda-envs/myenv/lib/python3.10/site-packages/optuna/trial/_trial.py", line 161, in suggest_float
    suggested_value = self._suggest(name, distribution)
  File "/panfs/jay/groups/33/kuangr/inoue019/conda-envs/myenv/lib/python3.10/site-packages/optuna/trial/_trial.py", line 627, in _suggest
    elif self._is_relative_param(name, distribution):
  File "/panfs/jay/groups/33/kuangr/inoue019/conda-envs/myenv/lib/python3.10/site-packages/optuna/trial/_trial.py", line 659, in _is_relative_param
    if name not in self.relative_params:
  File "/panfs/jay/groups/33/kuangr/inoue019/conda-envs/myenv/lib/python3.10/site-packages/optuna/trial/_trial.py", line 71, in relative_params
    self._relative_params = self.study.sampler.sample_relative(
  File "/panfs/jay/groups/33/kuangr/inoue019/conda-envs/myenv/lib/python3.10/site-packages/optuna/samplers/nsgaii/_sampler.py", line 269, in sample_relative
    parent_population = self.get_parent_population(study, generation)
  File "/panfs/jay/groups/33/kuangr/inoue019/conda-envs/myenv/lib/python3.10/site-packages/optuna/samplers/_ga/_base.py", line 176, in get_parent_population
    parent_population = self.select_parent(study, generation)
  File "/panfs/jay/groups/33/kuangr/inoue019/conda-envs/myenv/lib/python3.10/site-packages/optuna/samplers/nsgaii/_sampler.py", line 256, in select_parent
    return self._elite_population_selection_strategy(
  File "/panfs/jay/groups/33/kuangr/inoue019/conda-envs/myenv/lib/python3.10/site-packages/optuna/samplers/nsgaii/_elite_population_selection_strategy.py", line 47, in __call__
    population_per_rank = _rank_population(
  File "/panfs/jay/groups/33/kuangr/inoue019/conda-envs/myenv/lib/python3.10/site-packages/optuna/samplers/nsgaii/_elite_population_selection_strategy.py", line 126, in _rank_population
    objective_values = np.array([trial.values for trial in population], dtype=np.float64)
ValueError: setting an array element with a sequence. The requested array has an inhomogeneous shape after 1 dimensions. The detected shape was (101,) + inhomogeneous part.
