Not a conda environment: /scratch.global/inoue019/myenv
load nci
unique drugs: 177
unique genes: 251
DTI unique genes:  251
Top 90% variable genes:  2383
Total:  2582
Final gene exp shape: (60, 2582)
Final drug Act shape: (1005, 60)
  0%|          | 0/25 [00:00<?, ?it/s]  4%|▍         | 1/25 [00:04<01:51,  4.65s/it]  8%|▊         | 2/25 [00:04<00:46,  2.02s/it] 12%|█▏        | 3/25 [00:05<00:26,  1.18s/it] 16%|█▌        | 4/25 [00:05<00:16,  1.27it/s] 20%|██        | 5/25 [00:05<00:11,  1.79it/s] 24%|██▍       | 6/25 [00:05<00:08,  2.34it/s] 28%|██▊       | 7/25 [00:05<00:06,  2.88it/s] 32%|███▏      | 8/25 [00:05<00:04,  3.42it/s] 36%|███▌      | 9/25 [00:06<00:04,  3.85it/s] 40%|████      | 10/25 [00:06<00:03,  4.25it/s] 44%|████▍     | 11/25 [00:06<00:03,  4.66it/s] 48%|████▊     | 12/25 [00:06<00:02,  5.02it/s] 52%|█████▏    | 13/25 [00:06<00:02,  4.69it/s] 56%|█████▌    | 14/25 [00:07<00:02,  4.95it/s] 60%|██████    | 15/25 [00:07<00:01,  5.17it/s] 64%|██████▍   | 16/25 [00:07<00:01,  5.37it/s] 68%|██████▊   | 17/25 [00:07<00:01,  5.56it/s] 72%|███████▏  | 18/25 [00:07<00:01,  5.83it/s] 76%|███████▌  | 19/25 [00:07<00:00,  6.21it/s] 80%|████████  | 20/25 [00:07<00:00,  5.84it/s] 84%|████████▍ | 21/25 [00:08<00:00,  5.29it/s] 88%|████████▊ | 22/25 [00:08<00:00,  5.40it/s] 92%|█████████▏| 23/25 [00:08<00:00,  5.52it/s] 96%|█████████▌| 24/25 [00:08<00:00,  5.13it/s]100%|██████████| 25/25 [00:08<00:00,  5.43it/s]100%|██████████| 25/25 [00:08<00:00,  2.79it/s]
[I 2025-04-19 12:29:25,646] Using an existing study with name 'GAT' instead of creating a new one.
Done!
0it [00:00, ?it/s]1it [03:42, 222.01s/it]2it [06:50, 202.24s/it]3it [09:59, 196.18s/it]4it [13:14, 195.73s/it]5it [16:23, 193.29s/it]5it [16:23, 196.68s/it]
[I 2025-04-19 12:45:53,273] Trial 11 finished with values: [0.6637380942667959, 0.6485885278719112, 0.6025983798108572, 0.6104802744212641] and parameters: {'dropout1': 0.5, 'dropout2': 0.30000000000000004, 'hidden1': 555, 'hidden2': 150, 'hidden3': 67, 'epochs': 900, 'heads': 2, 'activation': 'relu', 'optimizer': 'AdamW', 'lr': 8.208215563160652e-05, 'weight_decay': 8.814928064510283e-05, 'scheduler': 'Cosine', 'T_max': 350}.
Using device: cuda
Best model found at epoch 900
Using device: cuda
Best model found at epoch 900
Using device: cuda
Best model found at epoch 900
Using device: cuda
Best model found at epoch 900
Using device: cuda
Best model found at epoch 900
ACC_mean: 0.6105
ACC_std: 0.0037
F1_mean: 0.6026
F1_std: 0.0476
AUROC_mean: 0.6637
AUROC_std: 0.0085
AUPR_mean: 0.6486
AUPR_std: 0.0138
0it [00:00, ?it/s]1it [36:23, 2183.81s/it]2it [1:12:49, 2184.66s/it]3it [1:49:05, 2181.01s/it]4it [2:26:32, 2206.83s/it]5it [3:03:53, 2219.26s/it]5it [3:03:53, 2206.69s/it]
[I 2025-04-19 15:49:48,687] Trial 13 finished with values: [0.6188691838277889, 0.5954521299781369, 0.4756386455039953, 0.5609570883960108] and parameters: {'dropout1': 0.5, 'dropout2': 0.35, 'hidden1': 838, 'hidden2': 298, 'hidden3': 41, 'epochs': 8100, 'heads': 7, 'activation': 'relu', 'optimizer': 'Adam', 'lr': 0.004749852639829944, 'weight_decay': 0.00017155899376188727, 'scheduler': None}.
Using device: cuda
Best model found at epoch 8100
Using device: cuda
Best model found at epoch 8100
Using device: cuda
Best model found at epoch 8100
Using device: cuda
Best model found at epoch 8100
Using device: cuda
Best model found at epoch 8100
ACC_mean: 0.5610
ACC_std: 0.0211
F1_mean: 0.4756
F1_std: 0.1615
AUROC_mean: 0.6189
AUROC_std: 0.0233
AUPR_mean: 0.5955
AUPR_std: 0.0280
0it [00:00, ?it/s]1it [33:43, 2023.00s/it]2it [1:08:03, 2044.77s/it]3it [1:42:20, 2050.68s/it]4it [2:16:07, 2041.24s/it]5it [2:49:42, 2031.75s/it]5it [2:49:42, 2036.48s/it]
[I 2025-04-19 18:39:33,426] Trial 30 finished with values: [0.7224559657414353, 0.7132507961004747, 0.650264943787225, 0.66315843746025] and parameters: {'dropout1': 0.2, 'dropout2': 0.5, 'hidden1': 442, 'hidden2': 99, 'hidden3': 65, 'epochs': 9500, 'heads': 2, 'activation': 'relu', 'optimizer': 'AdamW', 'lr': 0.0023575519005312223, 'weight_decay': 0.002714287381963854, 'scheduler': None}.
Using device: cuda
Best model found at epoch 9500
Using device: cuda
Best model found at epoch 9500
Using device: cuda
Best model found at epoch 9500
Using device: cuda
Best model found at epoch 9500
Using device: cuda
Best model found at epoch 9500
ACC_mean: 0.6632
ACC_std: 0.0032
F1_mean: 0.6503
F1_std: 0.0141
AUROC_mean: 0.7225
AUROC_std: 0.0042
AUPR_mean: 0.7133
AUPR_std: 0.0051
0it [00:00, ?it/s]1it [30:28, 1828.41s/it]2it [1:00:23, 1808.87s/it]3it [1:29:40, 1785.18s/it]4it [1:59:31, 1787.63s/it]5it [2:29:39, 1794.75s/it]5it [2:29:39, 1795.87s/it]
[I 2025-04-19 21:09:14,256] Trial 42 finished with values: [0.6804045189654995, 0.6650968274638008, 0.6418641984548503, 0.6194096596759031] and parameters: {'dropout1': 0.4, 'dropout2': 0.1, 'hidden1': 679, 'hidden2': 78, 'hidden3': 61, 'epochs': 8800, 'heads': 2, 'activation': 'gelu', 'optimizer': 'Adam', 'lr': 0.004494761682820952, 'weight_decay': 1.2709685428193883e-05, 'scheduler': None}.
Using device: cuda
Best model found at epoch 8800
Using device: cuda
Best model found at epoch 8800
Using device: cuda
Best model found at epoch 8800
Using device: cuda
Best model found at epoch 8800
Using device: cuda
Best model found at epoch 8800
ACC_mean: 0.6194
ACC_std: 0.0458
F1_mean: 0.6419
F1_std: 0.0623
AUROC_mean: 0.6804
AUROC_std: 0.0629
AUPR_mean: 0.6651
AUPR_std: 0.0702
0it [00:00, ?it/s]1it [00:47, 47.28s/it]2it [01:33, 46.90s/it]3it [02:20, 46.75s/it]4it [03:06, 46.61s/it]5it [03:53, 46.61s/it]5it [03:53, 46.70s/it]
[I 2025-04-19 21:13:09,482] Trial 55 finished with values: [0.6904825622595385, 0.6766191274666629, 0.6412511857434163, 0.6310855417969157] and parameters: {'dropout1': 0.25, 'dropout2': 0.5, 'hidden1': 932, 'hidden2': 114, 'hidden3': 101, 'epochs': 200, 'heads': 5, 'activation': 'relu', 'optimizer': 'AdamW', 'lr': 0.005133383513006333, 'weight_decay': 5.214655965809262e-05, 'scheduler': None}.
Using device: cuda
Best model found at epoch 200
Using device: cuda
Best model found at epoch 200
Using device: cuda
Best model found at epoch 200
Using device: cuda
Best model found at epoch 200
Using device: cuda
Best model found at epoch 200
ACC_mean: 0.6311
ACC_std: 0.0412
F1_mean: 0.6413
F1_std: 0.0226
AUROC_mean: 0.6905
AUROC_std: 0.0357
AUPR_mean: 0.6766
AUPR_std: 0.0417
0it [00:00, ?it/s]1it [34:50, 2090.41s/it]2it [1:09:14, 2074.76s/it]3it [1:43:47, 2074.21s/it]4it [2:18:15, 2071.49s/it]5it [2:53:04, 2077.99s/it]5it [2:53:04, 2076.92s/it]
[I 2025-04-20 00:06:15,865] Trial 56 finished with values: [0.7148762618129196, 0.7066438291403527, 0.6316247408914245, 0.6551762994831105] and parameters: {'dropout1': 0.15000000000000002, 'dropout2': 0.4, 'hidden1': 1001, 'hidden2': 310, 'hidden3': 191, 'epochs': 7100, 'heads': 6, 'activation': 'gelu', 'optimizer': 'AdamW', 'lr': 0.00014509432511672476, 'weight_decay': 0.0011726171236195859, 'scheduler': 'Cosine', 'T_max': 1651}.
Using device: cuda
Best model found at epoch 7100
Using device: cuda
Best model found at epoch 7100
Using device: cuda
Best model found at epoch 7100
Using device: cuda
Best model found at epoch 7100
Using device: cuda
Best model found at epoch 7100
ACC_mean: 0.6552
ACC_std: 0.0086
F1_mean: 0.6316
F1_std: 0.0144
AUROC_mean: 0.7149
AUROC_std: 0.0062
AUPR_mean: 0.7066
AUPR_std: 0.0057
0it [00:00, ?it/s]1it [35:58, 2158.82s/it]2it [1:12:13, 2168.00s/it]3it [1:48:35, 2174.60s/it]4it [2:23:50, 2151.04s/it]5it [2:58:37, 2127.93s/it]5it [2:58:37, 2143.52s/it]
[I 2025-04-20 03:04:55,331] Trial 71 finished with values: [0.6327304165250088, 0.608492401166821, 0.3700542967240503, 0.5628530782056778] and parameters: {'dropout1': 0.4, 'dropout2': 0.35, 'hidden1': 687, 'hidden2': 132, 'hidden3': 77, 'epochs': 9800, 'heads': 3, 'activation': 'gelu', 'optimizer': 'Adam', 'lr': 0.00014307843166680805, 'weight_decay': 0.009374599709041599, 'scheduler': None}.
Using device: cuda
Best model found at epoch 9800
Using device: cuda
Best model found at epoch 9800
Using device: cuda
Best model found at epoch 9800
Using device: cuda
Best model found at epoch 9800
Using device: cuda
Best model found at epoch 9800
ACC_mean: 0.5629
ACC_std: 0.0409
F1_mean: 0.3701
F1_std: 0.1792
AUROC_mean: 0.6327
AUROC_std: 0.0301
AUPR_mean: 0.6085
AUPR_std: 0.0279
0it [00:00, ?it/s]1it [29:28, 1768.75s/it]2it [59:35, 1791.16s/it]3it [1:29:30, 1793.06s/it]4it [1:59:10, 1787.56s/it]5it [2:28:53, 1786.14s/it]5it [2:28:53, 1786.73s/it]
[I 2025-04-20 05:33:50,970] Trial 88 finished with values: [0.7205195920999246, 0.7123299384522573, 0.6401627194820387, 0.6603553104072895] and parameters: {'dropout1': 0.15000000000000002, 'dropout2': 0.45000000000000007, 'hidden1': 791, 'hidden2': 163, 'hidden3': 61, 'epochs': 7100, 'heads': 8, 'activation': 'gelu', 'optimizer': 'AdamW', 'lr': 3.092589555013167e-05, 'weight_decay': 0.003804050662289661, 'scheduler': 'Cosine', 'T_max': 2282}.
Using device: cuda
Best model found at epoch 7100
Using device: cuda
Best model found at epoch 7100
Using device: cuda
Best model found at epoch 7100
Using device: cuda
Best model found at epoch 7100
Using device: cuda
Best model found at epoch 7100
ACC_mean: 0.6604
ACC_std: 0.0044
F1_mean: 0.6402
F1_std: 0.0045
AUROC_mean: 0.7205
AUROC_std: 0.0023
AUPR_mean: 0.7123
AUPR_std: 0.0013
0it [00:00, ?it/s]1it [14:49, 889.28s/it]2it [29:50, 896.23s/it]3it [44:34, 890.56s/it]4it [59:24, 890.35s/it]5it [1:14:40, 899.69s/it]5it [1:14:40, 896.09s/it]
[I 2025-04-20 06:48:33,638] Trial 102 finished with values: [0.7062455291018782, 0.698076734782726, 0.6437432316538614, 0.6427603214260071] and parameters: {'dropout1': 0.1, 'dropout2': 0.25, 'hidden1': 587, 'hidden2': 339, 'hidden3': 104, 'epochs': 4100, 'heads': 2, 'activation': 'relu', 'optimizer': 'AdamW', 'lr': 0.000244151152435166, 'weight_decay': 0.0017890049445786124, 'scheduler': None}.
Using device: cuda
Best model found at epoch 4100
Using device: cuda
Best model found at epoch 4100
Using device: cuda
Best model found at epoch 4100
Using device: cuda
Best model found at epoch 4100
Using device: cuda
Best model found at epoch 4100
ACC_mean: 0.6428
ACC_std: 0.0284
F1_mean: 0.6437
F1_std: 0.0197
AUROC_mean: 0.7062
AUROC_std: 0.0224
AUPR_mean: 0.6981
AUPR_std: 0.0235
0it [00:00, ?it/s]1it [06:21, 381.04s/it]2it [12:41, 380.45s/it]3it [19:02, 381.03s/it]4it [25:26, 382.12s/it]5it [31:46, 381.43s/it]5it [31:46, 381.36s/it]
[I 2025-04-20 07:20:22,717] Trial 106 finished with values: [0.6632285426221415, 0.6459962310390226, 0.575351800871962, 0.6101088965723388] and parameters: {'dropout1': 0.35, 'dropout2': 0.5, 'hidden1': 791, 'hidden2': 74, 'hidden3': 51, 'epochs': 1700, 'heads': 3, 'activation': 'gelu', 'optimizer': 'AdamW', 'lr': 1.365297505671502e-05, 'weight_decay': 0.000421621905922159, 'scheduler': 'Cosine', 'T_max': 531}.
Using device: cuda
Best model found at epoch 1700
Using device: cuda
Best model found at epoch 1700
Using device: cuda
Best model found at epoch 1700
Using device: cuda
Best model found at epoch 1700
Using device: cuda
Best model found at epoch 1700
ACC_mean: 0.6101
ACC_std: 0.0112
F1_mean: 0.5754
F1_std: 0.0351
AUROC_mean: 0.6632
AUROC_std: 0.0159
AUPR_mean: 0.6460
AUPR_std: 0.0170
0it [00:00, ?it/s]1it [09:23, 563.54s/it]2it [18:44, 562.29s/it]3it [28:07, 562.29s/it]4it [37:28, 561.86s/it]5it [46:49, 561.67s/it]5it [46:49, 561.96s/it]
[I 2025-04-20 08:07:14,270] Trial 114 finished with values: [0.718454486303248, 0.7072471587231317, 0.6454746078821281, 0.6610051329267619] and parameters: {'dropout1': 0.30000000000000004, 'dropout2': 0.35, 'hidden1': 827, 'hidden2': 149, 'hidden3': 83, 'epochs': 2400, 'heads': 4, 'activation': 'relu', 'optimizer': 'AdamW', 'lr': 0.0030995654267651903, 'weight_decay': 0.0004835483114346653, 'scheduler': 'Cosine', 'T_max': 964}.
Using device: cuda
Best model found at epoch 2400
Using device: cuda
Best model found at epoch 2400
Using device: cuda
Best model found at epoch 2400
Using device: cuda
Best model found at epoch 2400
Using device: cuda
Best model found at epoch 2400
ACC_mean: 0.6610
ACC_std: 0.0042
F1_mean: 0.6455
F1_std: 0.0068
AUROC_mean: 0.7185
AUROC_std: 0.0050
AUPR_mean: 0.7072
AUPR_std: 0.0071
0it [00:00, ?it/s]1it [29:47, 1787.32s/it]2it [59:34, 1787.35s/it]3it [1:28:13, 1755.86s/it]4it [1:57:02, 1745.55s/it]5it [2:25:50, 1738.96s/it]5it [2:25:50, 1750.02s/it]
[I 2025-04-20 10:33:06,219] Trial 119 finished with values: [0.7228292361258523, 0.7125752997897457, 0.6397846067699555, 0.6609680754170624] and parameters: {'dropout1': 0.4, 'dropout2': 0.4, 'hidden1': 562, 'hidden2': 172, 'hidden3': 58, 'epochs': 7700, 'heads': 5, 'activation': 'relu', 'optimizer': 'AdamW', 'lr': 1.0995859503397373e-05, 'weight_decay': 3.992832247553223e-06, 'scheduler': None}.
[W 2025-04-20 10:33:06,624] Trial 131 failed with parameters: {} because of the following error: ValueError('setting an array element with a sequence. The requested array has an inhomogeneous shape after 1 dimensions. The detected shape was (107,) + inhomogeneous part.').
Traceback (most recent call last):
  File "/panfs/jay/groups/33/kuangr/inoue019/conda-envs/myenv/lib/python3.10/site-packages/optuna/study/_optimize.py", line 197, in _run_trial
    value_or_values = func(trial)
  File "/users/4/inoue019/drGAT/zero_pad/t_small_GAT.py", line 40, in objective
    "dropout1": trial.suggest_float("dropout1", 0.1, 0.5, step=0.05),
  File "/panfs/jay/groups/33/kuangr/inoue019/conda-envs/myenv/lib/python3.10/site-packages/optuna/trial/_trial.py", line 161, in suggest_float
    suggested_value = self._suggest(name, distribution)
  File "/panfs/jay/groups/33/kuangr/inoue019/conda-envs/myenv/lib/python3.10/site-packages/optuna/trial/_trial.py", line 627, in _suggest
    elif self._is_relative_param(name, distribution):
  File "/panfs/jay/groups/33/kuangr/inoue019/conda-envs/myenv/lib/python3.10/site-packages/optuna/trial/_trial.py", line 659, in _is_relative_param
    if name not in self.relative_params:
  File "/panfs/jay/groups/33/kuangr/inoue019/conda-envs/myenv/lib/python3.10/site-packages/optuna/trial/_trial.py", line 71, in relative_params
    self._relative_params = self.study.sampler.sample_relative(
  File "/panfs/jay/groups/33/kuangr/inoue019/conda-envs/myenv/lib/python3.10/site-packages/optuna/samplers/nsgaii/_sampler.py", line 269, in sample_relative
    parent_population = self.get_parent_population(study, generation)
  File "/panfs/jay/groups/33/kuangr/inoue019/conda-envs/myenv/lib/python3.10/site-packages/optuna/samplers/_ga/_base.py", line 176, in get_parent_population
    parent_population = self.select_parent(study, generation)
  File "/panfs/jay/groups/33/kuangr/inoue019/conda-envs/myenv/lib/python3.10/site-packages/optuna/samplers/nsgaii/_sampler.py", line 256, in select_parent
    return self._elite_population_selection_strategy(
  File "/panfs/jay/groups/33/kuangr/inoue019/conda-envs/myenv/lib/python3.10/site-packages/optuna/samplers/nsgaii/_elite_population_selection_strategy.py", line 47, in __call__
    population_per_rank = _rank_population(
  File "/panfs/jay/groups/33/kuangr/inoue019/conda-envs/myenv/lib/python3.10/site-packages/optuna/samplers/nsgaii/_elite_population_selection_strategy.py", line 126, in _rank_population
    objective_values = np.array([trial.values for trial in population], dtype=np.float64)
ValueError: setting an array element with a sequence. The requested array has an inhomogeneous shape after 1 dimensions. The detected shape was (107,) + inhomogeneous part.
[W 2025-04-20 10:33:06,649] Trial 131 failed with value None.
Using device: cuda
Best model found at epoch 7700
Using device: cuda
Best model found at epoch 7700
Using device: cuda
Best model found at epoch 7700
Using device: cuda
Best model found at epoch 7700
Using device: cuda
Best model found at epoch 7700
ACC_mean: 0.6610
ACC_std: 0.0032
F1_mean: 0.6398
F1_std: 0.0094
AUROC_mean: 0.7228
AUROC_std: 0.0033
AUPR_mean: 0.7126
AUPR_std: 0.0039
Traceback (most recent call last):
  File "/users/4/inoue019/drGAT/zero_pad/t_small_GAT.py", line 162, in <module>
    study.optimize(objective, n_trials=1000)
  File "/panfs/jay/groups/33/kuangr/inoue019/conda-envs/myenv/lib/python3.10/site-packages/optuna/study/study.py", line 475, in optimize
    _optimize(
  File "/panfs/jay/groups/33/kuangr/inoue019/conda-envs/myenv/lib/python3.10/site-packages/optuna/study/_optimize.py", line 63, in _optimize
    _optimize_sequential(
  File "/panfs/jay/groups/33/kuangr/inoue019/conda-envs/myenv/lib/python3.10/site-packages/optuna/study/_optimize.py", line 160, in _optimize_sequential
    frozen_trial = _run_trial(study, func, catch)
  File "/panfs/jay/groups/33/kuangr/inoue019/conda-envs/myenv/lib/python3.10/site-packages/optuna/study/_optimize.py", line 248, in _run_trial
    raise func_err
  File "/panfs/jay/groups/33/kuangr/inoue019/conda-envs/myenv/lib/python3.10/site-packages/optuna/study/_optimize.py", line 197, in _run_trial
    value_or_values = func(trial)
  File "/users/4/inoue019/drGAT/zero_pad/t_small_GAT.py", line 40, in objective
    "dropout1": trial.suggest_float("dropout1", 0.1, 0.5, step=0.05),
  File "/panfs/jay/groups/33/kuangr/inoue019/conda-envs/myenv/lib/python3.10/site-packages/optuna/trial/_trial.py", line 161, in suggest_float
    suggested_value = self._suggest(name, distribution)
  File "/panfs/jay/groups/33/kuangr/inoue019/conda-envs/myenv/lib/python3.10/site-packages/optuna/trial/_trial.py", line 627, in _suggest
    elif self._is_relative_param(name, distribution):
  File "/panfs/jay/groups/33/kuangr/inoue019/conda-envs/myenv/lib/python3.10/site-packages/optuna/trial/_trial.py", line 659, in _is_relative_param
    if name not in self.relative_params:
  File "/panfs/jay/groups/33/kuangr/inoue019/conda-envs/myenv/lib/python3.10/site-packages/optuna/trial/_trial.py", line 71, in relative_params
    self._relative_params = self.study.sampler.sample_relative(
  File "/panfs/jay/groups/33/kuangr/inoue019/conda-envs/myenv/lib/python3.10/site-packages/optuna/samplers/nsgaii/_sampler.py", line 269, in sample_relative
    parent_population = self.get_parent_population(study, generation)
  File "/panfs/jay/groups/33/kuangr/inoue019/conda-envs/myenv/lib/python3.10/site-packages/optuna/samplers/_ga/_base.py", line 176, in get_parent_population
    parent_population = self.select_parent(study, generation)
  File "/panfs/jay/groups/33/kuangr/inoue019/conda-envs/myenv/lib/python3.10/site-packages/optuna/samplers/nsgaii/_sampler.py", line 256, in select_parent
    return self._elite_population_selection_strategy(
  File "/panfs/jay/groups/33/kuangr/inoue019/conda-envs/myenv/lib/python3.10/site-packages/optuna/samplers/nsgaii/_elite_population_selection_strategy.py", line 47, in __call__
    population_per_rank = _rank_population(
  File "/panfs/jay/groups/33/kuangr/inoue019/conda-envs/myenv/lib/python3.10/site-packages/optuna/samplers/nsgaii/_elite_population_selection_strategy.py", line 126, in _rank_population
    objective_values = np.array([trial.values for trial in population], dtype=np.float64)
ValueError: setting an array element with a sequence. The requested array has an inhomogeneous shape after 1 dimensions. The detected shape was (107,) + inhomogeneous part.
