Not a conda environment: /scratch.global/inoue019/myenv
load nci
unique drugs: 177
unique genes: 251
DTI unique genes:  251
Top 90% variable genes:  2383
Total:  2582
Final gene exp shape: (60, 2582)
Final drug Act shape: (1005, 60)
  0%|          | 0/25 [00:00<?, ?it/s]  4%|▍         | 1/25 [00:01<00:46,  1.92s/it]  8%|▊         | 2/25 [00:02<00:20,  1.13it/s] 12%|█▏        | 3/25 [00:02<00:12,  1.83it/s] 16%|█▌        | 4/25 [00:02<00:08,  2.51it/s] 20%|██        | 5/25 [00:02<00:06,  3.20it/s] 24%|██▍       | 6/25 [00:02<00:05,  3.77it/s] 28%|██▊       | 7/25 [00:02<00:04,  4.25it/s] 32%|███▏      | 8/25 [00:03<00:03,  4.59it/s] 36%|███▌      | 9/25 [00:03<00:03,  4.97it/s] 40%|████      | 10/25 [00:03<00:02,  5.24it/s] 44%|████▍     | 11/25 [00:03<00:02,  5.31it/s] 48%|████▊     | 12/25 [00:03<00:02,  5.47it/s] 52%|█████▏    | 13/25 [00:03<00:02,  5.54it/s] 56%|█████▌    | 14/25 [00:04<00:01,  5.64it/s] 60%|██████    | 15/25 [00:04<00:01,  5.76it/s] 64%|██████▍   | 16/25 [00:04<00:01,  5.78it/s] 68%|██████▊   | 17/25 [00:04<00:01,  6.00it/s] 72%|███████▏  | 18/25 [00:04<00:01,  5.94it/s] 76%|███████▌  | 19/25 [00:04<00:01,  5.98it/s] 80%|████████  | 20/25 [00:05<00:00,  5.87it/s] 84%|████████▍ | 21/25 [00:05<00:00,  6.26it/s] 88%|████████▊ | 22/25 [00:05<00:00,  6.18it/s] 92%|█████████▏| 23/25 [00:05<00:00,  6.33it/s] 96%|█████████▌| 24/25 [00:05<00:00,  6.03it/s]100%|██████████| 25/25 [00:05<00:00,  6.02it/s]100%|██████████| 25/25 [00:05<00:00,  4.22it/s]
[I 2025-04-19 12:08:06,865] Using an existing study with name 'GAT' instead of creating a new one.
Done!
0it [00:00, ?it/s]1it [45:41, 2741.63s/it]2it [1:31:08, 2733.21s/it]3it [2:17:04, 2743.37s/it]4it [3:03:11, 2752.92s/it]5it [3:49:40, 2765.80s/it]5it [3:49:40, 2756.12s/it]
[I 2025-04-19 15:57:50,392] Trial 4 finished with values: [0.6381170915581087, 0.630954649931615, 0.47761709426450816, 0.5888386508585862] and parameters: {'dropout1': 0.30000000000000004, 'dropout2': 0.5, 'hidden1': 791, 'hidden2': 298, 'hidden3': 211, 'epochs': 8100, 'heads': 6, 'activation': 'relu', 'optimizer': 'Adam', 'lr': 0.0017381371795862056, 'weight_decay': 0.0008413685731788568, 'scheduler': None}.
Using device: cuda
Best model found at epoch 8100
Using device: cuda
Best model found at epoch 8100
Using device: cuda
Best model found at epoch 8100
Using device: cuda
Best model found at epoch 8100
Using device: cuda
Best model found at epoch 8100
ACC_mean: 0.5888
ACC_std: 0.0433
F1_mean: 0.4776
F1_std: 0.1361
AUROC_mean: 0.6381
AUROC_std: 0.0583
AUPR_mean: 0.6310
AUPR_std: 0.0535
0it [00:00, ?it/s]1it [46:41, 2801.25s/it]2it [1:32:18, 2763.33s/it]3it [2:17:41, 2744.94s/it]4it [3:02:54, 2732.62s/it]5it [3:48:01, 2723.33s/it]5it [3:48:01, 2736.34s/it]
[I 2025-04-19 19:45:53,729] Trial 32 finished with values: [0.722590661902527, 0.7120888645985278, 0.6449079903802887, 0.6619516566939382] and parameters: {'dropout1': 0.4, 'dropout2': 0.2, 'hidden1': 594, 'hidden2': 112, 'hidden3': 69, 'epochs': 9700, 'heads': 7, 'activation': 'gelu', 'optimizer': 'AdamW', 'lr': 4.468910739202678e-05, 'weight_decay': 1.244517306594985e-06, 'scheduler': 'Cosine', 'T_max': 2955}.
Using device: cuda
Best model found at epoch 9700
Using device: cuda
Best model found at epoch 9700
Using device: cuda
Best model found at epoch 9700
Using device: cuda
Best model found at epoch 9700
Using device: cuda
Best model found at epoch 9700
ACC_mean: 0.6620
ACC_std: 0.0040
F1_mean: 0.6449
F1_std: 0.0099
AUROC_mean: 0.7226
AUROC_std: 0.0032
AUPR_mean: 0.7121
AUPR_std: 0.0036
0it [00:00, ?it/s]1it [41:55, 2515.19s/it]2it [1:23:49, 2514.60s/it]3it [2:05:51, 2518.19s/it]4it [2:47:58, 2521.53s/it]5it [3:30:01, 2522.19s/it]5it [3:30:01, 2520.37s/it]
[I 2025-04-19 23:15:57,632] Trial 50 finished with values: [0.6940207891126123, 0.6807481457314246, 0.577411817960544, 0.6305997149507137] and parameters: {'dropout1': 0.25, 'dropout2': 0.5, 'hidden1': 522, 'hidden2': 226, 'hidden3': 171, 'epochs': 8400, 'heads': 5, 'activation': 'relu', 'optimizer': 'Adam', 'lr': 0.002459172432071324, 'weight_decay': 0.00010425555396446954, 'scheduler': 'Cosine', 'T_max': 3520}.
Using device: cuda
Best model found at epoch 8400
Using device: cuda
Best model found at epoch 8400
Using device: cuda
Best model found at epoch 8400
Using device: cuda
Best model found at epoch 8400
Using device: cuda
Best model found at epoch 8400
ACC_mean: 0.6306
ACC_std: 0.0296
F1_mean: 0.5774
F1_std: 0.0493
AUROC_mean: 0.6940
AUROC_std: 0.0323
AUPR_mean: 0.6807
AUPR_std: 0.0353
0it [00:00, ?it/s]1it [35:12, 2112.48s/it]2it [1:10:29, 2114.97s/it]3it [1:45:59, 2122.15s/it]4it [2:21:31, 2125.94s/it]5it [2:57:02, 2127.73s/it]5it [2:57:02, 2124.51s/it]
[I 2025-04-20 02:13:02,006] Trial 68 finished with values: [0.6307385916384558, 0.6104168948902298, 0.4173693505720233, 0.5636660729747671] and parameters: {'dropout1': 0.4, 'dropout2': 0.1, 'hidden1': 416, 'hidden2': 307, 'hidden3': 146, 'epochs': 6600, 'heads': 6, 'activation': 'relu', 'optimizer': 'Adam', 'lr': 0.007794623638437369, 'weight_decay': 0.00020095843519582924, 'scheduler': 'Cosine', 'T_max': 1809}.
Using device: cuda
Best model found at epoch 6600
Using device: cuda
Best model found at epoch 6600
Using device: cuda
Best model found at epoch 6600
Using device: cuda
Best model found at epoch 6600
Using device: cuda
Best model found at epoch 6600
ACC_mean: 0.5637
ACC_std: 0.0289
F1_mean: 0.4174
F1_std: 0.1338
AUROC_mean: 0.6307
AUROC_std: 0.0166
AUPR_mean: 0.6104
AUPR_std: 0.0304
0it [00:00, ?it/s]1it [16:05, 965.35s/it]2it [32:17, 969.57s/it]3it [48:32, 971.84s/it]4it [1:04:44, 972.02s/it]5it [1:20:49, 969.27s/it]5it [1:20:49, 969.82s/it]
[I 2025-04-20 03:33:52,683] Trial 84 finished with values: [0.7243545122082162, 0.7159984126522219, 0.6372719781250937, 0.6632139410379053] and parameters: {'dropout1': 0.15000000000000002, 'dropout2': 0.5, 'hidden1': 825, 'hidden2': 113, 'hidden3': 94, 'epochs': 3700, 'heads': 3, 'activation': 'gelu', 'optimizer': 'AdamW', 'lr': 2.1588499571372436e-05, 'weight_decay': 0.0003371199760465471, 'scheduler': 'Cosine', 'T_max': 1117}.
Using device: cuda
Best model found at epoch 3700
Using device: cuda
Best model found at epoch 3700
Using device: cuda
Best model found at epoch 3700
Using device: cuda
Best model found at epoch 3700
Using device: cuda
Best model found at epoch 3700
ACC_mean: 0.6632
ACC_std: 0.0051
F1_mean: 0.6373
F1_std: 0.0095
AUROC_mean: 0.7244
AUROC_std: 0.0030
AUPR_mean: 0.7160
AUPR_std: 0.0019
0it [00:00, ?it/s]1it [40:22, 2422.27s/it]2it [1:20:41, 2420.35s/it]3it [2:01:01, 2420.33s/it]4it [2:41:10, 2416.01s/it]5it [3:21:19, 2413.19s/it]5it [3:21:19, 2415.83s/it]
[I 2025-04-20 06:55:13,370] Trial 90 finished with values: [0.7255649016304969, 0.7165954294417253, 0.6458419155067163, 0.6631952365734055] and parameters: {'dropout1': 0.35, 'dropout2': 0.25, 'hidden1': 280, 'hidden2': 94, 'hidden3': 68, 'epochs': 8900, 'heads': 7, 'activation': 'relu', 'optimizer': 'Adam', 'lr': 0.00011133917227532192, 'weight_decay': 0.0009824446725382456, 'scheduler': None}.
Using device: cuda
Best model found at epoch 8900
Using device: cuda
Best model found at epoch 8900
Using device: cuda
Best model found at epoch 8900
Using device: cuda
Best model found at epoch 8900
Using device: cuda
Best model found at epoch 8900
ACC_mean: 0.6632
ACC_std: 0.0058
F1_mean: 0.6458
F1_std: 0.0196
AUROC_mean: 0.7256
AUROC_std: 0.0031
AUPR_mean: 0.7166
AUPR_std: 0.0019
0it [00:00, ?it/s]1it [14:45, 885.41s/it]2it [29:31, 886.05s/it]3it [44:18, 886.39s/it]4it [59:02, 885.43s/it]5it [1:13:46, 884.98s/it]5it [1:13:46, 885.37s/it]
[I 2025-04-20 08:09:02,041] Trial 109 finished with values: [0.7197951756718782, 0.7114295060592359, 0.6396114121163715, 0.6602807612816965] and parameters: {'dropout1': 0.1, 'dropout2': 0.5, 'hidden1': 859, 'hidden2': 150, 'hidden3': 96, 'epochs': 3400, 'heads': 3, 'activation': 'gelu', 'optimizer': 'AdamW', 'lr': 0.003884822088735253, 'weight_decay': 1.2961568664519867e-06, 'scheduler': 'Cosine', 'T_max': 702}.
Using device: cuda
Best model found at epoch 3400
Using device: cuda
Best model found at epoch 3400
Using device: cuda
Best model found at epoch 3400
Using device: cuda
Best model found at epoch 3400
Using device: cuda
Best model found at epoch 3400
ACC_mean: 0.6603
ACC_std: 0.0093
F1_mean: 0.6396
F1_std: 0.0112
AUROC_mean: 0.7198
AUROC_std: 0.0081
AUPR_mean: 0.7114
AUPR_std: 0.0090
0it [00:00, ?it/s]1it [10:56, 656.61s/it]2it [21:54, 657.62s/it]3it [32:52, 657.47s/it]4it [43:46, 656.30s/it]5it [54:39, 655.09s/it]5it [54:39, 655.93s/it]
[I 2025-04-20 09:03:43,522] Trial 120 finished with values: [0.7249206185766571, 0.7155827001392903, 0.6356065827121876, 0.6616916408649104] and parameters: {'dropout1': 0.45000000000000007, 'dropout2': 0.30000000000000004, 'hidden1': 636, 'hidden2': 495, 'hidden3': 212, 'epochs': 2400, 'heads': 2, 'activation': 'gelu', 'optimizer': 'AdamW', 'lr': 1.6791877274130407e-05, 'weight_decay': 0.00017799323213991196, 'scheduler': None}.
[W 2025-04-20 09:03:43,920] Trial 124 failed with parameters: {} because of the following error: ValueError('setting an array element with a sequence. The requested array has an inhomogeneous shape after 1 dimensions. The detected shape was (100,) + inhomogeneous part.').
Traceback (most recent call last):
  File "/panfs/jay/groups/33/kuangr/inoue019/conda-envs/myenv/lib/python3.10/site-packages/optuna/study/_optimize.py", line 197, in _run_trial
    value_or_values = func(trial)
  File "/users/4/inoue019/drGAT/zero_pad/t_small_GAT.py", line 40, in objective
    "dropout1": trial.suggest_float("dropout1", 0.1, 0.5, step=0.05),
  File "/panfs/jay/groups/33/kuangr/inoue019/conda-envs/myenv/lib/python3.10/site-packages/optuna/trial/_trial.py", line 161, in suggest_float
    suggested_value = self._suggest(name, distribution)
  File "/panfs/jay/groups/33/kuangr/inoue019/conda-envs/myenv/lib/python3.10/site-packages/optuna/trial/_trial.py", line 627, in _suggest
    elif self._is_relative_param(name, distribution):
  File "/panfs/jay/groups/33/kuangr/inoue019/conda-envs/myenv/lib/python3.10/site-packages/optuna/trial/_trial.py", line 659, in _is_relative_param
    if name not in self.relative_params:
  File "/panfs/jay/groups/33/kuangr/inoue019/conda-envs/myenv/lib/python3.10/site-packages/optuna/trial/_trial.py", line 71, in relative_params
    self._relative_params = self.study.sampler.sample_relative(
  File "/panfs/jay/groups/33/kuangr/inoue019/conda-envs/myenv/lib/python3.10/site-packages/optuna/samplers/nsgaii/_sampler.py", line 269, in sample_relative
    parent_population = self.get_parent_population(study, generation)
  File "/panfs/jay/groups/33/kuangr/inoue019/conda-envs/myenv/lib/python3.10/site-packages/optuna/samplers/_ga/_base.py", line 176, in get_parent_population
    parent_population = self.select_parent(study, generation)
  File "/panfs/jay/groups/33/kuangr/inoue019/conda-envs/myenv/lib/python3.10/site-packages/optuna/samplers/nsgaii/_sampler.py", line 256, in select_parent
    return self._elite_population_selection_strategy(
  File "/panfs/jay/groups/33/kuangr/inoue019/conda-envs/myenv/lib/python3.10/site-packages/optuna/samplers/nsgaii/_elite_population_selection_strategy.py", line 47, in __call__
    population_per_rank = _rank_population(
  File "/panfs/jay/groups/33/kuangr/inoue019/conda-envs/myenv/lib/python3.10/site-packages/optuna/samplers/nsgaii/_elite_population_selection_strategy.py", line 126, in _rank_population
    objective_values = np.array([trial.values for trial in population], dtype=np.float64)
ValueError: setting an array element with a sequence. The requested array has an inhomogeneous shape after 1 dimensions. The detected shape was (100,) + inhomogeneous part.
[W 2025-04-20 09:03:43,974] Trial 124 failed with value None.
Using device: cuda
Best model found at epoch 2400
Using device: cuda
Best model found at epoch 2400
Using device: cuda
Best model found at epoch 2400
Using device: cuda
Best model found at epoch 2400
Using device: cuda
Best model found at epoch 2400
ACC_mean: 0.6617
ACC_std: 0.0068
F1_mean: 0.6356
F1_std: 0.0265
AUROC_mean: 0.7249
AUROC_std: 0.0028
AUPR_mean: 0.7156
AUPR_std: 0.0057
Traceback (most recent call last):
  File "/users/4/inoue019/drGAT/zero_pad/t_small_GAT.py", line 162, in <module>
    study.optimize(objective, n_trials=1000)
  File "/panfs/jay/groups/33/kuangr/inoue019/conda-envs/myenv/lib/python3.10/site-packages/optuna/study/study.py", line 475, in optimize
    _optimize(
  File "/panfs/jay/groups/33/kuangr/inoue019/conda-envs/myenv/lib/python3.10/site-packages/optuna/study/_optimize.py", line 63, in _optimize
    _optimize_sequential(
  File "/panfs/jay/groups/33/kuangr/inoue019/conda-envs/myenv/lib/python3.10/site-packages/optuna/study/_optimize.py", line 160, in _optimize_sequential
    frozen_trial = _run_trial(study, func, catch)
  File "/panfs/jay/groups/33/kuangr/inoue019/conda-envs/myenv/lib/python3.10/site-packages/optuna/study/_optimize.py", line 248, in _run_trial
    raise func_err
  File "/panfs/jay/groups/33/kuangr/inoue019/conda-envs/myenv/lib/python3.10/site-packages/optuna/study/_optimize.py", line 197, in _run_trial
    value_or_values = func(trial)
  File "/users/4/inoue019/drGAT/zero_pad/t_small_GAT.py", line 40, in objective
    "dropout1": trial.suggest_float("dropout1", 0.1, 0.5, step=0.05),
  File "/panfs/jay/groups/33/kuangr/inoue019/conda-envs/myenv/lib/python3.10/site-packages/optuna/trial/_trial.py", line 161, in suggest_float
    suggested_value = self._suggest(name, distribution)
  File "/panfs/jay/groups/33/kuangr/inoue019/conda-envs/myenv/lib/python3.10/site-packages/optuna/trial/_trial.py", line 627, in _suggest
    elif self._is_relative_param(name, distribution):
  File "/panfs/jay/groups/33/kuangr/inoue019/conda-envs/myenv/lib/python3.10/site-packages/optuna/trial/_trial.py", line 659, in _is_relative_param
    if name not in self.relative_params:
  File "/panfs/jay/groups/33/kuangr/inoue019/conda-envs/myenv/lib/python3.10/site-packages/optuna/trial/_trial.py", line 71, in relative_params
    self._relative_params = self.study.sampler.sample_relative(
  File "/panfs/jay/groups/33/kuangr/inoue019/conda-envs/myenv/lib/python3.10/site-packages/optuna/samplers/nsgaii/_sampler.py", line 269, in sample_relative
    parent_population = self.get_parent_population(study, generation)
  File "/panfs/jay/groups/33/kuangr/inoue019/conda-envs/myenv/lib/python3.10/site-packages/optuna/samplers/_ga/_base.py", line 176, in get_parent_population
    parent_population = self.select_parent(study, generation)
  File "/panfs/jay/groups/33/kuangr/inoue019/conda-envs/myenv/lib/python3.10/site-packages/optuna/samplers/nsgaii/_sampler.py", line 256, in select_parent
    return self._elite_population_selection_strategy(
  File "/panfs/jay/groups/33/kuangr/inoue019/conda-envs/myenv/lib/python3.10/site-packages/optuna/samplers/nsgaii/_elite_population_selection_strategy.py", line 47, in __call__
    population_per_rank = _rank_population(
  File "/panfs/jay/groups/33/kuangr/inoue019/conda-envs/myenv/lib/python3.10/site-packages/optuna/samplers/nsgaii/_elite_population_selection_strategy.py", line 126, in _rank_population
    objective_values = np.array([trial.values for trial in population], dtype=np.float64)
ValueError: setting an array element with a sequence. The requested array has an inhomogeneous shape after 1 dimensions. The detected shape was (100,) + inhomogeneous part.
