Not a conda environment: /scratch.global/inoue019/myenv
load nci
unique drugs: 177
unique genes: 251
DTI unique genes:  251
Top 90% variable genes:  2383
Total:  2582
Final gene exp shape: (60, 2582)
Final drug Act shape: (1005, 60)
  0%|          | 0/25 [00:00<?, ?it/s]  4%|▍         | 1/25 [00:01<00:45,  1.90s/it]  8%|▊         | 2/25 [00:02<00:20,  1.15it/s] 12%|█▏        | 3/25 [00:02<00:11,  1.84it/s] 16%|█▌        | 4/25 [00:02<00:08,  2.58it/s] 20%|██        | 5/25 [00:02<00:06,  3.32it/s] 24%|██▍       | 6/25 [00:02<00:04,  4.04it/s] 28%|██▊       | 7/25 [00:02<00:03,  4.69it/s] 32%|███▏      | 8/25 [00:02<00:03,  5.13it/s] 36%|███▌      | 9/25 [00:03<00:02,  5.50it/s] 40%|████      | 10/25 [00:03<00:02,  5.66it/s] 44%|████▍     | 11/25 [00:03<00:02,  5.91it/s] 48%|████▊     | 12/25 [00:03<00:02,  6.15it/s] 52%|█████▏    | 13/25 [00:03<00:01,  6.28it/s] 56%|█████▌    | 14/25 [00:03<00:01,  6.63it/s] 60%|██████    | 15/25 [00:03<00:01,  6.77it/s] 64%|██████▍   | 16/25 [00:04<00:01,  6.84it/s] 68%|██████▊   | 17/25 [00:04<00:01,  6.92it/s] 72%|███████▏  | 18/25 [00:04<00:00,  7.15it/s] 76%|███████▌  | 19/25 [00:04<00:00,  7.08it/s] 80%|████████  | 20/25 [00:04<00:00,  6.79it/s] 84%|████████▍ | 21/25 [00:04<00:00,  6.67it/s] 88%|████████▊ | 22/25 [00:05<00:00,  6.72it/s] 92%|█████████▏| 23/25 [00:05<00:00,  6.92it/s] 96%|█████████▌| 24/25 [00:05<00:00,  7.08it/s]100%|██████████| 25/25 [00:05<00:00,  7.23it/s]100%|██████████| 25/25 [00:05<00:00,  4.63it/s]
[I 2025-04-19 12:08:07,804] Using an existing study with name 'Transformer' instead of creating a new one.
Done!
0it [00:00, ?it/s]1it [08:43, 523.69s/it]2it [17:11, 514.25s/it]3it [25:39, 511.26s/it]4it [34:07, 510.05s/it]5it [42:33, 508.70s/it]5it [42:33, 510.71s/it]
[I 2025-04-19 12:50:43,853] Trial 7 finished with values: [0.7169029562787944, 0.7080477673738771, 0.6394047400701576, 0.6569214408356668] and parameters: {'dropout1': 0.1, 'dropout2': 0.2, 'hidden1': 297, 'hidden2': 278, 'hidden3': 250, 'epochs': 1800, 'heads': 3, 'activation': 'gelu', 'optimizer': 'Adam', 'lr': 0.00030019045368629403, 'weight_decay': 1.4901554988318259e-05, 'scheduler': None}.
Using device: cuda
Best model found at epoch 1800
Using device: cuda
Best model found at epoch 1800
Using device: cuda
Best model found at epoch 1800
Using device: cuda
Best model found at epoch 1800
Using device: cuda
Best model found at epoch 1800
ACC_mean: 0.6569
ACC_std: 0.0036
F1_mean: 0.6394
F1_std: 0.0031
AUROC_mean: 0.7169
AUROC_std: 0.0022
AUPR_mean: 0.7080
AUPR_std: 0.0027
0it [00:00, ?it/s]1it [26:26, 1586.15s/it]2it [52:37, 1577.62s/it]3it [1:19:21, 1589.43s/it]4it [1:45:22, 1578.31s/it]5it [2:11:14, 1568.74s/it]5it [2:11:14, 1574.86s/it]
[I 2025-04-19 15:01:59,513] Trial 24 finished with values: [0.7118022570428281, 0.7005552494934413, 0.6122227619801969, 0.6505367688635334] and parameters: {'dropout1': 0.30000000000000004, 'dropout2': 0.2, 'hidden1': 516, 'hidden2': 468, 'hidden3': 227, 'epochs': 3200, 'heads': 8, 'activation': 'gelu', 'optimizer': 'Adam', 'lr': 0.0003649544059459485, 'weight_decay': 0.0021824992526710916, 'scheduler': None}.
Using device: cuda
Best model found at epoch 3200
Using device: cuda
Best model found at epoch 3200
Using device: cuda
Best model found at epoch 3200
Using device: cuda
Best model found at epoch 3200
Using device: cuda
Best model found at epoch 3200
ACC_mean: 0.6505
ACC_std: 0.0090
F1_mean: 0.6122
F1_std: 0.0306
AUROC_mean: 0.7118
AUROC_std: 0.0046
AUPR_mean: 0.7006
AUPR_std: 0.0071
0it [00:00, ?it/s]1it [06:18, 378.21s/it]2it [12:32, 375.73s/it]3it [18:46, 374.86s/it]4it [24:59, 374.44s/it]5it [31:16, 375.31s/it]5it [31:16, 375.33s/it]
[I 2025-04-19 15:33:17,680] Trial 39 finished with values: [0.711396443959049, 0.699150999228926, 0.6348771082043514, 0.6527265142003027] and parameters: {'dropout1': 0.25, 'dropout2': 0.5, 'hidden1': 774, 'hidden2': 228, 'hidden3': 42, 'epochs': 1600, 'heads': 2, 'activation': 'gelu', 'optimizer': 'AdamW', 'lr': 2.1975108978282648e-05, 'weight_decay': 4.448462178888289e-06, 'scheduler': 'Cosine', 'T_max': 537}.
Using device: cuda
Best model found at epoch 1600
Using device: cuda
Best model found at epoch 1600
Using device: cuda
Best model found at epoch 1600
Using device: cuda
Best model found at epoch 1600
Using device: cuda
Best model found at epoch 1600
ACC_mean: 0.6527
ACC_std: 0.0040
F1_mean: 0.6349
F1_std: 0.0070
AUROC_mean: 0.7114
AUROC_std: 0.0025
AUPR_mean: 0.6992
AUPR_std: 0.0026
0it [00:00, ?it/s]1it [48:21, 2901.20s/it]2it [1:36:33, 2896.16s/it]3it [2:24:50, 2896.19s/it]4it [3:12:49, 2889.56s/it]5it [4:01:16, 2895.95s/it]5it [4:01:16, 2895.35s/it]
[I 2025-04-19 19:34:36,133] Trial 44 finished with values: [0.7200270997028253, 0.7120668422834456, 0.630596074263791, 0.6584248815062355] and parameters: {'dropout1': 0.5, 'dropout2': 0.25, 'hidden1': 381, 'hidden2': 184, 'hidden3': 122, 'epochs': 9300, 'heads': 7, 'activation': 'gelu', 'optimizer': 'Adam', 'lr': 0.0003986050768324814, 'weight_decay': 3.427796893491514e-05, 'scheduler': None}.
Using device: cuda
Best model found at epoch 9300
Using device: cuda
Best model found at epoch 9300
Using device: cuda
Best model found at epoch 9300
Using device: cuda
Best model found at epoch 9300
Using device: cuda
Best model found at epoch 9300
ACC_mean: 0.6584
ACC_std: 0.0058
F1_mean: 0.6306
F1_std: 0.0182
AUROC_mean: 0.7200
AUROC_std: 0.0034
AUPR_mean: 0.7121
AUPR_std: 0.0029
0it [00:00, ?it/s]0it [00:07, ?it/s]
[I 2025-04-19 19:34:44,189] Trial 76 pruned. NaN input at trial 76
Using device: cuda
Pruned trial 76: Input contains NaN
0it [00:00, ?it/s]1it [06:06, 366.03s/it]2it [12:11, 365.76s/it]3it [18:17, 365.98s/it]4it [24:23, 365.68s/it]5it [30:29, 365.87s/it]5it [30:29, 365.86s/it]
[I 2025-04-19 20:05:15,196] Trial 77 finished with values: [0.7215279943099057, 0.7121535080861199, 0.6505566776055653, 0.6624158230191769] and parameters: {'dropout1': 0.25, 'dropout2': 0.30000000000000004, 'hidden1': 284, 'hidden2': 114, 'hidden3': 97, 'epochs': 1400, 'heads': 5, 'activation': 'relu', 'optimizer': 'AdamW', 'lr': 0.00019520588527227974, 'weight_decay': 1.24613302844022e-06, 'scheduler': 'Cosine', 'T_max': 430}.
Using device: cuda
Best model found at epoch 1400
Using device: cuda
Best model found at epoch 1400
Using device: cuda
Best model found at epoch 1400
Using device: cuda
Best model found at epoch 1400
Using device: cuda
Best model found at epoch 1400
ACC_mean: 0.6624
ACC_std: 0.0036
F1_mean: 0.6506
F1_std: 0.0052
AUROC_mean: 0.7215
AUROC_std: 0.0026
AUPR_mean: 0.7122
AUPR_std: 0.0025
0it [00:00, ?it/s]0it [01:36, ?it/s]
[I 2025-04-19 20:06:52,966] Trial 81 pruned. NaN input at trial 81
Using device: cuda
Pruned trial 81: Input contains NaN
0it [00:00, ?it/s]1it [1:11:52, 4312.97s/it]2it [2:23:44, 4312.39s/it]3it [3:35:41, 4314.14s/it]4it [4:48:07, 4326.65s/it]5it [6:00:49, 4339.73s/it]5it [6:00:49, 4329.99s/it]
[I 2025-04-20 02:07:45,017] Trial 82 finished with values: [0.7213458469209725, 0.7139031762904954, 0.6495797764317096, 0.6599469439544097] and parameters: {'dropout1': 0.35, 'dropout2': 0.25, 'hidden1': 956, 'hidden2': 475, 'hidden3': 121, 'epochs': 9400, 'heads': 8, 'activation': 'gelu', 'optimizer': 'Adam', 'lr': 2.2644748946401016e-05, 'weight_decay': 0.0023783628641380317, 'scheduler': 'Cosine', 'T_max': 4619}.
Using device: cuda
Best model found at epoch 9400
Using device: cuda
Best model found at epoch 9400
Using device: cuda
Best model found at epoch 9400
Using device: cuda
Best model found at epoch 9400
Using device: cuda
Best model found at epoch 9400
ACC_mean: 0.6599
ACC_std: 0.0048
F1_mean: 0.6496
F1_std: 0.0114
AUROC_mean: 0.7213
AUROC_std: 0.0021
AUPR_mean: 0.7139
AUPR_std: 0.0014
0it [00:00, ?it/s]1it [00:25, 25.58s/it]2it [00:50, 24.95s/it]3it [01:14, 24.75s/it]4it [01:39, 24.62s/it]5it [02:03, 24.53s/it]5it [02:03, 24.68s/it]
[I 2025-04-20 02:09:50,198] Trial 116 finished with values: [0.6661085070745256, 0.6444679121278789, 0.5805178346916084, 0.6141550005794973] and parameters: {'dropout1': 0.2, 'dropout2': 0.2, 'hidden1': 644, 'hidden2': 81, 'hidden3': 33, 'epochs': 100, 'heads': 3, 'activation': 'gelu', 'optimizer': 'AdamW', 'lr': 2.735699135644965e-05, 'weight_decay': 0.0010870935539262336, 'scheduler': None}.
Using device: cuda
Best model found at epoch 100
Using device: cuda
Best model found at epoch 100
Using device: cuda
Best model found at epoch 100
Using device: cuda
Best model found at epoch 100
Using device: cuda
Best model found at epoch 100
ACC_mean: 0.6142
ACC_std: 0.0096
F1_mean: 0.5805
F1_std: 0.0333
AUROC_mean: 0.6661
AUROC_std: 0.0066
AUPR_mean: 0.6445
AUPR_std: 0.0107
0it [00:00, ?it/s]1it [33:16, 1996.68s/it]2it [1:06:39, 2000.27s/it]3it [1:40:56, 2026.39s/it]4it [2:14:58, 2032.22s/it]5it [2:48:50, 2032.19s/it]5it [2:48:50, 2026.05s/it]
[I 2025-04-20 04:58:42,164] Trial 117 finished with values: [0.6958258234258352, 0.6852750190145, 0.6297625554650519, 0.6419594540680504] and parameters: {'dropout1': 0.25, 'dropout2': 0.25, 'hidden1': 835, 'hidden2': 307, 'hidden3': 135, 'epochs': 6300, 'heads': 5, 'activation': 'relu', 'optimizer': 'AdamW', 'lr': 0.0005413325217474958, 'weight_decay': 0.00015664511668515252, 'scheduler': None}.
Using device: cuda
Best model found at epoch 6300
Using device: cuda
Best model found at epoch 6300
Using device: cuda
Best model found at epoch 6300
Using device: cuda
Best model found at epoch 6300
Using device: cuda
Best model found at epoch 6300
ACC_mean: 0.6420
ACC_std: 0.0298
F1_mean: 0.6298
F1_std: 0.0231
AUROC_mean: 0.6958
AUROC_std: 0.0393
AUPR_mean: 0.6853
AUPR_std: 0.0425
0it [00:00, ?it/s]1it [23:37, 1417.69s/it]2it [47:03, 1410.62s/it]3it [1:10:40, 1413.47s/it]4it [1:34:24, 1417.69s/it]5it [1:57:45, 1411.70s/it]5it [1:57:45, 1413.09s/it]
[I 2025-04-20 06:56:29,238] Trial 143 finished with values: [0.6964303753556972, 0.6789538134888087, 0.6164171745991516, 0.6420531693266351] and parameters: {'dropout1': 0.1, 'dropout2': 0.30000000000000004, 'hidden1': 716, 'hidden2': 279, 'hidden3': 134, 'epochs': 5200, 'heads': 3, 'activation': 'gelu', 'optimizer': 'Adam', 'lr': 0.0033274466782711965, 'weight_decay': 0.0011045504514532371, 'scheduler': 'Cosine', 'T_max': 1677}.
Using device: cuda
Best model found at epoch 5200
Using device: cuda
Best model found at epoch 5200
Using device: cuda
Best model found at epoch 5200
Using device: cuda
Best model found at epoch 5200
Using device: cuda
Best model found at epoch 5200
ACC_mean: 0.6421
ACC_std: 0.0099
F1_mean: 0.6164
F1_std: 0.0201
AUROC_mean: 0.6964
AUROC_std: 0.0083
AUPR_mean: 0.6790
AUPR_std: 0.0051
0it [00:00, ?it/s]1it [51:16, 3076.64s/it]2it [1:42:04, 3059.45s/it]3it [2:33:27, 3070.31s/it]4it [3:24:53, 3076.70s/it]5it [4:14:23, 3037.99s/it]5it [4:14:23, 3052.63s/it]
[I 2025-04-20 11:10:54,037] Trial 152 finished with values: [0.7175290069351645, 0.7092625888613469, 0.6323381306804523, 0.6572740556502091] and parameters: {'dropout1': 0.25, 'dropout2': 0.25, 'hidden1': 381, 'hidden2': 303, 'hidden3': 34, 'epochs': 9300, 'heads': 7, 'activation': 'gelu', 'optimizer': 'Adam', 'lr': 0.0003986050768324814, 'weight_decay': 3.427796893491514e-05, 'scheduler': None}.
[W 2025-04-20 11:10:54,399] Trial 173 failed with parameters: {} because of the following error: ValueError('setting an array element with a sequence. The requested array has an inhomogeneous shape after 1 dimensions. The detected shape was (105,) + inhomogeneous part.').
Traceback (most recent call last):
  File "/panfs/jay/groups/33/kuangr/inoue019/conda-envs/myenv/lib/python3.10/site-packages/optuna/study/_optimize.py", line 197, in _run_trial
    value_or_values = func(trial)
  File "/users/4/inoue019/drGAT/zero_pad/t_small_GT.py", line 40, in objective
    "dropout1": trial.suggest_float("dropout1", 0.1, 0.5, step=0.05),
  File "/panfs/jay/groups/33/kuangr/inoue019/conda-envs/myenv/lib/python3.10/site-packages/optuna/trial/_trial.py", line 161, in suggest_float
    suggested_value = self._suggest(name, distribution)
  File "/panfs/jay/groups/33/kuangr/inoue019/conda-envs/myenv/lib/python3.10/site-packages/optuna/trial/_trial.py", line 627, in _suggest
    elif self._is_relative_param(name, distribution):
  File "/panfs/jay/groups/33/kuangr/inoue019/conda-envs/myenv/lib/python3.10/site-packages/optuna/trial/_trial.py", line 659, in _is_relative_param
    if name not in self.relative_params:
  File "/panfs/jay/groups/33/kuangr/inoue019/conda-envs/myenv/lib/python3.10/site-packages/optuna/trial/_trial.py", line 71, in relative_params
    self._relative_params = self.study.sampler.sample_relative(
  File "/panfs/jay/groups/33/kuangr/inoue019/conda-envs/myenv/lib/python3.10/site-packages/optuna/samplers/nsgaii/_sampler.py", line 269, in sample_relative
    parent_population = self.get_parent_population(study, generation)
  File "/panfs/jay/groups/33/kuangr/inoue019/conda-envs/myenv/lib/python3.10/site-packages/optuna/samplers/_ga/_base.py", line 176, in get_parent_population
    parent_population = self.select_parent(study, generation)
  File "/panfs/jay/groups/33/kuangr/inoue019/conda-envs/myenv/lib/python3.10/site-packages/optuna/samplers/nsgaii/_sampler.py", line 256, in select_parent
    return self._elite_population_selection_strategy(
  File "/panfs/jay/groups/33/kuangr/inoue019/conda-envs/myenv/lib/python3.10/site-packages/optuna/samplers/nsgaii/_elite_population_selection_strategy.py", line 47, in __call__
    population_per_rank = _rank_population(
  File "/panfs/jay/groups/33/kuangr/inoue019/conda-envs/myenv/lib/python3.10/site-packages/optuna/samplers/nsgaii/_elite_population_selection_strategy.py", line 126, in _rank_population
    objective_values = np.array([trial.values for trial in population], dtype=np.float64)
ValueError: setting an array element with a sequence. The requested array has an inhomogeneous shape after 1 dimensions. The detected shape was (105,) + inhomogeneous part.
[W 2025-04-20 11:10:54,401] Trial 173 failed with value None.
Using device: cuda
Best model found at epoch 9300
Using device: cuda
Best model found at epoch 9300
Using device: cuda
Best model found at epoch 9300
Using device: cuda
Best model found at epoch 9300
Using device: cuda
Best model found at epoch 9300
ACC_mean: 0.6573
ACC_std: 0.0050
F1_mean: 0.6323
F1_std: 0.0140
AUROC_mean: 0.7175
AUROC_std: 0.0032
AUPR_mean: 0.7093
AUPR_std: 0.0028
Traceback (most recent call last):
  File "/users/4/inoue019/drGAT/zero_pad/t_small_GT.py", line 162, in <module>
    study.optimize(objective, n_trials=1000)
  File "/panfs/jay/groups/33/kuangr/inoue019/conda-envs/myenv/lib/python3.10/site-packages/optuna/study/study.py", line 475, in optimize
    _optimize(
  File "/panfs/jay/groups/33/kuangr/inoue019/conda-envs/myenv/lib/python3.10/site-packages/optuna/study/_optimize.py", line 63, in _optimize
    _optimize_sequential(
  File "/panfs/jay/groups/33/kuangr/inoue019/conda-envs/myenv/lib/python3.10/site-packages/optuna/study/_optimize.py", line 160, in _optimize_sequential
    frozen_trial = _run_trial(study, func, catch)
  File "/panfs/jay/groups/33/kuangr/inoue019/conda-envs/myenv/lib/python3.10/site-packages/optuna/study/_optimize.py", line 248, in _run_trial
    raise func_err
  File "/panfs/jay/groups/33/kuangr/inoue019/conda-envs/myenv/lib/python3.10/site-packages/optuna/study/_optimize.py", line 197, in _run_trial
    value_or_values = func(trial)
  File "/users/4/inoue019/drGAT/zero_pad/t_small_GT.py", line 40, in objective
    "dropout1": trial.suggest_float("dropout1", 0.1, 0.5, step=0.05),
  File "/panfs/jay/groups/33/kuangr/inoue019/conda-envs/myenv/lib/python3.10/site-packages/optuna/trial/_trial.py", line 161, in suggest_float
    suggested_value = self._suggest(name, distribution)
  File "/panfs/jay/groups/33/kuangr/inoue019/conda-envs/myenv/lib/python3.10/site-packages/optuna/trial/_trial.py", line 627, in _suggest
    elif self._is_relative_param(name, distribution):
  File "/panfs/jay/groups/33/kuangr/inoue019/conda-envs/myenv/lib/python3.10/site-packages/optuna/trial/_trial.py", line 659, in _is_relative_param
    if name not in self.relative_params:
  File "/panfs/jay/groups/33/kuangr/inoue019/conda-envs/myenv/lib/python3.10/site-packages/optuna/trial/_trial.py", line 71, in relative_params
    self._relative_params = self.study.sampler.sample_relative(
  File "/panfs/jay/groups/33/kuangr/inoue019/conda-envs/myenv/lib/python3.10/site-packages/optuna/samplers/nsgaii/_sampler.py", line 269, in sample_relative
    parent_population = self.get_parent_population(study, generation)
  File "/panfs/jay/groups/33/kuangr/inoue019/conda-envs/myenv/lib/python3.10/site-packages/optuna/samplers/_ga/_base.py", line 176, in get_parent_population
    parent_population = self.select_parent(study, generation)
  File "/panfs/jay/groups/33/kuangr/inoue019/conda-envs/myenv/lib/python3.10/site-packages/optuna/samplers/nsgaii/_sampler.py", line 256, in select_parent
    return self._elite_population_selection_strategy(
  File "/panfs/jay/groups/33/kuangr/inoue019/conda-envs/myenv/lib/python3.10/site-packages/optuna/samplers/nsgaii/_elite_population_selection_strategy.py", line 47, in __call__
    population_per_rank = _rank_population(
  File "/panfs/jay/groups/33/kuangr/inoue019/conda-envs/myenv/lib/python3.10/site-packages/optuna/samplers/nsgaii/_elite_population_selection_strategy.py", line 126, in _rank_population
    objective_values = np.array([trial.values for trial in population], dtype=np.float64)
ValueError: setting an array element with a sequence. The requested array has an inhomogeneous shape after 1 dimensions. The detected shape was (105,) + inhomogeneous part.
