Not a conda environment: /scratch.global/inoue019/myenv
load nci
unique drugs: 177
unique genes: 251
DTI unique genes:  251
Top 90% variable genes:  2383
Total:  2582
Final gene exp shape: (60, 2582)
Final drug Act shape: (1005, 60)
  0%|          | 0/25 [00:00<?, ?it/s]  4%|▍         | 1/25 [00:03<01:18,  3.26s/it]  8%|▊         | 2/25 [00:03<00:36,  1.60s/it] 12%|█▏        | 3/25 [00:03<00:20,  1.05it/s] 16%|█▌        | 4/25 [00:04<00:13,  1.56it/s] 20%|██        | 5/25 [00:04<00:09,  2.12it/s] 24%|██▍       | 6/25 [00:04<00:07,  2.70it/s] 28%|██▊       | 7/25 [00:04<00:05,  3.32it/s] 32%|███▏      | 8/25 [00:04<00:04,  3.84it/s] 36%|███▌      | 9/25 [00:04<00:03,  4.29it/s] 40%|████      | 10/25 [00:05<00:03,  4.63it/s] 44%|████▍     | 11/25 [00:05<00:02,  4.95it/s] 48%|████▊     | 12/25 [00:05<00:02,  5.11it/s] 52%|█████▏    | 13/25 [00:05<00:02,  5.29it/s] 56%|█████▌    | 14/25 [00:05<00:02,  5.49it/s] 60%|██████    | 15/25 [00:05<00:01,  5.80it/s] 64%|██████▍   | 16/25 [00:06<00:01,  5.71it/s] 68%|██████▊   | 17/25 [00:06<00:01,  5.71it/s] 72%|███████▏  | 18/25 [00:06<00:01,  5.77it/s] 76%|███████▌  | 19/25 [00:06<00:01,  5.73it/s] 80%|████████  | 20/25 [00:06<00:00,  5.76it/s] 84%|████████▍ | 21/25 [00:06<00:00,  5.93it/s] 88%|████████▊ | 22/25 [00:07<00:00,  6.07it/s] 92%|█████████▏| 23/25 [00:07<00:00,  6.01it/s] 96%|█████████▌| 24/25 [00:07<00:00,  6.04it/s]100%|██████████| 25/25 [00:07<00:00,  6.17it/s]100%|██████████| 25/25 [00:07<00:00,  3.30it/s]
[I 2025-04-19 12:03:05,415] A new study created in RDB with name: Transformer
Done!
0it [00:00, ?it/s]1it [31:34, 1894.73s/it]2it [1:03:00, 1889.71s/it]3it [1:34:50, 1898.88s/it]4it [2:06:24, 1896.88s/it]5it [2:37:55, 1894.74s/it]5it [2:37:55, 1895.10s/it]
[I 2025-04-19 14:41:02,381] Trial 0 finished with values: [0.7149716515598067, 0.7067059025879463, 0.6369170607256286, 0.6557705805267678] and parameters: {'dropout1': 0.45000000000000007, 'dropout2': 0.45000000000000007, 'hidden1': 382, 'hidden2': 333, 'hidden3': 230, 'epochs': 6200, 'heads': 4, 'activation': 'gelu', 'optimizer': 'AdamW', 'lr': 3.6652172035627335e-05, 'weight_decay': 1.1869809642159885e-06, 'scheduler': None}.
Using device: cuda
Best model found at epoch 6200
Using device: cuda
Best model found at epoch 6200
Using device: cuda
Best model found at epoch 6200
Using device: cuda
Best model found at epoch 6200
Using device: cuda
Best model found at epoch 6200
ACC_mean: 0.6558
ACC_std: 0.0040
F1_mean: 0.6369
F1_std: 0.0070
AUROC_mean: 0.7150
AUROC_std: 0.0019
AUPR_mean: 0.7067
AUPR_std: 0.0011
0it [00:00, ?it/s]1it [00:32, 32.55s/it]2it [01:02, 31.29s/it]3it [01:33, 31.13s/it]4it [02:05, 31.21s/it]5it [02:36, 31.36s/it]5it [02:36, 31.37s/it]
[I 2025-04-19 14:43:40,781] Trial 35 finished with values: [0.6453342317377901, 0.6290077777016518, 0.4608911510912863, 0.5857049381577828] and parameters: {'dropout1': 0.2, 'dropout2': 0.2, 'hidden1': 644, 'hidden2': 356, 'hidden3': 120, 'epochs': 100, 'heads': 4, 'activation': 'gelu', 'optimizer': 'AdamW', 'lr': 0.0005683865845377297, 'weight_decay': 0.0013105374548521302, 'scheduler': None}.
Using device: cuda
Best model found at epoch 100
Using device: cuda
Best model found at epoch 100
Using device: cuda
Best model found at epoch 100
Using device: cuda
Best model found at epoch 100
Using device: cuda
Best model found at epoch 100
ACC_mean: 0.5857
ACC_std: 0.0617
F1_mean: 0.4609
F1_std: 0.2507
AUROC_mean: 0.6453
AUROC_std: 0.0545
AUPR_mean: 0.6290
AUPR_std: 0.0560
0it [00:00, ?it/s]0it [05:44, ?it/s]
[I 2025-04-19 14:49:26,416] Trial 36 pruned. NaN input at trial 36
Using device: cuda
Pruned trial 36: Input contains NaN
0it [00:00, ?it/s]1it [02:29, 149.93s/it]2it [04:59, 149.57s/it]3it [07:28, 149.56s/it]4it [09:59, 149.97s/it]5it [12:27, 149.12s/it]5it [12:27, 149.40s/it]
[I 2025-04-19 15:01:54,720] Trial 37 finished with values: [0.588693782606143, 0.5705653916694329, 0.383673632115765, 0.5440672980362276] and parameters: {'dropout1': 0.45000000000000007, 'dropout2': 0.2, 'hidden1': 693, 'hidden2': 457, 'hidden3': 49, 'epochs': 600, 'heads': 2, 'activation': 'gelu', 'optimizer': 'AdamW', 'lr': 0.001276061178032775, 'weight_decay': 0.004465231491262495, 'scheduler': None}.
Using device: cuda
Best model found at epoch 600
Using device: cuda
Best model found at epoch 600
Using device: cuda
Best model found at epoch 600
Using device: cuda
Best model found at epoch 600
Using device: cuda
Best model found at epoch 600
ACC_mean: 0.5441
ACC_std: 0.0207
F1_mean: 0.3837
F1_std: 0.1346
AUROC_mean: 0.5887
AUROC_std: 0.0164
AUPR_mean: 0.5706
AUPR_std: 0.0113
0it [00:00, ?it/s]0it [00:11, ?it/s]
[I 2025-04-19 15:02:06,992] Trial 38 pruned. NaN input at trial 38
Using device: cuda
Pruned trial 38: Input contains NaN
0it [00:00, ?it/s]0it [05:18, ?it/s]
[I 2025-04-19 15:07:25,873] Trial 40 pruned. NaN input at trial 40
Using device: cuda
Pruned trial 40: Input contains NaN
0it [00:00, ?it/s]0it [14:51, ?it/s]
[I 2025-04-19 15:22:18,542] Trial 41 pruned. NaN input at trial 41
Using device: cuda
Pruned trial 41: Input contains NaN
0it [00:00, ?it/s]0it [11:40, ?it/s]
[I 2025-04-19 15:34:00,163] Trial 42 pruned. NaN input at trial 42
Using device: cuda
Pruned trial 42: Input contains NaN
0it [00:00, ?it/s]0it [19:11, ?it/s]
[I 2025-04-19 15:53:12,489] Trial 45 pruned. NaN input at trial 45
Using device: cuda
Pruned trial 45: Input contains NaN
0it [00:00, ?it/s]1it [46:37, 2797.66s/it]2it [1:32:54, 2785.58s/it]3it [2:18:43, 2768.53s/it]4it [3:04:34, 2761.89s/it]5it [3:56:18, 2885.02s/it]5it [3:56:18, 2835.61s/it]
[I 2025-04-19 19:49:32,604] Trial 47 finished with values: [0.7091237239172288, 0.7002008982457832, 0.6296425129655722, 0.6509444979382712] and parameters: {'dropout1': 0.2, 'dropout2': 0.1, 'hidden1': 923, 'hidden2': 197, 'hidden3': 162, 'epochs': 9100, 'heads': 6, 'activation': 'gelu', 'optimizer': 'AdamW', 'lr': 7.981108317040203e-05, 'weight_decay': 0.0007099113870049841, 'scheduler': None}.
Using device: cuda
Best model found at epoch 9100
Using device: cuda
Best model found at epoch 9100
Using device: cuda
Best model found at epoch 9100
Using device: cuda
Best model found at epoch 9100
Using device: cuda
Best model found at epoch 9100
ACC_mean: 0.6509
ACC_std: 0.0041
F1_mean: 0.6296
F1_std: 0.0057
AUROC_mean: 0.7091
AUROC_std: 0.0022
AUPR_mean: 0.7002
AUPR_std: 0.0012
0it [00:00, ?it/s]1it [41:56, 2516.54s/it]2it [1:22:26, 2465.88s/it]3it [2:02:45, 2444.08s/it]4it [2:53:50, 2689.45s/it]5it [3:38:07, 2677.59s/it]5it [3:38:07, 2617.45s/it]
[I 2025-04-19 23:27:41,817] Trial 79 finished with values: [0.7168214925776293, 0.7078412312364603, 0.6339909994946712, 0.6563273458375211] and parameters: {'dropout1': 0.5, 'dropout2': 0.1, 'hidden1': 544, 'hidden2': 309, 'hidden3': 117, 'epochs': 6800, 'heads': 7, 'activation': 'gelu', 'optimizer': 'Adam', 'lr': 2.763973559412092e-05, 'weight_decay': 2.750743822864538e-06, 'scheduler': 'Cosine', 'T_max': 1597}.
Using device: cuda
Best model found at epoch 6800
Using device: cuda
Best model found at epoch 6800
Using device: cuda
Best model found at epoch 6800
Using device: cuda
Best model found at epoch 6800
Using device: cuda
Best model found at epoch 6800
ACC_mean: 0.6563
ACC_std: 0.0059
F1_mean: 0.6340
F1_std: 0.0122
AUROC_mean: 0.7168
AUROC_std: 0.0023
AUPR_mean: 0.7078
AUPR_std: 0.0021
0it [00:00, ?it/s]1it [16:24, 984.68s/it]2it [32:50, 985.41s/it]3it [49:06, 980.95s/it]4it [1:05:36, 984.52s/it]5it [1:22:01, 984.64s/it]5it [1:22:01, 984.21s/it]
[I 2025-04-20 00:49:44,766] Trial 102 finished with values: [0.7186258724422973, 0.7087281730928325, 0.6357979805329925, 0.6585921949911311] and parameters: {'dropout1': 0.45000000000000007, 'dropout2': 0.45000000000000007, 'hidden1': 291, 'hidden2': 107, 'hidden3': 41, 'epochs': 3900, 'heads': 3, 'activation': 'gelu', 'optimizer': 'AdamW', 'lr': 0.0004269163484662159, 'weight_decay': 1.5022446092853378e-06, 'scheduler': 'Cosine', 'T_max': 791}.
Using device: cuda
Best model found at epoch 3900
Using device: cuda
Best model found at epoch 3900
Using device: cuda
Best model found at epoch 3900
Using device: cuda
Best model found at epoch 3900
Using device: cuda
Best model found at epoch 3900
ACC_mean: 0.6586
ACC_std: 0.0012
F1_mean: 0.6358
F1_std: 0.0030
AUROC_mean: 0.7186
AUROC_std: 0.0023
AUPR_mean: 0.7087
AUPR_std: 0.0019
0it [00:00, ?it/s]1it [43:34, 2614.49s/it]2it [1:24:38, 2525.70s/it]3it [2:06:32, 2520.56s/it]4it [2:48:31, 2520.14s/it]5it [3:28:52, 2484.19s/it]5it [3:28:52, 2506.48s/it]
[I 2025-04-20 04:18:38,762] Trial 109 finished with values: [0.7102331071044228, 0.7012921806034648, 0.6321469719050563, 0.6521510099721773] and parameters: {'dropout1': 0.15000000000000002, 'dropout2': 0.30000000000000004, 'hidden1': 596, 'hidden2': 251, 'hidden3': 149, 'epochs': 8700, 'heads': 4, 'activation': 'gelu', 'optimizer': 'AdamW', 'lr': 0.00011903523667246613, 'weight_decay': 0.00016079819818505325, 'scheduler': None}.
Using device: cuda
Best model found at epoch 8700
Using device: cuda
Best model found at epoch 8700
Using device: cuda
Best model found at epoch 8700
Using device: cuda
Best model found at epoch 8700
Using device: cuda
Best model found at epoch 8700
ACC_mean: 0.6522
ACC_std: 0.0043
F1_mean: 0.6321
F1_std: 0.0049
AUROC_mean: 0.7102
AUROC_std: 0.0022
AUPR_mean: 0.7013
AUPR_std: 0.0013
0it [00:00, ?it/s]1it [54:57, 3297.14s/it]2it [1:49:55, 3297.81s/it]3it [2:45:25, 3312.62s/it]4it [3:40:22, 3306.55s/it]5it [4:35:20, 3303.23s/it]5it [4:35:20, 3304.05s/it]
[I 2025-04-20 08:54:00,689] Trial 140 finished with values: [0.7099466419210796, 0.7013687914090799, 0.6312320579912819, 0.651371424153586] and parameters: {'dropout1': 0.15000000000000002, 'dropout2': 0.1, 'hidden1': 544, 'hidden2': 501, 'hidden3': 78, 'epochs': 6800, 'heads': 8, 'activation': 'gelu', 'optimizer': 'Adam', 'lr': 2.763973559412092e-05, 'weight_decay': 2.750743822864538e-06, 'scheduler': None}.
Using device: cuda
Best model found at epoch 6800
Using device: cuda
Best model found at epoch 6800
Using device: cuda
Best model found at epoch 6800
Using device: cuda
Best model found at epoch 6800
Using device: cuda
Best model found at epoch 6800
ACC_mean: 0.6514
ACC_std: 0.0053
F1_mean: 0.6312
F1_std: 0.0096
AUROC_mean: 0.7099
AUROC_std: 0.0022
AUPR_mean: 0.7014
AUPR_std: 0.0008
0it [00:00, ?it/s]1it [58:27, 3507.72s/it]2it [2:03:27, 3738.30s/it]3it [3:02:34, 3651.06s/it]slurmstepd: error: *** JOB 34492521 ON aga02 CANCELLED AT 2025-04-20T12:02:34 DUE TO TIME LIMIT ***
