Not a conda environment: /scratch.global/inoue019/myenv
load nci
unique drugs: 177
unique genes: 251
DTI unique genes:  251
Top 90% variable genes:  2383
Total:  2582
Final gene exp shape: (60, 2582)
Final drug Act shape: (1005, 60)
  0%|          | 0/25 [00:00<?, ?it/s]  4%|▍         | 1/25 [00:01<00:46,  1.94s/it]  8%|▊         | 2/25 [00:02<00:20,  1.12it/s] 12%|█▏        | 3/25 [00:02<00:12,  1.79it/s] 16%|█▌        | 4/25 [00:02<00:08,  2.51it/s] 20%|██        | 5/25 [00:02<00:06,  3.28it/s] 24%|██▍       | 6/25 [00:02<00:04,  3.90it/s] 28%|██▊       | 7/25 [00:02<00:03,  4.59it/s] 32%|███▏      | 8/25 [00:02<00:03,  5.21it/s] 36%|███▌      | 9/25 [00:03<00:02,  5.77it/s] 40%|████      | 10/25 [00:03<00:02,  5.91it/s] 44%|████▍     | 11/25 [00:03<00:02,  6.40it/s] 48%|████▊     | 12/25 [00:03<00:02,  6.39it/s] 52%|█████▏    | 13/25 [00:03<00:01,  6.29it/s] 56%|█████▌    | 14/25 [00:03<00:01,  6.28it/s] 60%|██████    | 15/25 [00:04<00:01,  6.40it/s] 64%|██████▍   | 16/25 [00:04<00:01,  6.74it/s] 68%|██████▊   | 17/25 [00:04<00:01,  7.00it/s] 72%|███████▏  | 18/25 [00:04<00:00,  7.19it/s] 76%|███████▌  | 19/25 [00:04<00:00,  7.35it/s] 80%|████████  | 20/25 [00:04<00:00,  7.38it/s] 84%|████████▍ | 21/25 [00:04<00:00,  7.28it/s] 88%|████████▊ | 22/25 [00:04<00:00,  7.20it/s] 92%|█████████▏| 23/25 [00:05<00:00,  7.14it/s] 96%|█████████▌| 24/25 [00:05<00:00,  7.15it/s]100%|██████████| 25/25 [00:05<00:00,  7.13it/s]100%|██████████| 25/25 [00:05<00:00,  4.63it/s]
[I 2025-04-19 12:08:07,912] Using an existing study with name 'Transformer' instead of creating a new one.
Done!
0it [00:00, ?it/s]0it [00:20, ?it/s]
[I 2025-04-19 12:08:31,344] Trial 8 pruned. NaN input at trial 8
Using device: cuda
Pruned trial 8: Input contains NaN
0it [00:00, ?it/s]1it [41:23, 2483.69s/it]2it [1:23:10, 2497.36s/it]3it [2:05:54, 2527.55s/it]4it [2:47:08, 2506.56s/it]5it [3:28:38, 2500.73s/it]5it [3:28:38, 2503.77s/it]
[I 2025-04-19 15:37:11,493] Trial 9 finished with values: [0.7149695439434245, 0.7059575022830263, 0.6371710865803922, 0.6569399661452293] and parameters: {'dropout1': 0.45000000000000007, 'dropout2': 0.45000000000000007, 'hidden1': 475, 'hidden2': 399, 'hidden3': 208, 'epochs': 5100, 'heads': 8, 'activation': 'gelu', 'optimizer': 'AdamW', 'lr': 0.0004048918234601821, 'weight_decay': 7.91433515105005e-05, 'scheduler': None}.
Using device: cuda
Best model found at epoch 5100
Using device: cuda
Best model found at epoch 5100
Using device: cuda
Best model found at epoch 5100
Using device: cuda
Best model found at epoch 5100
Using device: cuda
Best model found at epoch 5100
ACC_mean: 0.6569
ACC_std: 0.0056
F1_mean: 0.6372
F1_std: 0.0054
AUROC_mean: 0.7150
AUROC_std: 0.0035
AUPR_mean: 0.7060
AUPR_std: 0.0026
0it [00:00, ?it/s]1it [25:18, 1518.29s/it]2it [50:36, 1518.16s/it]3it [1:15:55, 1518.78s/it]4it [1:41:09, 1516.55s/it]5it [2:06:35, 1520.06s/it]5it [2:06:35, 1519.06s/it]
[I 2025-04-19 17:43:48,283] Trial 46 finished with values: [0.7203031454199769, 0.7119579885869335, 0.6470449836399006, 0.65998420129077] and parameters: {'dropout1': 0.30000000000000004, 'dropout2': 0.5, 'hidden1': 906, 'hidden2': 255, 'hidden3': 248, 'epochs': 3900, 'heads': 6, 'activation': 'relu', 'optimizer': 'AdamW', 'lr': 2.64158325330293e-05, 'weight_decay': 8.310991854141183e-05, 'scheduler': 'Cosine', 'T_max': 936}.
Using device: cuda
Best model found at epoch 3900
Using device: cuda
Best model found at epoch 3900
Using device: cuda
Best model found at epoch 3900
Using device: cuda
Best model found at epoch 3900
Using device: cuda
Best model found at epoch 3900
ACC_mean: 0.6600
ACC_std: 0.0034
F1_mean: 0.6470
F1_std: 0.0100
AUROC_mean: 0.7203
AUROC_std: 0.0033
AUPR_mean: 0.7120
AUPR_std: 0.0037
0it [00:00, ?it/s]0it [00:04, ?it/s]
[I 2025-04-19 17:43:53,444] Trial 61 pruned. NaN input at trial 61
Using device: cuda
Pruned trial 61: Input contains NaN
0it [00:00, ?it/s]1it [13:00, 780.23s/it]2it [26:00, 780.52s/it]3it [39:00, 780.19s/it]4it [52:01, 780.31s/it]5it [1:05:01, 780.18s/it]5it [1:05:01, 780.24s/it]
[I 2025-04-19 18:48:57,065] Trial 62 finished with values: [0.7222499534583271, 0.7116166739553844, 0.6450887140363056, 0.6630095734885972] and parameters: {'dropout1': 0.5, 'dropout2': 0.35, 'hidden1': 938, 'hidden2': 361, 'hidden3': 241, 'epochs': 1600, 'heads': 8, 'activation': 'gelu', 'optimizer': 'Adam', 'lr': 0.00019676873339635514, 'weight_decay': 0.0003221647587892835, 'scheduler': None}.
Using device: cuda
Best model found at epoch 1600
Using device: cuda
Best model found at epoch 1600
Using device: cuda
Best model found at epoch 1600
Using device: cuda
Best model found at epoch 1600
Using device: cuda
Best model found at epoch 1600
ACC_mean: 0.6630
ACC_std: 0.0070
F1_mean: 0.6451
F1_std: 0.0144
AUROC_mean: 0.7222
AUROC_std: 0.0033
AUPR_mean: 0.7116
AUPR_std: 0.0042
0it [00:00, ?it/s]1it [30:42, 1842.81s/it]2it [1:01:34, 1848.02s/it]3it [1:32:27, 1850.49s/it]4it [2:03:19, 1850.80s/it]5it [2:34:09, 1850.55s/it]5it [2:34:09, 1849.86s/it]
[I 2025-04-19 21:23:07,761] Trial 72 finished with values: [0.7188220466171596, 0.7099795313728385, 0.6396571545698866, 0.6588702779065168] and parameters: {'dropout1': 0.25, 'dropout2': 0.25, 'hidden1': 581, 'hidden2': 216, 'hidden3': 138, 'epochs': 6300, 'heads': 3, 'activation': 'gelu', 'optimizer': 'AdamW', 'lr': 1.6903054802010637e-05, 'weight_decay': 0.0025087990460845567, 'scheduler': None}.
Using device: cuda
Best model found at epoch 6300
Using device: cuda
Best model found at epoch 6300
Using device: cuda
Best model found at epoch 6300
Using device: cuda
Best model found at epoch 6300
Using device: cuda
Best model found at epoch 6300
ACC_mean: 0.6589
ACC_std: 0.0061
F1_mean: 0.6397
F1_std: 0.0167
AUROC_mean: 0.7188
AUROC_std: 0.0025
AUPR_mean: 0.7100
AUPR_std: 0.0017
0it [00:00, ?it/s]1it [27:15, 1635.85s/it]2it [54:31, 1635.66s/it]3it [1:21:41, 1633.29s/it]4it [1:48:56, 1633.64s/it]5it [2:16:21, 1638.09s/it]5it [2:16:21, 1636.40s/it]
[I 2025-04-19 23:39:31,426] Trial 90 finished with values: [0.7103970440168667, 0.7017556226782495, 0.6293525733605395, 0.6519653778949543] and parameters: {'dropout1': 0.25, 'dropout2': 0.15000000000000002, 'hidden1': 823, 'hidden2': 308, 'hidden3': 103, 'epochs': 4200, 'heads': 7, 'activation': 'relu', 'optimizer': 'Adam', 'lr': 0.0002584312191052901, 'weight_decay': 1.2324469673603406e-06, 'scheduler': None}.
Using device: cuda
Best model found at epoch 4200
Using device: cuda
Best model found at epoch 4200
Using device: cuda
Best model found at epoch 4200
Using device: cuda
Best model found at epoch 4200
Using device: cuda
Best model found at epoch 4200
ACC_mean: 0.6520
ACC_std: 0.0043
F1_mean: 0.6294
F1_std: 0.0056
AUROC_mean: 0.7104
AUROC_std: 0.0020
AUPR_mean: 0.7018
AUPR_std: 0.0009
0it [00:00, ?it/s]1it [43:01, 2581.01s/it]2it [1:25:39, 2567.78s/it]3it [2:08:15, 2562.30s/it]4it [2:50:21, 2548.20s/it]5it [3:32:36, 2543.21s/it]5it [3:32:36, 2551.25s/it]
[I 2025-04-20 03:12:09,775] Trial 103 finished with values: [0.7133651941955128, 0.7051682226358311, 0.6344840068161386, 0.6544156317368286] and parameters: {'dropout1': 0.25, 'dropout2': 0.35, 'hidden1': 536, 'hidden2': 262, 'hidden3': 142, 'epochs': 6300, 'heads': 8, 'activation': 'relu', 'optimizer': 'AdamW', 'lr': 1.6903054802010637e-05, 'weight_decay': 0.00011838891335694367, 'scheduler': None}.
Using device: cuda
Best model found at epoch 6300
Using device: cuda
Best model found at epoch 6300
Using device: cuda
Best model found at epoch 6300
Using device: cuda
Best model found at epoch 6300
Using device: cuda
Best model found at epoch 6300
ACC_mean: 0.6544
ACC_std: 0.0035
F1_mean: 0.6345
F1_std: 0.0072
AUROC_mean: 0.7134
AUROC_std: 0.0018
AUPR_mean: 0.7052
AUPR_std: 0.0010
0it [00:00, ?it/s]1it [52:40, 3160.48s/it]2it [1:45:36, 3169.53s/it]3it [2:37:49, 3153.00s/it]4it [3:29:25, 3130.34s/it]5it [4:20:43, 3111.55s/it]5it [4:20:43, 3128.70s/it]
[I 2025-04-20 07:32:54,867] Trial 128 finished with values: [0.7199836256599792, 0.711938554143932, 0.6383102637967009, 0.6597057566202228] and parameters: {'dropout1': 0.5, 'dropout2': 0.25, 'hidden1': 539, 'hidden2': 477, 'hidden3': 167, 'epochs': 9300, 'heads': 3, 'activation': 'gelu', 'optimizer': 'Adam', 'lr': 0.0003986050768324814, 'weight_decay': 3.427796893491514e-05, 'scheduler': None}.
Using device: cuda
Best model found at epoch 9300
Using device: cuda
Best model found at epoch 9300
Using device: cuda
Best model found at epoch 9300
Using device: cuda
Best model found at epoch 9300
Using device: cuda
Best model found at epoch 9300
ACC_mean: 0.6597
ACC_std: 0.0042
F1_mean: 0.6383
F1_std: 0.0118
AUROC_mean: 0.7200
AUROC_std: 0.0019
AUPR_mean: 0.7119
AUPR_std: 0.0026
0it [00:00, ?it/s]1it [1:01:49, 3709.09s/it]2it [2:05:08, 3762.42s/it]3it [3:05:25, 3695.65s/it]4it [4:02:06, 3579.48s/it]slurmstepd: error: *** JOB 34492526 ON aga42 CANCELLED AT 2025-04-20T12:02:34 DUE TO TIME LIMIT ***
