Not a conda environment: /scratch.global/inoue019/myenv
load nci
unique drugs: 177
unique genes: 251
DTI unique genes:  251
Top 90% variable genes:  2383
Total:  2582
Final gene exp shape: (60, 2582)
Final drug Act shape: (1005, 60)
  0%|          | 0/25 [00:00<?, ?it/s]  4%|▍         | 1/25 [00:01<00:43,  1.82s/it]  8%|▊         | 2/25 [00:02<00:20,  1.12it/s] 12%|█▏        | 3/25 [00:02<00:12,  1.77it/s] 16%|█▌        | 4/25 [00:02<00:08,  2.42it/s] 20%|██        | 5/25 [00:02<00:07,  2.81it/s] 24%|██▍       | 6/25 [00:02<00:05,  3.18it/s] 28%|██▊       | 7/25 [00:03<00:04,  3.72it/s] 32%|███▏      | 8/25 [00:03<00:04,  4.06it/s] 36%|███▌      | 9/25 [00:03<00:03,  4.54it/s] 40%|████      | 10/25 [00:03<00:03,  4.83it/s] 44%|████▍     | 11/25 [00:03<00:02,  5.15it/s] 48%|████▊     | 12/25 [00:03<00:02,  5.30it/s] 52%|█████▏    | 13/25 [00:04<00:02,  5.42it/s] 56%|█████▌    | 14/25 [00:04<00:01,  5.51it/s] 60%|██████    | 15/25 [00:04<00:01,  5.67it/s] 64%|██████▍   | 16/25 [00:04<00:01,  5.78it/s] 68%|██████▊   | 17/25 [00:04<00:01,  5.74it/s] 72%|███████▏  | 18/25 [00:04<00:01,  6.07it/s] 76%|███████▌  | 19/25 [00:05<00:00,  6.22it/s] 80%|████████  | 20/25 [00:05<00:00,  6.15it/s] 84%|████████▍ | 21/25 [00:05<00:00,  6.08it/s] 88%|████████▊ | 22/25 [00:05<00:00,  5.98it/s] 92%|█████████▏| 23/25 [00:05<00:00,  5.89it/s] 96%|█████████▌| 24/25 [00:05<00:00,  5.91it/s]100%|██████████| 25/25 [00:06<00:00,  5.78it/s]100%|██████████| 25/25 [00:06<00:00,  4.07it/s]
[I 2025-04-19 12:08:07,116] Using an existing study with name 'Transformer' instead of creating a new one.
Done!
0it [00:00, ?it/s]1it [02:34, 154.85s/it]2it [04:49, 143.04s/it]3it [06:59, 137.09s/it]4it [09:09, 134.18s/it]5it [11:19, 132.70s/it]5it [11:19, 135.89s/it]
[I 2025-04-19 12:19:29,462] Trial 6 finished with values: [0.7153376724643501, 0.7044916766921567, 0.6429593296638982, 0.6565314239826996] and parameters: {'dropout1': 0.25, 'dropout2': 0.35, 'hidden1': 624, 'hidden2': 295, 'hidden3': 86, 'epochs': 500, 'heads': 2, 'activation': 'gelu', 'optimizer': 'Adam', 'lr': 9.508657409642725e-05, 'weight_decay': 9.592345613777652e-06, 'scheduler': None}.
Using device: cuda
Best model found at epoch 500
Using device: cuda
Best model found at epoch 500
Using device: cuda
Best model found at epoch 500
Using device: cuda
Best model found at epoch 500
Using device: cuda
Best model found at epoch 500
ACC_mean: 0.6565
ACC_std: 0.0067
F1_mean: 0.6430
F1_std: 0.0181
AUROC_mean: 0.7153
AUROC_std: 0.0035
AUPR_mean: 0.7045
AUPR_std: 0.0027
0it [00:00, ?it/s]1it [1:13:34, 4414.97s/it]2it [2:27:23, 4423.08s/it]3it [3:43:06, 4477.84s/it]4it [4:56:24, 4446.27s/it]5it [6:09:03, 4414.62s/it]5it [6:09:03, 4428.62s/it]
[I 2025-04-19 18:28:33,861] Trial 13 finished with values: [0.7146701022739078, 0.7057124229253068, 0.6496579698667537, 0.6577196553224381] and parameters: {'dropout1': 0.45000000000000007, 'dropout2': 0.1, 'hidden1': 629, 'hidden2': 467, 'hidden3': 206, 'epochs': 8900, 'heads': 8, 'activation': 'gelu', 'optimizer': 'AdamW', 'lr': 1.301809001520468e-05, 'weight_decay': 1.5022446092853378e-06, 'scheduler': 'Cosine', 'T_max': 2433}.
Using device: cuda
Best model found at epoch 8900
Using device: cuda
Best model found at epoch 8900
Using device: cuda
Best model found at epoch 8900
Using device: cuda
Best model found at epoch 8900
Using device: cuda
Best model found at epoch 8900
ACC_mean: 0.6577
ACC_std: 0.0032
F1_mean: 0.6497
F1_std: 0.0047
AUROC_mean: 0.7147
AUROC_std: 0.0019
AUPR_mean: 0.7057
AUPR_std: 0.0016
0it [00:00, ?it/s]1it [31:05, 1865.89s/it]2it [1:02:43, 1884.64s/it]3it [1:34:57, 1907.33s/it]4it [2:04:01, 1842.76s/it]5it [2:33:56, 1825.60s/it]5it [2:33:56, 1847.39s/it]
[I 2025-04-19 21:02:32,504] Trial 71 finished with values: [0.6906830024240305, 0.6736462869092448, 0.5800149947510469, 0.6304148787348465] and parameters: {'dropout1': 0.5, 'dropout2': 0.2, 'hidden1': 395, 'hidden2': 332, 'hidden3': 97, 'epochs': 7700, 'heads': 2, 'activation': 'gelu', 'optimizer': 'Adam', 'lr': 0.0019506316532547504, 'weight_decay': 0.0010992012852032752, 'scheduler': 'Cosine', 'T_max': 2013}.
Using device: cuda
Best model found at epoch 7700
Using device: cuda
Best model found at epoch 7700
Using device: cuda
Best model found at epoch 7700
Using device: cuda
Best model found at epoch 7700
Using device: cuda
Best model found at epoch 7700
ACC_mean: 0.6304
ACC_std: 0.0224
F1_mean: 0.5800
F1_std: 0.0874
AUROC_mean: 0.6907
AUROC_std: 0.0061
AUPR_mean: 0.6736
AUPR_std: 0.0067
0it [00:00, ?it/s]0it [24:31, ?it/s]
[I 2025-04-19 21:27:05,038] Trial 86 pruned. NaN input at trial 86
Using device: cuda
Pruned trial 86: Input contains NaN
0it [00:00, ?it/s]1it [53:30, 3210.99s/it]2it [1:47:28, 3226.32s/it]3it [2:42:38, 3264.62s/it]4it [3:36:50, 3259.72s/it]5it [4:31:01, 3256.53s/it]5it [4:31:01, 3252.26s/it]
[I 2025-04-20 01:58:08,274] Trial 91 finished with values: [0.5, 0.5, 0.0, 0.5] and parameters: {'dropout1': 0.45000000000000007, 'dropout2': 0.15000000000000002, 'hidden1': 503, 'hidden2': 433, 'hidden3': 233, 'epochs': 7400, 'heads': 7, 'activation': 'relu', 'optimizer': 'Adam', 'lr': 0.006779921814481896, 'weight_decay': 0.009580151158614054, 'scheduler': None}.
Using device: cuda
Best model found at epoch 7400
Using device: cuda
Best model found at epoch 7400
Using device: cuda
Best model found at epoch 7400
Using device: cuda
Best model found at epoch 7400
Using device: cuda
Best model found at epoch 7400
ACC_mean: 0.5000
ACC_std: 0.0000
F1_mean: 0.0000
F1_std: 0.0000
AUROC_mean: 0.5000
AUROC_std: 0.0000
AUPR_mean: 0.5000
AUPR_std: 0.0000
0it [00:00, ?it/s]1it [35:32, 2132.30s/it]2it [1:11:13, 2137.35s/it]3it [1:46:44, 2134.82s/it]4it [2:22:19, 2134.66s/it]5it [2:57:50, 2133.31s/it]5it [2:57:50, 2134.07s/it]
[I 2025-04-20 04:56:00,062] Trial 115 finished with values: [0.7144099486925398, 0.7059461474928279, 0.6342863695904528, 0.6549352706321372] and parameters: {'dropout1': 0.2, 'dropout2': 0.35, 'hidden1': 385, 'hidden2': 299, 'hidden3': 42, 'epochs': 6300, 'heads': 8, 'activation': 'relu', 'optimizer': 'Adam', 'lr': 0.00033836128247018106, 'weight_decay': 2.1277622627735234e-05, 'scheduler': None}.
Using device: cuda
Best model found at epoch 6300
Using device: cuda
Best model found at epoch 6300
Using device: cuda
Best model found at epoch 6300
Using device: cuda
Best model found at epoch 6300
Using device: cuda
Best model found at epoch 6300
ACC_mean: 0.6549
ACC_std: 0.0047
F1_mean: 0.6343
F1_std: 0.0056
AUROC_mean: 0.7144
AUROC_std: 0.0035
AUPR_mean: 0.7059
AUPR_std: 0.0026
0it [00:00, ?it/s]1it [39:05, 2345.11s/it]2it [1:17:05, 2307.11s/it]3it [1:54:55, 2289.92s/it]4it [2:32:51, 2284.73s/it]5it [3:11:12, 2290.37s/it]5it [3:11:12, 2294.45s/it]
[I 2025-04-20 08:07:14,144] Trial 141 finished with values: [0.7105480378469166, 0.7020293883784418, 0.6329903127351002, 0.653153461087341] and parameters: {'dropout1': 0.45000000000000007, 'dropout2': 0.2, 'hidden1': 629, 'hidden2': 418, 'hidden3': 178, 'epochs': 5300, 'heads': 8, 'activation': 'gelu', 'optimizer': 'AdamW', 'lr': 3.828383032152841e-05, 'weight_decay': 1.5022446092853378e-06, 'scheduler': None}.
Using device: cuda
Best model found at epoch 5300
Using device: cuda
Best model found at epoch 5300
Using device: cuda
Best model found at epoch 5300
Using device: cuda
Best model found at epoch 5300
Using device: cuda
Best model found at epoch 5300
ACC_mean: 0.6532
ACC_std: 0.0032
F1_mean: 0.6330
F1_std: 0.0060
AUROC_mean: 0.7105
AUROC_std: 0.0019
AUPR_mean: 0.7020
AUPR_std: 0.0011
0it [00:00, ?it/s]1it [15:53, 953.97s/it]2it [32:12, 968.68s/it]3it [48:24, 970.11s/it]4it [1:04:17, 963.44s/it]5it [1:20:16, 961.50s/it]5it [1:20:16, 963.21s/it]
[I 2025-04-20 09:27:31,865] Trial 160 finished with values: [0.7138448984355963, 0.7006305210636061, 0.6303516633169379, 0.6548425682880051] and parameters: {'dropout1': 0.25, 'dropout2': 0.25, 'hidden1': 283, 'hidden2': 143, 'hidden3': 121, 'epochs': 4000, 'heads': 3, 'activation': 'relu', 'optimizer': 'Adam', 'lr': 0.0011638296754628889, 'weight_decay': 0.0010870935539262336, 'scheduler': 'Cosine', 'T_max': 1032}.
Using device: cuda
Best model found at epoch 4000
Using device: cuda
Best model found at epoch 4000
Using device: cuda
Best model found at epoch 4000
Using device: cuda
Best model found at epoch 4000
Using device: cuda
Best model found at epoch 4000
ACC_mean: 0.6548
ACC_std: 0.0045
F1_mean: 0.6304
F1_std: 0.0106
AUROC_mean: 0.7138
AUROC_std: 0.0030
AUPR_mean: 0.7006
AUPR_std: 0.0065
0it [00:00, ?it/s]1it [49:56, 2996.29s/it]2it [1:42:02, 3072.61s/it]3it [2:32:40, 3057.11s/it]slurmstepd: error: *** JOB 34492531 ON aga05 CANCELLED AT 2025-04-20T12:02:34 DUE TO TIME LIMIT ***
