Not a conda environment: /scratch.global/inoue019/myenv
load nci
unique drugs: 177
unique genes: 251
DTI unique genes:  251
Top 90% variable genes:  2383
Total:  2582
Final gene exp shape: (60, 2582)
Final drug Act shape: (1005, 60)
  0%|          | 0/25 [00:00<?, ?it/s]  4%|▍         | 1/25 [00:00<00:03,  6.57it/s]  8%|▊         | 2/25 [00:00<00:03,  7.40it/s] 12%|█▏        | 3/25 [00:00<00:02,  7.78it/s] 16%|█▌        | 4/25 [00:00<00:02,  7.90it/s] 20%|██        | 5/25 [00:00<00:02,  7.77it/s] 24%|██▍       | 6/25 [00:00<00:02,  7.50it/s] 28%|██▊       | 7/25 [00:00<00:02,  6.69it/s] 32%|███▏      | 8/25 [00:01<00:02,  6.47it/s] 36%|███▌      | 9/25 [00:01<00:02,  6.50it/s] 40%|████      | 10/25 [00:01<00:02,  6.38it/s] 44%|████▍     | 11/25 [00:01<00:02,  6.20it/s] 48%|████▊     | 12/25 [00:01<00:02,  5.95it/s] 52%|█████▏    | 13/25 [00:01<00:02,  5.81it/s] 56%|█████▌    | 14/25 [00:02<00:01,  5.71it/s] 60%|██████    | 15/25 [00:02<00:01,  5.81it/s] 64%|██████▍   | 16/25 [00:02<00:01,  5.64it/s] 68%|██████▊   | 17/25 [00:02<00:01,  5.34it/s] 72%|███████▏  | 18/25 [00:02<00:01,  5.32it/s] 76%|███████▌  | 19/25 [00:03<00:01,  5.26it/s] 80%|████████  | 20/25 [00:03<00:00,  5.39it/s] 84%|████████▍ | 21/25 [00:03<00:00,  5.39it/s] 88%|████████▊ | 22/25 [00:03<00:00,  5.30it/s] 92%|█████████▏| 23/25 [00:03<00:00,  5.20it/s] 96%|█████████▌| 24/25 [00:04<00:00,  5.42it/s]100%|██████████| 25/25 [00:04<00:00,  5.61it/s]100%|██████████| 25/25 [00:04<00:00,  5.93it/s]
[I 2025-04-19 12:06:44,643] Using an existing study with name 'Transformer' instead of creating a new one.
Done!
0it [00:00, ?it/s]1it [58:55, 3535.83s/it]2it [1:51:21, 3306.14s/it]3it [2:46:38, 3311.40s/it]4it [3:39:06, 3246.83s/it]5it [4:31:26, 3208.38s/it]5it [4:31:26, 3257.38s/it]
[I 2025-04-19 16:38:13,283] Trial 2 finished with values: [0.7184490052511399, 0.7105288247877375, 0.6399225988464193, 0.6590931948823979] and parameters: {'dropout1': 0.2, 'dropout2': 0.35, 'hidden1': 536, 'hidden2': 460, 'hidden3': 240, 'epochs': 6300, 'heads': 8, 'activation': 'relu', 'optimizer': 'Adam', 'lr': 0.00033264106043891397, 'weight_decay': 0.00011838891335694367, 'scheduler': 'Cosine', 'T_max': 2330}.
Using device: cuda
Best model found at epoch 6300
Using device: cuda
Best model found at epoch 6300
Using device: cuda
Best model found at epoch 6300
Using device: cuda
Best model found at epoch 6300
Using device: cuda
Best model found at epoch 6300
ACC_mean: 0.6591
ACC_std: 0.0036
F1_mean: 0.6399
F1_std: 0.0068
AUROC_mean: 0.7184
AUROC_std: 0.0022
AUPR_mean: 0.7105
AUPR_std: 0.0019
0it [00:00, ?it/s]1it [03:38, 218.96s/it]2it [07:18, 219.05s/it]3it [10:57, 219.14s/it]4it [14:36, 219.18s/it]5it [18:16, 219.30s/it]5it [18:16, 219.22s/it]
[I 2025-04-19 16:56:31,020] Trial 52 finished with values: [0.7211591947697953, 0.7133523947662712, 0.6491150092313195, 0.6613019547595196] and parameters: {'dropout1': 0.15000000000000002, 'dropout2': 0.4, 'hidden1': 548, 'hidden2': 419, 'hidden3': 180, 'epochs': 600, 'heads': 5, 'activation': 'relu', 'optimizer': 'AdamW', 'lr': 0.00016139513582632303, 'weight_decay': 0.0012627322514444307, 'scheduler': None}.
Using device: cuda
Best model found at epoch 600
Using device: cuda
Best model found at epoch 600
Using device: cuda
Best model found at epoch 600
Using device: cuda
Best model found at epoch 600
Using device: cuda
Best model found at epoch 600
ACC_mean: 0.6613
ACC_std: 0.0053
F1_mean: 0.6491
F1_std: 0.0109
AUROC_mean: 0.7212
AUROC_std: 0.0022
AUPR_mean: 0.7134
AUPR_std: 0.0024
0it [00:00, ?it/s]0it [00:37, ?it/s]
[I 2025-04-19 16:57:08,817] Trial 53 pruned. NaN input at trial 53
Using device: cuda
Pruned trial 53: Input contains NaN
0it [00:00, ?it/s]1it [01:46, 106.76s/it]2it [03:33, 106.99s/it]3it [05:20, 106.91s/it]4it [07:07, 106.78s/it]5it [08:54, 106.75s/it]5it [08:54, 106.80s/it]
[I 2025-04-19 17:06:04,494] Trial 54 finished with values: [0.5397240960010193, 0.540805327648748, 0.2155685949449632, 0.5078521714060726] and parameters: {'dropout1': 0.5, 'dropout2': 0.2, 'hidden1': 498, 'hidden2': 333, 'hidden3': 138, 'epochs': 300, 'heads': 6, 'activation': 'relu', 'optimizer': 'Adam', 'lr': 0.003060057414166164, 'weight_decay': 0.00011527058970466394, 'scheduler': None}.
Using device: cuda
Best model found at epoch 300
Using device: cuda
Best model found at epoch 300
Using device: cuda
Best model found at epoch 300
Using device: cuda
Best model found at epoch 300
Using device: cuda
Best model found at epoch 300
ACC_mean: 0.5079
ACC_std: 0.0070
F1_mean: 0.2156
F1_std: 0.2385
AUROC_mean: 0.5397
AUROC_std: 0.0175
AUPR_mean: 0.5408
AUPR_std: 0.0128
0it [00:00, ?it/s]1it [33:31, 2011.42s/it]2it [1:06:55, 2007.39s/it]3it [1:40:21, 2006.50s/it]4it [2:13:48, 2006.89s/it]5it [2:47:21, 2008.95s/it]5it [2:47:21, 2008.30s/it]
[I 2025-04-19 19:53:27,719] Trial 56 finished with values: [0.7116827452007527, 0.7031450258526863, 0.6313447564974195, 0.6536916459639356] and parameters: {'dropout1': 0.4, 'dropout2': 0.25, 'hidden1': 438, 'hidden2': 381, 'hidden3': 80, 'epochs': 5800, 'heads': 6, 'activation': 'relu', 'optimizer': 'AdamW', 'lr': 0.00033836128247018106, 'weight_decay': 1.1603102241170083e-05, 'scheduler': 'Cosine', 'T_max': 2305}.
Using device: cuda
Best model found at epoch 5800
Using device: cuda
Best model found at epoch 5800
Using device: cuda
Best model found at epoch 5800
Using device: cuda
Best model found at epoch 5800
Using device: cuda
Best model found at epoch 5800
ACC_mean: 0.6537
ACC_std: 0.0049
F1_mean: 0.6313
F1_std: 0.0052
AUROC_mean: 0.7117
AUROC_std: 0.0019
AUPR_mean: 0.7031
AUPR_std: 0.0010
0it [00:00, ?it/s]1it [21:06, 1266.59s/it]2it [42:11, 1265.41s/it]3it [1:03:23, 1268.36s/it]4it [1:24:34, 1269.43s/it]5it [1:45:39, 1267.86s/it]5it [1:45:39, 1267.84s/it]
[I 2025-04-19 21:39:08,535] Trial 80 finished with values: [0.7203067513564819, 0.7114273765156254, 0.6450474923183981, 0.6584065008987376] and parameters: {'dropout1': 0.35, 'dropout2': 0.1, 'hidden1': 1019, 'hidden2': 468, 'hidden3': 255, 'epochs': 2900, 'heads': 6, 'activation': 'relu', 'optimizer': 'Adam', 'lr': 0.0008677585729554783, 'weight_decay': 4.5822189113002747e-05, 'scheduler': 'Cosine', 'T_max': 1412}.
Using device: cuda
Best model found at epoch 2900
Using device: cuda
Best model found at epoch 2900
Using device: cuda
Best model found at epoch 2900
Using device: cuda
Best model found at epoch 2900
Using device: cuda
Best model found at epoch 2900
ACC_mean: 0.6584
ACC_std: 0.0026
F1_mean: 0.6450
F1_std: 0.0264
AUROC_mean: 0.7203
AUROC_std: 0.0035
AUPR_mean: 0.7114
AUPR_std: 0.0049
0it [00:00, ?it/s]1it [24:36, 1476.69s/it]2it [49:09, 1474.58s/it]3it [1:13:46, 1475.56s/it]4it [1:38:22, 1475.74s/it]5it [2:02:58, 1475.66s/it]5it [2:02:58, 1475.61s/it]
[I 2025-04-19 23:42:08,381] Trial 92 finished with values: [0.7167955365600029, 0.7074583364018812, 0.644158851095666, 0.6578681230860568] and parameters: {'dropout1': 0.2, 'dropout2': 0.25, 'hidden1': 532, 'hidden2': 205, 'hidden3': 57, 'epochs': 5900, 'heads': 3, 'activation': 'relu', 'optimizer': 'Adam', 'lr': 2.735699135644965e-05, 'weight_decay': 0.00016079819818505325, 'scheduler': None}.
Using device: cuda
Best model found at epoch 5900
Using device: cuda
Best model found at epoch 5900
Using device: cuda
Best model found at epoch 5900
Using device: cuda
Best model found at epoch 5900
Using device: cuda
Best model found at epoch 5900
ACC_mean: 0.6579
ACC_std: 0.0052
F1_mean: 0.6442
F1_std: 0.0109
AUROC_mean: 0.7168
AUROC_std: 0.0035
AUPR_mean: 0.7075
AUPR_std: 0.0031
0it [00:00, ?it/s]1it [34:27, 2067.05s/it]2it [1:09:07, 2074.84s/it]3it [1:41:44, 2021.26s/it]4it [2:14:06, 1990.00s/it]5it [2:46:18, 1968.89s/it]5it [2:46:18, 1995.67s/it]
[I 2025-04-20 02:28:28,962] Trial 104 finished with values: [0.7117212495981085, 0.7031486472777673, 0.6315877541595245, 0.6537472804625064] and parameters: {'dropout1': 0.1, 'dropout2': 0.5, 'hidden1': 358, 'hidden2': 172, 'hidden3': 154, 'epochs': 6900, 'heads': 6, 'activation': 'relu', 'optimizer': 'Adam', 'lr': 6.928985475683915e-05, 'weight_decay': 3.9876548278352885e-06, 'scheduler': None}.
Using device: cuda
Best model found at epoch 6900
Using device: cuda
Best model found at epoch 6900
Using device: cuda
Best model found at epoch 6900
Using device: cuda
Best model found at epoch 6900
Using device: cuda
Best model found at epoch 6900
ACC_mean: 0.6537
ACC_std: 0.0046
F1_mean: 0.6316
F1_std: 0.0050
AUROC_mean: 0.7117
AUROC_std: 0.0023
AUPR_mean: 0.7031
AUPR_std: 0.0016
0it [00:00, ?it/s]0it [18:10, ?it/s]
[I 2025-04-20 02:46:40,140] Trial 123 pruned. NaN input at trial 123
Using device: cuda
Pruned trial 123: Input contains NaN
0it [00:00, ?it/s]1it [10:38, 638.95s/it]2it [21:16, 638.26s/it]3it [31:54, 638.00s/it]4it [42:31, 637.46s/it]5it [53:06, 636.85s/it]5it [53:06, 637.36s/it]
[I 2025-04-20 03:39:48,825] Trial 125 finished with values: [0.7223195010323546, 0.7148960242008483, 0.6401782204161233, 0.661042307576228] and parameters: {'dropout1': 0.35, 'dropout2': 0.1, 'hidden1': 904, 'hidden2': 298, 'hidden3': 174, 'epochs': 2100, 'heads': 5, 'activation': 'gelu', 'optimizer': 'Adam', 'lr': 0.0002218898927358775, 'weight_decay': 0.0010965707885502057, 'scheduler': 'Cosine', 'T_max': 1039}.
Using device: cuda
Best model found at epoch 2100
Using device: cuda
Best model found at epoch 2100
Using device: cuda
Best model found at epoch 2100
Using device: cuda
Best model found at epoch 2100
Using device: cuda
Best model found at epoch 2100
ACC_mean: 0.6610
ACC_std: 0.0050
F1_mean: 0.6402
F1_std: 0.0191
AUROC_mean: 0.7223
AUROC_std: 0.0025
AUPR_mean: 0.7149
AUPR_std: 0.0021
0it [00:00, ?it/s]1it [49:07, 2947.94s/it]2it [1:38:12, 2945.71s/it]3it [2:27:59, 2964.61s/it]4it [3:18:38, 2994.16s/it]5it [4:08:40, 2997.05s/it]5it [4:08:40, 2984.17s/it]
[I 2025-04-20 07:48:31,420] Trial 130 finished with values: [0.700288756342488, 0.6922824624857716, 0.6260535519961494, 0.644133388981613] and parameters: {'dropout1': 0.35, 'dropout2': 0.35, 'hidden1': 270, 'hidden2': 207, 'hidden3': 84, 'epochs': 9900, 'heads': 8, 'activation': 'gelu', 'optimizer': 'AdamW', 'lr': 0.0007732612641831245, 'weight_decay': 9.489329069128993e-06, 'scheduler': None}.
Using device: cuda
Best model found at epoch 9900
Using device: cuda
Best model found at epoch 9900
Using device: cuda
Best model found at epoch 9900
Using device: cuda
Best model found at epoch 9900
Using device: cuda
Best model found at epoch 9900
ACC_mean: 0.6441
ACC_std: 0.0191
F1_mean: 0.6261
F1_std: 0.0242
AUROC_mean: 0.7003
AUROC_std: 0.0256
AUPR_mean: 0.6923
AUPR_std: 0.0241
0it [00:00, ?it/s]1it [44:05, 2645.33s/it]2it [1:28:05, 2642.42s/it]3it [2:12:44, 2659.20s/it]4it [2:57:16, 2664.27s/it]5it [3:41:40, 2664.05s/it]5it [3:41:40, 2660.12s/it]
[I 2025-04-20 11:30:13,976] Trial 156 finished with values: [0.7103650033992996, 0.7017851085410325, 0.6315854653503417, 0.6518726135356516] and parameters: {'dropout1': 0.2, 'dropout2': 0.25, 'hidden1': 591, 'hidden2': 275, 'hidden3': 201, 'epochs': 7300, 'heads': 7, 'activation': 'relu', 'optimizer': 'AdamW', 'lr': 2.735699135644965e-05, 'weight_decay': 0.0010965707885502057, 'scheduler': None}.
[W 2025-04-20 11:30:14,499] Trial 175 failed with parameters: {} because of the following error: ValueError('setting an array element with a sequence. The requested array has an inhomogeneous shape after 1 dimensions. The detected shape was (107,) + inhomogeneous part.').
Traceback (most recent call last):
  File "/panfs/jay/groups/33/kuangr/inoue019/conda-envs/myenv/lib/python3.10/site-packages/optuna/study/_optimize.py", line 197, in _run_trial
    value_or_values = func(trial)
  File "/users/4/inoue019/drGAT/zero_pad/t_small_GT.py", line 40, in objective
    "dropout1": trial.suggest_float("dropout1", 0.1, 0.5, step=0.05),
  File "/panfs/jay/groups/33/kuangr/inoue019/conda-envs/myenv/lib/python3.10/site-packages/optuna/trial/_trial.py", line 161, in suggest_float
    suggested_value = self._suggest(name, distribution)
  File "/panfs/jay/groups/33/kuangr/inoue019/conda-envs/myenv/lib/python3.10/site-packages/optuna/trial/_trial.py", line 627, in _suggest
    elif self._is_relative_param(name, distribution):
  File "/panfs/jay/groups/33/kuangr/inoue019/conda-envs/myenv/lib/python3.10/site-packages/optuna/trial/_trial.py", line 659, in _is_relative_param
    if name not in self.relative_params:
  File "/panfs/jay/groups/33/kuangr/inoue019/conda-envs/myenv/lib/python3.10/site-packages/optuna/trial/_trial.py", line 71, in relative_params
    self._relative_params = self.study.sampler.sample_relative(
  File "/panfs/jay/groups/33/kuangr/inoue019/conda-envs/myenv/lib/python3.10/site-packages/optuna/samplers/nsgaii/_sampler.py", line 269, in sample_relative
    parent_population = self.get_parent_population(study, generation)
  File "/panfs/jay/groups/33/kuangr/inoue019/conda-envs/myenv/lib/python3.10/site-packages/optuna/samplers/_ga/_base.py", line 176, in get_parent_population
    parent_population = self.select_parent(study, generation)
  File "/panfs/jay/groups/33/kuangr/inoue019/conda-envs/myenv/lib/python3.10/site-packages/optuna/samplers/nsgaii/_sampler.py", line 256, in select_parent
    return self._elite_population_selection_strategy(
  File "/panfs/jay/groups/33/kuangr/inoue019/conda-envs/myenv/lib/python3.10/site-packages/optuna/samplers/nsgaii/_elite_population_selection_strategy.py", line 47, in __call__
    population_per_rank = _rank_population(
  File "/panfs/jay/groups/33/kuangr/inoue019/conda-envs/myenv/lib/python3.10/site-packages/optuna/samplers/nsgaii/_elite_population_selection_strategy.py", line 126, in _rank_population
    objective_values = np.array([trial.values for trial in population], dtype=np.float64)
ValueError: setting an array element with a sequence. The requested array has an inhomogeneous shape after 1 dimensions. The detected shape was (107,) + inhomogeneous part.
[W 2025-04-20 11:30:14,552] Trial 175 failed with value None.
Using device: cuda
Best model found at epoch 7300
Using device: cuda
Best model found at epoch 7300
Using device: cuda
Best model found at epoch 7300
Using device: cuda
Best model found at epoch 7300
Using device: cuda
Best model found at epoch 7300
ACC_mean: 0.6519
ACC_std: 0.0041
F1_mean: 0.6316
F1_std: 0.0064
AUROC_mean: 0.7104
AUROC_std: 0.0023
AUPR_mean: 0.7018
AUPR_std: 0.0011
Traceback (most recent call last):
  File "/users/4/inoue019/drGAT/zero_pad/t_small_GT.py", line 162, in <module>
    study.optimize(objective, n_trials=1000)
  File "/panfs/jay/groups/33/kuangr/inoue019/conda-envs/myenv/lib/python3.10/site-packages/optuna/study/study.py", line 475, in optimize
    _optimize(
  File "/panfs/jay/groups/33/kuangr/inoue019/conda-envs/myenv/lib/python3.10/site-packages/optuna/study/_optimize.py", line 63, in _optimize
    _optimize_sequential(
  File "/panfs/jay/groups/33/kuangr/inoue019/conda-envs/myenv/lib/python3.10/site-packages/optuna/study/_optimize.py", line 160, in _optimize_sequential
    frozen_trial = _run_trial(study, func, catch)
  File "/panfs/jay/groups/33/kuangr/inoue019/conda-envs/myenv/lib/python3.10/site-packages/optuna/study/_optimize.py", line 248, in _run_trial
    raise func_err
  File "/panfs/jay/groups/33/kuangr/inoue019/conda-envs/myenv/lib/python3.10/site-packages/optuna/study/_optimize.py", line 197, in _run_trial
    value_or_values = func(trial)
  File "/users/4/inoue019/drGAT/zero_pad/t_small_GT.py", line 40, in objective
    "dropout1": trial.suggest_float("dropout1", 0.1, 0.5, step=0.05),
  File "/panfs/jay/groups/33/kuangr/inoue019/conda-envs/myenv/lib/python3.10/site-packages/optuna/trial/_trial.py", line 161, in suggest_float
    suggested_value = self._suggest(name, distribution)
  File "/panfs/jay/groups/33/kuangr/inoue019/conda-envs/myenv/lib/python3.10/site-packages/optuna/trial/_trial.py", line 627, in _suggest
    elif self._is_relative_param(name, distribution):
  File "/panfs/jay/groups/33/kuangr/inoue019/conda-envs/myenv/lib/python3.10/site-packages/optuna/trial/_trial.py", line 659, in _is_relative_param
    if name not in self.relative_params:
  File "/panfs/jay/groups/33/kuangr/inoue019/conda-envs/myenv/lib/python3.10/site-packages/optuna/trial/_trial.py", line 71, in relative_params
    self._relative_params = self.study.sampler.sample_relative(
  File "/panfs/jay/groups/33/kuangr/inoue019/conda-envs/myenv/lib/python3.10/site-packages/optuna/samplers/nsgaii/_sampler.py", line 269, in sample_relative
    parent_population = self.get_parent_population(study, generation)
  File "/panfs/jay/groups/33/kuangr/inoue019/conda-envs/myenv/lib/python3.10/site-packages/optuna/samplers/_ga/_base.py", line 176, in get_parent_population
    parent_population = self.select_parent(study, generation)
  File "/panfs/jay/groups/33/kuangr/inoue019/conda-envs/myenv/lib/python3.10/site-packages/optuna/samplers/nsgaii/_sampler.py", line 256, in select_parent
    return self._elite_population_selection_strategy(
  File "/panfs/jay/groups/33/kuangr/inoue019/conda-envs/myenv/lib/python3.10/site-packages/optuna/samplers/nsgaii/_elite_population_selection_strategy.py", line 47, in __call__
    population_per_rank = _rank_population(
  File "/panfs/jay/groups/33/kuangr/inoue019/conda-envs/myenv/lib/python3.10/site-packages/optuna/samplers/nsgaii/_elite_population_selection_strategy.py", line 126, in _rank_population
    objective_values = np.array([trial.values for trial in population], dtype=np.float64)
ValueError: setting an array element with a sequence. The requested array has an inhomogeneous shape after 1 dimensions. The detected shape was (107,) + inhomogeneous part.
