Not a conda environment: /scratch.global/inoue019/myenv
load nci
unique drugs: 177
unique genes: 251
DTI unique genes:  251
Top 90% variable genes:  2383
Total:  2582
Final gene exp shape: (60, 2582)
Final drug Act shape: (1005, 60)
  0%|          | 0/25 [00:00<?, ?it/s]  4%|▍         | 1/25 [00:01<00:40,  1.68s/it]  8%|▊         | 2/25 [00:01<00:18,  1.25it/s] 12%|█▏        | 3/25 [00:02<00:11,  1.92it/s] 16%|█▌        | 4/25 [00:02<00:07,  2.65it/s] 20%|██        | 5/25 [00:02<00:06,  3.31it/s] 24%|██▍       | 6/25 [00:02<00:04,  3.87it/s] 28%|██▊       | 7/25 [00:02<00:04,  4.36it/s] 32%|███▏      | 8/25 [00:02<00:03,  4.70it/s] 36%|███▌      | 9/25 [00:03<00:03,  5.00it/s] 40%|████      | 10/25 [00:03<00:02,  5.23it/s] 44%|████▍     | 11/25 [00:03<00:02,  5.37it/s] 48%|████▊     | 12/25 [00:03<00:02,  5.47it/s] 52%|█████▏    | 13/25 [00:03<00:02,  5.56it/s] 56%|█████▌    | 14/25 [00:03<00:01,  5.61it/s] 60%|██████    | 15/25 [00:04<00:01,  5.71it/s] 64%|██████▍   | 16/25 [00:04<00:01,  5.85it/s] 68%|██████▊   | 17/25 [00:04<00:01,  5.84it/s] 72%|███████▏  | 18/25 [00:04<00:01,  6.13it/s] 76%|███████▌  | 19/25 [00:04<00:01,  5.98it/s] 80%|████████  | 20/25 [00:04<00:00,  6.08it/s] 84%|████████▍ | 21/25 [00:05<00:00,  6.17it/s] 88%|████████▊ | 22/25 [00:05<00:00,  6.06it/s] 92%|█████████▏| 23/25 [00:05<00:00,  6.06it/s] 96%|█████████▌| 24/25 [00:05<00:00,  6.20it/s]100%|██████████| 25/25 [00:05<00:00,  6.31it/s]100%|██████████| 25/25 [00:05<00:00,  4.37it/s]
[I 2025-04-19 12:08:06,863] Using an existing study with name 'Transformer' instead of creating a new one.
Done!
0it [00:00, ?it/s]1it [53:42, 3222.72s/it]2it [1:47:02, 3209.27s/it]3it [2:40:23, 3205.35s/it]4it [3:33:42, 3203.06s/it]5it [4:27:07, 3203.70s/it]5it [4:27:07, 3205.53s/it]
[I 2025-04-19 16:35:18,033] Trial 4 finished with values: [0.7128278277177453, 0.7039587842231578, 0.6320415065068323, 0.6535802253741547] and parameters: {'dropout1': 0.25, 'dropout2': 0.30000000000000004, 'hidden1': 562, 'hidden2': 473, 'hidden3': 237, 'epochs': 6400, 'heads': 7, 'activation': 'gelu', 'optimizer': 'Adam', 'lr': 0.00043329295632027633, 'weight_decay': 7.394492904455329e-06, 'scheduler': 'Cosine', 'T_max': 2737}.
Using device: cuda
Best model found at epoch 6400
Using device: cuda
Best model found at epoch 6400
Using device: cuda
Best model found at epoch 6400
Using device: cuda
Best model found at epoch 6400
Using device: cuda
Best model found at epoch 6400
ACC_mean: 0.6536
ACC_std: 0.0049
F1_mean: 0.6320
F1_std: 0.0047
AUROC_mean: 0.7128
AUROC_std: 0.0029
AUPR_mean: 0.7040
AUPR_std: 0.0017
0it [00:00, ?it/s]1it [26:23, 1583.37s/it]2it [53:09, 1596.81s/it]2it [55:29, 1664.79s/it]
[I 2025-04-19 17:30:48,743] Trial 51 pruned. NaN input at trial 51
Using device: cuda
Best model found at epoch 4800
Using device: cuda
Best model found at epoch 4800
Using device: cuda
Pruned trial 51: Input contains NaN
0it [00:00, ?it/s]1it [32:44, 1964.34s/it]2it [1:05:20, 1959.35s/it]3it [1:37:46, 1953.24s/it]4it [2:10:08, 1948.78s/it]5it [2:42:20, 1942.98s/it]5it [2:42:20, 1948.16s/it]
[I 2025-04-19 20:13:10,768] Trial 60 finished with values: [0.7173480579488934, 0.7096753636135318, 0.6336063768377358, 0.6564575260163976] and parameters: {'dropout1': 0.35, 'dropout2': 0.25, 'hidden1': 946, 'hidden2': 289, 'hidden3': 81, 'epochs': 7000, 'heads': 3, 'activation': 'gelu', 'optimizer': 'Adam', 'lr': 6.928985475683915e-05, 'weight_decay': 6.802636807925919e-05, 'scheduler': None}.
Using device: cuda
Best model found at epoch 7000
Using device: cuda
Best model found at epoch 7000
Using device: cuda
Best model found at epoch 7000
Using device: cuda
Best model found at epoch 7000
Using device: cuda
Best model found at epoch 7000
ACC_mean: 0.6565
ACC_std: 0.0039
F1_mean: 0.6336
F1_std: 0.0120
AUROC_mean: 0.7173
AUROC_std: 0.0018
AUPR_mean: 0.7097
AUPR_std: 0.0019
0it [00:00, ?it/s]1it [49:25, 2965.91s/it]2it [1:38:54, 2967.24s/it]3it [2:28:25, 2969.00s/it]4it [3:18:00, 2971.46s/it]5it [4:07:37, 2973.52s/it]5it [4:07:37, 2971.52s/it]
[I 2025-04-20 00:20:49,682] Trial 83 finished with values: [0.7107689521781667, 0.7020571536309422, 0.6392477224175479, 0.6530420301616984] and parameters: {'dropout1': 0.25, 'dropout2': 0.4, 'hidden1': 756, 'hidden2': 176, 'hidden3': 160, 'epochs': 9300, 'heads': 6, 'activation': 'relu', 'optimizer': 'AdamW', 'lr': 3.1385028182138364e-05, 'weight_decay': 0.003965305177325889, 'scheduler': None}.
Using device: cuda
Best model found at epoch 9300
Using device: cuda
Best model found at epoch 9300
Using device: cuda
Best model found at epoch 9300
Using device: cuda
Best model found at epoch 9300
Using device: cuda
Best model found at epoch 9300
ACC_mean: 0.6530
ACC_std: 0.0036
F1_mean: 0.6392
F1_std: 0.0051
AUROC_mean: 0.7108
AUROC_std: 0.0024
AUPR_mean: 0.7021
AUPR_std: 0.0016
0it [00:00, ?it/s]1it [21:54, 1314.88s/it]2it [44:16, 1330.81s/it]3it [1:06:37, 1335.22s/it]4it [1:29:02, 1339.02s/it]5it [1:51:14, 1336.46s/it]5it [1:51:14, 1334.81s/it]
[I 2025-04-20 02:12:05,763] Trial 105 finished with values: [0.7053114107188841, 0.697726483597478, 0.5623588850974237, 0.6354260008111584] and parameters: {'dropout1': 0.35, 'dropout2': 0.15000000000000002, 'hidden1': 778, 'hidden2': 495, 'hidden3': 155, 'epochs': 4800, 'heads': 2, 'activation': 'relu', 'optimizer': 'Adam', 'lr': 0.001673956972454742, 'weight_decay': 4.9417944003164285e-05, 'scheduler': 'Cosine', 'T_max': 1073}.
Using device: cuda
Best model found at epoch 4800
Using device: cuda
Best model found at epoch 4800
Using device: cuda
Best model found at epoch 4800
Using device: cuda
Best model found at epoch 4800
Using device: cuda
Best model found at epoch 4800
ACC_mean: 0.6354
ACC_std: 0.0307
F1_mean: 0.5624
F1_std: 0.1251
AUROC_mean: 0.7053
AUROC_std: 0.0082
AUPR_mean: 0.6977
AUPR_std: 0.0070
0it [00:00, ?it/s]0it [04:56, ?it/s]
[I 2025-04-20 02:17:03,525] Trial 120 pruned. NaN input at trial 120
Using device: cuda
Pruned trial 120: Input contains NaN
0it [00:00, ?it/s]1it [03:53, 233.15s/it]2it [07:45, 232.89s/it]3it [11:38, 232.98s/it]4it [15:32, 233.04s/it]5it [19:24, 232.88s/it]5it [19:24, 232.94s/it]
[I 2025-04-20 02:36:29,909] Trial 121 finished with values: [0.7198916929412352, 0.7101400063834531, 0.6484537161693447, 0.6579424758302762] and parameters: {'dropout1': 0.2, 'dropout2': 0.2, 'hidden1': 557, 'hidden2': 373, 'hidden3': 89, 'epochs': 800, 'heads': 3, 'activation': 'relu', 'optimizer': 'AdamW', 'lr': 2.735699135644965e-05, 'weight_decay': 4.188069717404964e-06, 'scheduler': None}.
Using device: cuda
Best model found at epoch 800
Using device: cuda
Best model found at epoch 800
Using device: cuda
Best model found at epoch 800
Using device: cuda
Best model found at epoch 800
Using device: cuda
Best model found at epoch 800
ACC_mean: 0.6579
ACC_std: 0.0046
F1_mean: 0.6485
F1_std: 0.0245
AUROC_mean: 0.7199
AUROC_std: 0.0020
AUPR_mean: 0.7101
AUPR_std: 0.0032
0it [00:00, ?it/s]1it [28:16, 1696.88s/it]2it [56:31, 1695.35s/it]3it [1:24:44, 1694.22s/it]4it [1:52:57, 1693.90s/it]5it [2:21:09, 1693.28s/it]5it [2:21:09, 1693.92s/it]
[I 2025-04-20 04:57:40,974] Trial 124 finished with values: [0.7242208554089352, 0.7159957776886963, 0.6310687313739409, 0.660541073405428] and parameters: {'dropout1': 0.15000000000000002, 'dropout2': 0.1, 'hidden1': 541, 'hidden2': 191, 'hidden3': 150, 'epochs': 5900, 'heads': 4, 'activation': 'relu', 'optimizer': 'Adam', 'lr': 0.000677542342790328, 'weight_decay': 0.00016079819818505325, 'scheduler': None}.
Using device: cuda
Best model found at epoch 5900
Using device: cuda
Best model found at epoch 5900
Using device: cuda
Best model found at epoch 5900
Using device: cuda
Best model found at epoch 5900
Using device: cuda
Best model found at epoch 5900
ACC_mean: 0.6605
ACC_std: 0.0056
F1_mean: 0.6311
F1_std: 0.0219
AUROC_mean: 0.7242
AUROC_std: 0.0034
AUPR_mean: 0.7160
AUPR_std: 0.0023
0it [00:00, ?it/s]1it [34:28, 2068.14s/it]2it [1:08:55, 2067.46s/it]3it [1:43:22, 2067.23s/it]4it [2:17:55, 2069.54s/it]5it [2:52:30, 2071.54s/it]5it [2:52:30, 2070.05s/it]
[I 2025-04-20 07:50:13,043] Trial 142 finished with values: [0.7239217670014335, 0.7152104034861834, 0.6507955805475388, 0.6634922375611004] and parameters: {'dropout1': 0.2, 'dropout2': 0.35, 'hidden1': 536, 'hidden2': 214, 'hidden3': 63, 'epochs': 6300, 'heads': 8, 'activation': 'relu', 'optimizer': 'Adam', 'lr': 0.000677542342790328, 'weight_decay': 0.00016079819818505325, 'scheduler': 'Cosine', 'T_max': 2578}.
Using device: cuda
Best model found at epoch 6300
Using device: cuda
Best model found at epoch 6300
Using device: cuda
Best model found at epoch 6300
Using device: cuda
Best model found at epoch 6300
Using device: cuda
Best model found at epoch 6300
ACC_mean: 0.6635
ACC_std: 0.0045
F1_mean: 0.6508
F1_std: 0.0039
AUROC_mean: 0.7239
AUROC_std: 0.0025
AUPR_mean: 0.7152
AUPR_std: 0.0021
0it [00:00, ?it/s]0it [00:09, ?it/s]
[I 2025-04-20 07:50:23,105] Trial 157 pruned. NaN input at trial 157
Using device: cuda
Pruned trial 157: Input contains NaN
0it [00:00, ?it/s]1it [34:29, 2069.55s/it]2it [1:09:05, 2073.11s/it]3it [1:43:44, 2076.10s/it]4it [2:17:57, 2066.82s/it]5it [2:52:23, 2066.50s/it]5it [2:52:23, 2068.67s/it]
[I 2025-04-20 10:42:48,235] Trial 158 finished with values: [0.712836815211577, 0.7049318374995517, 0.6332335135983008, 0.6541371767304196] and parameters: {'dropout1': 0.45000000000000007, 'dropout2': 0.2, 'hidden1': 829, 'hidden2': 493, 'hidden3': 215, 'epochs': 4300, 'heads': 7, 'activation': 'relu', 'optimizer': 'AdamW', 'lr': 0.00010269349421645671, 'weight_decay': 0.0027795890596191016, 'scheduler': 'Cosine', 'T_max': 1583}.
[W 2025-04-20 10:42:48,532] Trial 172 failed with parameters: {} because of the following error: ValueError('setting an array element with a sequence. The requested array has an inhomogeneous shape after 1 dimensions. The detected shape was (104,) + inhomogeneous part.').
Traceback (most recent call last):
  File "/panfs/jay/groups/33/kuangr/inoue019/conda-envs/myenv/lib/python3.10/site-packages/optuna/study/_optimize.py", line 197, in _run_trial
    value_or_values = func(trial)
  File "/users/4/inoue019/drGAT/zero_pad/t_small_GT.py", line 40, in objective
    "dropout1": trial.suggest_float("dropout1", 0.1, 0.5, step=0.05),
  File "/panfs/jay/groups/33/kuangr/inoue019/conda-envs/myenv/lib/python3.10/site-packages/optuna/trial/_trial.py", line 161, in suggest_float
    suggested_value = self._suggest(name, distribution)
  File "/panfs/jay/groups/33/kuangr/inoue019/conda-envs/myenv/lib/python3.10/site-packages/optuna/trial/_trial.py", line 627, in _suggest
    elif self._is_relative_param(name, distribution):
  File "/panfs/jay/groups/33/kuangr/inoue019/conda-envs/myenv/lib/python3.10/site-packages/optuna/trial/_trial.py", line 659, in _is_relative_param
    if name not in self.relative_params:
  File "/panfs/jay/groups/33/kuangr/inoue019/conda-envs/myenv/lib/python3.10/site-packages/optuna/trial/_trial.py", line 71, in relative_params
    self._relative_params = self.study.sampler.sample_relative(
  File "/panfs/jay/groups/33/kuangr/inoue019/conda-envs/myenv/lib/python3.10/site-packages/optuna/samplers/nsgaii/_sampler.py", line 269, in sample_relative
    parent_population = self.get_parent_population(study, generation)
  File "/panfs/jay/groups/33/kuangr/inoue019/conda-envs/myenv/lib/python3.10/site-packages/optuna/samplers/_ga/_base.py", line 176, in get_parent_population
    parent_population = self.select_parent(study, generation)
  File "/panfs/jay/groups/33/kuangr/inoue019/conda-envs/myenv/lib/python3.10/site-packages/optuna/samplers/nsgaii/_sampler.py", line 256, in select_parent
    return self._elite_population_selection_strategy(
  File "/panfs/jay/groups/33/kuangr/inoue019/conda-envs/myenv/lib/python3.10/site-packages/optuna/samplers/nsgaii/_elite_population_selection_strategy.py", line 47, in __call__
    population_per_rank = _rank_population(
  File "/panfs/jay/groups/33/kuangr/inoue019/conda-envs/myenv/lib/python3.10/site-packages/optuna/samplers/nsgaii/_elite_population_selection_strategy.py", line 126, in _rank_population
    objective_values = np.array([trial.values for trial in population], dtype=np.float64)
ValueError: setting an array element with a sequence. The requested array has an inhomogeneous shape after 1 dimensions. The detected shape was (104,) + inhomogeneous part.
[W 2025-04-20 10:42:48,535] Trial 172 failed with value None.
Using device: cuda
Best model found at epoch 4300
Using device: cuda
Best model found at epoch 4300
Using device: cuda
Best model found at epoch 4300
Using device: cuda
Best model found at epoch 4300
Using device: cuda
Best model found at epoch 4300
ACC_mean: 0.6541
ACC_std: 0.0037
F1_mean: 0.6332
F1_std: 0.0049
AUROC_mean: 0.7128
AUROC_std: 0.0020
AUPR_mean: 0.7049
AUPR_std: 0.0011
Traceback (most recent call last):
  File "/users/4/inoue019/drGAT/zero_pad/t_small_GT.py", line 162, in <module>
    study.optimize(objective, n_trials=1000)
  File "/panfs/jay/groups/33/kuangr/inoue019/conda-envs/myenv/lib/python3.10/site-packages/optuna/study/study.py", line 475, in optimize
    _optimize(
  File "/panfs/jay/groups/33/kuangr/inoue019/conda-envs/myenv/lib/python3.10/site-packages/optuna/study/_optimize.py", line 63, in _optimize
    _optimize_sequential(
  File "/panfs/jay/groups/33/kuangr/inoue019/conda-envs/myenv/lib/python3.10/site-packages/optuna/study/_optimize.py", line 160, in _optimize_sequential
    frozen_trial = _run_trial(study, func, catch)
  File "/panfs/jay/groups/33/kuangr/inoue019/conda-envs/myenv/lib/python3.10/site-packages/optuna/study/_optimize.py", line 248, in _run_trial
    raise func_err
  File "/panfs/jay/groups/33/kuangr/inoue019/conda-envs/myenv/lib/python3.10/site-packages/optuna/study/_optimize.py", line 197, in _run_trial
    value_or_values = func(trial)
  File "/users/4/inoue019/drGAT/zero_pad/t_small_GT.py", line 40, in objective
    "dropout1": trial.suggest_float("dropout1", 0.1, 0.5, step=0.05),
  File "/panfs/jay/groups/33/kuangr/inoue019/conda-envs/myenv/lib/python3.10/site-packages/optuna/trial/_trial.py", line 161, in suggest_float
    suggested_value = self._suggest(name, distribution)
  File "/panfs/jay/groups/33/kuangr/inoue019/conda-envs/myenv/lib/python3.10/site-packages/optuna/trial/_trial.py", line 627, in _suggest
    elif self._is_relative_param(name, distribution):
  File "/panfs/jay/groups/33/kuangr/inoue019/conda-envs/myenv/lib/python3.10/site-packages/optuna/trial/_trial.py", line 659, in _is_relative_param
    if name not in self.relative_params:
  File "/panfs/jay/groups/33/kuangr/inoue019/conda-envs/myenv/lib/python3.10/site-packages/optuna/trial/_trial.py", line 71, in relative_params
    self._relative_params = self.study.sampler.sample_relative(
  File "/panfs/jay/groups/33/kuangr/inoue019/conda-envs/myenv/lib/python3.10/site-packages/optuna/samplers/nsgaii/_sampler.py", line 269, in sample_relative
    parent_population = self.get_parent_population(study, generation)
  File "/panfs/jay/groups/33/kuangr/inoue019/conda-envs/myenv/lib/python3.10/site-packages/optuna/samplers/_ga/_base.py", line 176, in get_parent_population
    parent_population = self.select_parent(study, generation)
  File "/panfs/jay/groups/33/kuangr/inoue019/conda-envs/myenv/lib/python3.10/site-packages/optuna/samplers/nsgaii/_sampler.py", line 256, in select_parent
    return self._elite_population_selection_strategy(
  File "/panfs/jay/groups/33/kuangr/inoue019/conda-envs/myenv/lib/python3.10/site-packages/optuna/samplers/nsgaii/_elite_population_selection_strategy.py", line 47, in __call__
    population_per_rank = _rank_population(
  File "/panfs/jay/groups/33/kuangr/inoue019/conda-envs/myenv/lib/python3.10/site-packages/optuna/samplers/nsgaii/_elite_population_selection_strategy.py", line 126, in _rank_population
    objective_values = np.array([trial.values for trial in population], dtype=np.float64)
ValueError: setting an array element with a sequence. The requested array has an inhomogeneous shape after 1 dimensions. The detected shape was (104,) + inhomogeneous part.
