Not a conda environment: /scratch.global/inoue019/myenv
load nci
unique drugs: 177
unique genes: 251
DTI unique genes:  251
Top 90% variable genes:  2383
Total:  2582
Final gene exp shape: (60, 2582)
Final drug Act shape: (1005, 60)
  0%|          | 0/25 [00:00<?, ?it/s]  4%|▍         | 1/25 [00:01<00:43,  1.79s/it]  8%|▊         | 2/25 [00:01<00:19,  1.19it/s] 12%|█▏        | 3/25 [00:02<00:11,  1.86it/s] 16%|█▌        | 4/25 [00:02<00:08,  2.58it/s] 20%|██        | 5/25 [00:02<00:05,  3.38it/s] 24%|██▍       | 6/25 [00:02<00:04,  4.05it/s] 28%|██▊       | 7/25 [00:02<00:03,  4.63it/s] 32%|███▏      | 8/25 [00:02<00:03,  5.10it/s] 36%|███▌      | 9/25 [00:03<00:02,  5.50it/s] 40%|████      | 10/25 [00:03<00:02,  5.84it/s] 44%|████▍     | 11/25 [00:03<00:02,  6.17it/s] 48%|████▊     | 12/25 [00:03<00:01,  6.55it/s] 52%|█████▏    | 13/25 [00:03<00:01,  6.86it/s] 56%|█████▌    | 14/25 [00:03<00:01,  6.77it/s] 60%|██████    | 15/25 [00:03<00:01,  6.77it/s] 64%|██████▍   | 16/25 [00:04<00:01,  6.59it/s] 68%|██████▊   | 17/25 [00:04<00:01,  6.68it/s] 72%|███████▏  | 18/25 [00:04<00:01,  6.97it/s] 76%|███████▌  | 19/25 [00:04<00:00,  6.95it/s] 80%|████████  | 20/25 [00:04<00:00,  7.10it/s] 84%|████████▍ | 21/25 [00:04<00:00,  7.42it/s] 88%|████████▊ | 22/25 [00:04<00:00,  7.29it/s] 92%|█████████▏| 23/25 [00:04<00:00,  7.50it/s] 96%|█████████▌| 24/25 [00:05<00:00,  7.35it/s]100%|██████████| 25/25 [00:05<00:00,  7.27it/s]100%|██████████| 25/25 [00:05<00:00,  4.74it/s]
[I 2025-04-19 12:08:06,870] Using an existing study with name 'Transformer' instead of creating a new one.
Done!
0it [00:00, ?it/s]0it [22:56, ?it/s]
[I 2025-04-19 12:31:05,945] Trial 5 pruned. NaN input at trial 5
Using device: cuda
Pruned trial 5: Input contains NaN
0it [00:00, ?it/s]1it [14:56, 896.25s/it]2it [29:51, 895.64s/it]3it [44:36, 890.85s/it]4it [59:34, 893.58s/it]5it [1:14:31, 894.95s/it]5it [1:14:31, 894.35s/it]
[I 2025-04-19 13:45:38,885] Trial 21 finished with values: [0.7219674290879791, 0.7121414953020206, 0.6323499306277834, 0.6593342719673927] and parameters: {'dropout1': 0.5, 'dropout2': 0.1, 'hidden1': 904, 'hidden2': 354, 'hidden3': 213, 'epochs': 2100, 'heads': 7, 'activation': 'gelu', 'optimizer': 'Adam', 'lr': 0.0002218898927358775, 'weight_decay': 0.0010965707885502057, 'scheduler': 'Cosine', 'T_max': 930}.
Using device: cuda
Best model found at epoch 2100
Using device: cuda
Best model found at epoch 2100
Using device: cuda
Best model found at epoch 2100
Using device: cuda
Best model found at epoch 2100
Using device: cuda
Best model found at epoch 2100
ACC_mean: 0.6593
ACC_std: 0.0068
F1_mean: 0.6323
F1_std: 0.0247
AUROC_mean: 0.7220
AUROC_std: 0.0046
AUPR_mean: 0.7121
AUPR_std: 0.0023
0it [00:00, ?it/s]1it [28:45, 1725.30s/it]2it [57:46, 1734.61s/it]3it [1:26:06, 1718.76s/it]4it [1:52:57, 1676.45s/it]5it [2:20:05, 1658.90s/it]5it [2:20:05, 1681.14s/it]
[I 2025-04-19 16:05:46,002] Trial 33 finished with values: [0.7165702390574932, 0.708209200592871, 0.6350770323116353, 0.6564388422236215] and parameters: {'dropout1': 0.15000000000000002, 'dropout2': 0.35, 'hidden1': 804, 'hidden2': 457, 'hidden3': 142, 'epochs': 6600, 'heads': 2, 'activation': 'relu', 'optimizer': 'Adam', 'lr': 3.0469417994057602e-05, 'weight_decay': 3.024974097160774e-05, 'scheduler': 'Cosine', 'T_max': 2522}.
Using device: cuda
Best model found at epoch 6600
Using device: cuda
Best model found at epoch 6600
Using device: cuda
Best model found at epoch 6600
Using device: cuda
Best model found at epoch 6600
Using device: cuda
Best model found at epoch 6600
ACC_mean: 0.6564
ACC_std: 0.0045
F1_mean: 0.6351
F1_std: 0.0064
AUROC_mean: 0.7166
AUROC_std: 0.0022
AUPR_mean: 0.7082
AUPR_std: 0.0013
0it [00:00, ?it/s]1it [41:01, 2461.49s/it]2it [1:22:19, 2471.44s/it]3it [2:03:10, 2462.02s/it]4it [2:43:17, 2440.26s/it]5it [3:23:03, 2420.54s/it]5it [3:23:03, 2436.64s/it]
[I 2025-04-19 19:28:51,308] Trial 48 finished with values: [0.7140877395006551, 0.7056658964978766, 0.6341693388132873, 0.6553623794476764] and parameters: {'dropout1': 0.25, 'dropout2': 0.45000000000000007, 'hidden1': 289, 'hidden2': 223, 'hidden3': 97, 'epochs': 9500, 'heads': 4, 'activation': 'gelu', 'optimizer': 'Adam', 'lr': 0.0006377347994958218, 'weight_decay': 1.3898552526094585e-06, 'scheduler': 'Cosine', 'T_max': 2611}.
Using device: cuda
Best model found at epoch 9500
Using device: cuda
Best model found at epoch 9500
Using device: cuda
Best model found at epoch 9500
Using device: cuda
Best model found at epoch 9500
Using device: cuda
Best model found at epoch 9500
ACC_mean: 0.6554
ACC_std: 0.0029
F1_mean: 0.6342
F1_std: 0.0084
AUROC_mean: 0.7141
AUROC_std: 0.0033
AUPR_mean: 0.7057
AUPR_std: 0.0033
0it [00:00, ?it/s]1it [22:27, 1347.36s/it]2it [44:57, 1349.05s/it]3it [1:07:16, 1344.37s/it]4it [1:29:58, 1351.51s/it]5it [1:52:28, 1350.73s/it]5it [1:52:28, 1349.64s/it]
[I 2025-04-19 21:21:21,106] Trial 73 finished with values: [0.7186259807192863, 0.7098805197625617, 0.6441731414874428, 0.659093115640791] and parameters: {'dropout1': 0.45000000000000007, 'dropout2': 0.15000000000000002, 'hidden1': 949, 'hidden2': 441, 'hidden3': 169, 'epochs': 4300, 'heads': 4, 'activation': 'relu', 'optimizer': 'Adam', 'lr': 0.00010269349421645671, 'weight_decay': 2.8725578171271557e-05, 'scheduler': 'Cosine', 'T_max': 2073}.
Using device: cuda
Best model found at epoch 4300
Using device: cuda
Best model found at epoch 4300
Using device: cuda
Best model found at epoch 4300
Using device: cuda
Best model found at epoch 4300
Using device: cuda
Best model found at epoch 4300
ACC_mean: 0.6591
ACC_std: 0.0044
F1_mean: 0.6442
F1_std: 0.0079
AUROC_mean: 0.7186
AUROC_std: 0.0032
AUPR_mean: 0.7099
AUPR_std: 0.0030
0it [00:00, ?it/s]1it [19:01, 1141.12s/it]2it [37:58, 1138.78s/it]3it [56:56, 1138.56s/it]4it [1:16:24, 1150.22s/it]5it [1:35:50, 1155.74s/it]5it [1:35:50, 1150.03s/it]
[I 2025-04-19 22:57:12,651] Trial 89 finished with values: [0.7145919309471715, 0.7059075293635472, 0.6362925497288593, 0.6557334127678762] and parameters: {'dropout1': 0.1, 'dropout2': 0.35, 'hidden1': 373, 'hidden2': 358, 'hidden3': 50, 'epochs': 3700, 'heads': 6, 'activation': 'gelu', 'optimizer': 'AdamW', 'lr': 4.6433138816979275e-05, 'weight_decay': 2.4580109160807542e-06, 'scheduler': None}.
Using device: cuda
Best model found at epoch 3700
Using device: cuda
Best model found at epoch 3700
Using device: cuda
Best model found at epoch 3700
Using device: cuda
Best model found at epoch 3700
Using device: cuda
Best model found at epoch 3700
ACC_mean: 0.6557
ACC_std: 0.0052
F1_mean: 0.6363
F1_std: 0.0106
AUROC_mean: 0.7146
AUROC_std: 0.0026
AUPR_mean: 0.7059
AUPR_std: 0.0025
0it [00:00, ?it/s]0it [00:08, ?it/s]
[I 2025-04-19 22:57:21,690] Trial 100 pruned. NaN input at trial 100
Using device: cuda
Pruned trial 100: Input contains NaN
0it [00:00, ?it/s]1it [20:50, 1250.57s/it]2it [41:33, 1245.99s/it]3it [1:02:08, 1240.96s/it]4it [1:22:37, 1236.32s/it]5it [1:43:42, 1246.49s/it]5it [1:43:42, 1244.41s/it]
[I 2025-04-20 00:41:05,298] Trial 101 finished with values: [0.7214290787490245, 0.7120196788865077, 0.6476285450038455, 0.6624341588379404] and parameters: {'dropout1': 0.45000000000000007, 'dropout2': 0.35, 'hidden1': 628, 'hidden2': 69, 'hidden3': 42, 'epochs': 5200, 'heads': 8, 'activation': 'gelu', 'optimizer': 'AdamW', 'lr': 1.301809001520468e-05, 'weight_decay': 1.5022446092853378e-06, 'scheduler': None}.
Using device: cuda
Best model found at epoch 5200
Using device: cuda
Best model found at epoch 5200
Using device: cuda
Best model found at epoch 5200
Using device: cuda
Best model found at epoch 5200
Using device: cuda
Best model found at epoch 5200
ACC_mean: 0.6624
ACC_std: 0.0055
F1_mean: 0.6476
F1_std: 0.0135
AUROC_mean: 0.7214
AUROC_std: 0.0028
AUPR_mean: 0.7120
AUPR_std: 0.0021
0it [00:00, ?it/s]1it [00:29, 29.65s/it]2it [00:58, 29.37s/it]3it [01:28, 29.30s/it]4it [01:57, 29.24s/it]5it [02:26, 29.20s/it]5it [02:26, 29.26s/it]
[I 2025-04-20 00:43:33,131] Trial 107 finished with values: [0.6828670669284601, 0.6637241874516009, 0.6180956262673499, 0.6313437901935824] and parameters: {'dropout1': 0.2, 'dropout2': 0.1, 'hidden1': 629, 'hidden2': 146, 'hidden3': 117, 'epochs': 100, 'heads': 6, 'activation': 'gelu', 'optimizer': 'Adam', 'lr': 0.0005683865845377297, 'weight_decay': 0.0013105374548521302, 'scheduler': 'Cosine', 'T_max': 39}.
Using device: cuda
Best model found at epoch 100
Using device: cuda
Best model found at epoch 100
Using device: cuda
Best model found at epoch 100
Using device: cuda
Best model found at epoch 100
Using device: cuda
Best model found at epoch 100
ACC_mean: 0.6313
ACC_std: 0.0063
F1_mean: 0.6181
F1_std: 0.0252
AUROC_mean: 0.6829
AUROC_std: 0.0034
AUPR_mean: 0.6637
AUPR_std: 0.0006
0it [00:00, ?it/s]1it [41:53, 2513.18s/it]2it [1:23:24, 2500.54s/it]3it [2:05:02, 2498.99s/it]4it [2:46:55, 2504.86s/it]5it [3:29:01, 2512.47s/it]5it [3:29:01, 2508.37s/it]
[I 2025-04-20 04:12:36,553] Trial 108 finished with values: [0.7127006364821253, 0.7042767670044501, 0.6332079557451677, 0.6539514344040045] and parameters: {'dropout1': 0.25, 'dropout2': 0.4, 'hidden1': 292, 'hidden2': 93, 'hidden3': 69, 'epochs': 9500, 'heads': 8, 'activation': 'relu', 'optimizer': 'Adam', 'lr': 0.0006377347994958218, 'weight_decay': 1.3898552526094585e-06, 'scheduler': 'Cosine', 'T_max': 2493}.
Using device: cuda
Best model found at epoch 9500
Using device: cuda
Best model found at epoch 9500
Using device: cuda
Best model found at epoch 9500
Using device: cuda
Best model found at epoch 9500
Using device: cuda
Best model found at epoch 9500
ACC_mean: 0.6540
ACC_std: 0.0052
F1_mean: 0.6332
F1_std: 0.0066
AUROC_mean: 0.7127
AUROC_std: 0.0029
AUPR_mean: 0.7043
AUPR_std: 0.0017
0it [00:00, ?it/s]1it [43:08, 2588.66s/it]2it [1:26:21, 2591.37s/it]3it [2:09:26, 2588.29s/it]4it [2:52:21, 2583.02s/it]5it [3:35:17, 2580.67s/it]5it [3:35:17, 2583.60s/it]
[I 2025-04-20 07:47:56,160] Trial 136 finished with values: [0.714025438539325, 0.7058689554937587, 0.6400669849562648, 0.6559932149890942] and parameters: {'dropout1': 0.35, 'dropout2': 0.25, 'hidden1': 936, 'hidden2': 255, 'hidden3': 210, 'epochs': 7000, 'heads': 7, 'activation': 'gelu', 'optimizer': 'Adam', 'lr': 6.928985475683915e-05, 'weight_decay': 5.398136855290531e-05, 'scheduler': None}.
Using device: cuda
Best model found at epoch 7000
Using device: cuda
Best model found at epoch 7000
Using device: cuda
Best model found at epoch 7000
Using device: cuda
Best model found at epoch 7000
Using device: cuda
Best model found at epoch 7000
ACC_mean: 0.6560
ACC_std: 0.0054
F1_mean: 0.6401
F1_std: 0.0055
AUROC_mean: 0.7140
AUROC_std: 0.0032
AUPR_mean: 0.7059
AUPR_std: 0.0021
0it [00:00, ?it/s]0it [50:03, ?it/s]
[I 2025-04-20 08:38:01,073] Trial 155 pruned. NaN input at trial 155
Using device: cuda
Pruned trial 155: Input contains NaN
0it [00:00, ?it/s]0it [01:47, ?it/s]
[I 2025-04-20 08:39:49,580] Trial 162 pruned. NaN input at trial 162
Using device: cuda
Pruned trial 162: Input contains NaN
0it [00:00, ?it/s]1it [06:31, 391.03s/it]2it [13:04, 392.22s/it]3it [19:36, 392.47s/it]4it [26:09, 392.64s/it]5it [32:42, 392.74s/it]5it [32:42, 392.53s/it]
[I 2025-04-20 09:12:33,623] Trial 163 finished with values: [0.7208897961386649, 0.7126489671627535, 0.6376160847943001, 0.6597984761907912] and parameters: {'dropout1': 0.35, 'dropout2': 0.25, 'hidden1': 936, 'hidden2': 418, 'hidden3': 97, 'epochs': 1000, 'heads': 7, 'activation': 'gelu', 'optimizer': 'AdamW', 'lr': 0.0003986050768324814, 'weight_decay': 5.398136855290531e-05, 'scheduler': None}.
Using device: cuda
Best model found at epoch 1000
Using device: cuda
Best model found at epoch 1000
Using device: cuda
Best model found at epoch 1000
Using device: cuda
Best model found at epoch 1000
Using device: cuda
Best model found at epoch 1000
ACC_mean: 0.6598
ACC_std: 0.0050
F1_mean: 0.6376
F1_std: 0.0161
AUROC_mean: 0.7209
AUROC_std: 0.0027
AUPR_mean: 0.7126
AUPR_std: 0.0024
0it [00:00, ?it/s]1it [25:10, 1510.01s/it]2it [50:03, 1500.54s/it]3it [1:15:11, 1503.98s/it]4it [1:40:34, 1511.15s/it]5it [2:05:47, 1511.83s/it]5it [2:05:47, 1509.43s/it]
[I 2025-04-20 11:18:22,162] Trial 165 finished with values: [0.7025477010317939, 0.6881623684178344, 0.6152836453882662, 0.6454505222986571] and parameters: {'dropout1': 0.25, 'dropout2': 0.25, 'hidden1': 581, 'hidden2': 268, 'hidden3': 147, 'epochs': 5900, 'heads': 3, 'activation': 'gelu', 'optimizer': 'Adam', 'lr': 0.000677542342790328, 'weight_decay': 0.0025087990460845567, 'scheduler': 'Cosine', 'T_max': 2833}.
[W 2025-04-20 11:18:22,505] Trial 174 failed with parameters: {} because of the following error: ValueError('setting an array element with a sequence. The requested array has an inhomogeneous shape after 1 dimensions. The detected shape was (106,) + inhomogeneous part.').
Traceback (most recent call last):
  File "/panfs/jay/groups/33/kuangr/inoue019/conda-envs/myenv/lib/python3.10/site-packages/optuna/study/_optimize.py", line 197, in _run_trial
    value_or_values = func(trial)
  File "/users/4/inoue019/drGAT/zero_pad/t_small_GT.py", line 40, in objective
    "dropout1": trial.suggest_float("dropout1", 0.1, 0.5, step=0.05),
  File "/panfs/jay/groups/33/kuangr/inoue019/conda-envs/myenv/lib/python3.10/site-packages/optuna/trial/_trial.py", line 161, in suggest_float
    suggested_value = self._suggest(name, distribution)
  File "/panfs/jay/groups/33/kuangr/inoue019/conda-envs/myenv/lib/python3.10/site-packages/optuna/trial/_trial.py", line 627, in _suggest
    elif self._is_relative_param(name, distribution):
  File "/panfs/jay/groups/33/kuangr/inoue019/conda-envs/myenv/lib/python3.10/site-packages/optuna/trial/_trial.py", line 659, in _is_relative_param
    if name not in self.relative_params:
  File "/panfs/jay/groups/33/kuangr/inoue019/conda-envs/myenv/lib/python3.10/site-packages/optuna/trial/_trial.py", line 71, in relative_params
    self._relative_params = self.study.sampler.sample_relative(
  File "/panfs/jay/groups/33/kuangr/inoue019/conda-envs/myenv/lib/python3.10/site-packages/optuna/samplers/nsgaii/_sampler.py", line 269, in sample_relative
    parent_population = self.get_parent_population(study, generation)
  File "/panfs/jay/groups/33/kuangr/inoue019/conda-envs/myenv/lib/python3.10/site-packages/optuna/samplers/_ga/_base.py", line 176, in get_parent_population
    parent_population = self.select_parent(study, generation)
  File "/panfs/jay/groups/33/kuangr/inoue019/conda-envs/myenv/lib/python3.10/site-packages/optuna/samplers/nsgaii/_sampler.py", line 256, in select_parent
    return self._elite_population_selection_strategy(
  File "/panfs/jay/groups/33/kuangr/inoue019/conda-envs/myenv/lib/python3.10/site-packages/optuna/samplers/nsgaii/_elite_population_selection_strategy.py", line 47, in __call__
    population_per_rank = _rank_population(
  File "/panfs/jay/groups/33/kuangr/inoue019/conda-envs/myenv/lib/python3.10/site-packages/optuna/samplers/nsgaii/_elite_population_selection_strategy.py", line 126, in _rank_population
    objective_values = np.array([trial.values for trial in population], dtype=np.float64)
ValueError: setting an array element with a sequence. The requested array has an inhomogeneous shape after 1 dimensions. The detected shape was (106,) + inhomogeneous part.
[W 2025-04-20 11:18:22,640] Trial 174 failed with value None.
Using device: cuda
Best model found at epoch 5900
Using device: cuda
Best model found at epoch 5900
Using device: cuda
Best model found at epoch 5900
Using device: cuda
Best model found at epoch 5900
Using device: cuda
Best model found at epoch 5900
ACC_mean: 0.6455
ACC_std: 0.0065
F1_mean: 0.6153
F1_std: 0.0105
AUROC_mean: 0.7025
AUROC_std: 0.0077
AUPR_mean: 0.6882
AUPR_std: 0.0089
Traceback (most recent call last):
  File "/users/4/inoue019/drGAT/zero_pad/t_small_GT.py", line 162, in <module>
    study.optimize(objective, n_trials=1000)
  File "/panfs/jay/groups/33/kuangr/inoue019/conda-envs/myenv/lib/python3.10/site-packages/optuna/study/study.py", line 475, in optimize
    _optimize(
  File "/panfs/jay/groups/33/kuangr/inoue019/conda-envs/myenv/lib/python3.10/site-packages/optuna/study/_optimize.py", line 63, in _optimize
    _optimize_sequential(
  File "/panfs/jay/groups/33/kuangr/inoue019/conda-envs/myenv/lib/python3.10/site-packages/optuna/study/_optimize.py", line 160, in _optimize_sequential
    frozen_trial = _run_trial(study, func, catch)
  File "/panfs/jay/groups/33/kuangr/inoue019/conda-envs/myenv/lib/python3.10/site-packages/optuna/study/_optimize.py", line 248, in _run_trial
    raise func_err
  File "/panfs/jay/groups/33/kuangr/inoue019/conda-envs/myenv/lib/python3.10/site-packages/optuna/study/_optimize.py", line 197, in _run_trial
    value_or_values = func(trial)
  File "/users/4/inoue019/drGAT/zero_pad/t_small_GT.py", line 40, in objective
    "dropout1": trial.suggest_float("dropout1", 0.1, 0.5, step=0.05),
  File "/panfs/jay/groups/33/kuangr/inoue019/conda-envs/myenv/lib/python3.10/site-packages/optuna/trial/_trial.py", line 161, in suggest_float
    suggested_value = self._suggest(name, distribution)
  File "/panfs/jay/groups/33/kuangr/inoue019/conda-envs/myenv/lib/python3.10/site-packages/optuna/trial/_trial.py", line 627, in _suggest
    elif self._is_relative_param(name, distribution):
  File "/panfs/jay/groups/33/kuangr/inoue019/conda-envs/myenv/lib/python3.10/site-packages/optuna/trial/_trial.py", line 659, in _is_relative_param
    if name not in self.relative_params:
  File "/panfs/jay/groups/33/kuangr/inoue019/conda-envs/myenv/lib/python3.10/site-packages/optuna/trial/_trial.py", line 71, in relative_params
    self._relative_params = self.study.sampler.sample_relative(
  File "/panfs/jay/groups/33/kuangr/inoue019/conda-envs/myenv/lib/python3.10/site-packages/optuna/samplers/nsgaii/_sampler.py", line 269, in sample_relative
    parent_population = self.get_parent_population(study, generation)
  File "/panfs/jay/groups/33/kuangr/inoue019/conda-envs/myenv/lib/python3.10/site-packages/optuna/samplers/_ga/_base.py", line 176, in get_parent_population
    parent_population = self.select_parent(study, generation)
  File "/panfs/jay/groups/33/kuangr/inoue019/conda-envs/myenv/lib/python3.10/site-packages/optuna/samplers/nsgaii/_sampler.py", line 256, in select_parent
    return self._elite_population_selection_strategy(
  File "/panfs/jay/groups/33/kuangr/inoue019/conda-envs/myenv/lib/python3.10/site-packages/optuna/samplers/nsgaii/_elite_population_selection_strategy.py", line 47, in __call__
    population_per_rank = _rank_population(
  File "/panfs/jay/groups/33/kuangr/inoue019/conda-envs/myenv/lib/python3.10/site-packages/optuna/samplers/nsgaii/_elite_population_selection_strategy.py", line 126, in _rank_population
    objective_values = np.array([trial.values for trial in population], dtype=np.float64)
ValueError: setting an array element with a sequence. The requested array has an inhomogeneous shape after 1 dimensions. The detected shape was (106,) + inhomogeneous part.
