Not a conda environment: /scratch.global/inoue019/myenv
load nci
unique drugs: 177
unique genes: 251
DTI unique genes:  251
Top 90% variable genes:  2383
Total:  2582
Final gene exp shape: (60, 2582)
Final drug Act shape: (1005, 60)
  0%|          | 0/25 [00:00<?, ?it/s]  4%|▍         | 1/25 [00:00<00:05,  4.46it/s]  8%|▊         | 2/25 [00:00<00:04,  4.84it/s] 12%|█▏        | 3/25 [00:00<00:04,  5.22it/s] 16%|█▌        | 4/25 [00:00<00:03,  5.54it/s] 20%|██        | 5/25 [00:00<00:03,  5.61it/s] 24%|██▍       | 6/25 [00:01<00:03,  5.66it/s] 28%|██▊       | 7/25 [00:01<00:03,  5.87it/s] 32%|███▏      | 8/25 [00:01<00:02,  5.74it/s] 36%|███▌      | 9/25 [00:01<00:02,  5.91it/s] 40%|████      | 10/25 [00:01<00:02,  5.99it/s] 44%|████▍     | 11/25 [00:01<00:02,  5.97it/s] 48%|████▊     | 12/25 [00:02<00:02,  6.08it/s] 52%|█████▏    | 13/25 [00:02<00:01,  6.12it/s] 56%|█████▌    | 14/25 [00:02<00:01,  6.11it/s] 60%|██████    | 15/25 [00:02<00:01,  6.26it/s] 64%|██████▍   | 16/25 [00:02<00:01,  6.52it/s] 68%|██████▊   | 17/25 [00:02<00:01,  6.35it/s] 72%|███████▏  | 18/25 [00:03<00:01,  6.27it/s] 76%|███████▌  | 19/25 [00:03<00:00,  6.27it/s] 80%|████████  | 20/25 [00:03<00:00,  6.27it/s] 84%|████████▍ | 21/25 [00:03<00:00,  6.42it/s] 88%|████████▊ | 22/25 [00:03<00:00,  6.34it/s] 92%|█████████▏| 23/25 [00:03<00:00,  6.27it/s] 96%|█████████▌| 24/25 [00:03<00:00,  6.24it/s]100%|██████████| 25/25 [00:04<00:00,  6.47it/s]100%|██████████| 25/25 [00:04<00:00,  6.05it/s]
[I 2025-04-19 12:04:44,351] Using an existing study with name 'Transformer' instead of creating a new one.
Done!
0it [00:00, ?it/s]1it [04:39, 279.44s/it]2it [09:15, 277.58s/it]3it [13:54, 278.32s/it]4it [18:29, 276.82s/it]5it [23:09, 278.06s/it]5it [23:09, 277.94s/it]
[I 2025-04-19 12:27:56,965] Trial 1 finished with values: [0.7139229426230773, 0.7037207545432709, 0.6712541828733227, 0.6583135952826575] and parameters: {'dropout1': 0.30000000000000004, 'dropout2': 0.45000000000000007, 'hidden1': 483, 'hidden2': 210, 'hidden3': 139, 'epochs': 1100, 'heads': 4, 'activation': 'gelu', 'optimizer': 'Adam', 'lr': 1.993010181209549e-05, 'weight_decay': 3.452080785551063e-06, 'scheduler': 'Cosine', 'T_max': 491}.
Using device: cuda
Best model found at epoch 1100
Using device: cuda
Best model found at epoch 1100
Using device: cuda
Best model found at epoch 1100
Using device: cuda
Best model found at epoch 1100
Using device: cuda
Best model found at epoch 1100
ACC_mean: 0.6583
ACC_std: 0.0045
F1_mean: 0.6713
F1_std: 0.0066
AUROC_mean: 0.7139
AUROC_std: 0.0029
AUPR_mean: 0.7037
AUPR_std: 0.0031
0it [00:00, ?it/s]1it [24:35, 1475.30s/it]2it [49:10, 1475.06s/it]3it [1:13:44, 1474.55s/it]4it [1:38:31, 1479.52s/it]5it [2:03:08, 1478.82s/it]5it [2:03:08, 1477.77s/it]
[I 2025-04-19 14:31:07,414] Trial 19 finished with values: [0.7173648363555026, 0.708251215881645, 0.6348610461712106, 0.65844351706499] and parameters: {'dropout1': 0.5, 'dropout2': 0.2, 'hidden1': 624, 'hidden2': 187, 'hidden3': 182, 'epochs': 5300, 'heads': 5, 'activation': 'gelu', 'optimizer': 'AdamW', 'lr': 3.828383032152841e-05, 'weight_decay': 0.0006027966773820597, 'scheduler': None}.
Using device: cuda
Best model found at epoch 5300
Using device: cuda
Best model found at epoch 5300
Using device: cuda
Best model found at epoch 5300
Using device: cuda
Best model found at epoch 5300
Using device: cuda
Best model found at epoch 5300
ACC_mean: 0.6584
ACC_std: 0.0044
F1_mean: 0.6349
F1_std: 0.0034
AUROC_mean: 0.7174
AUROC_std: 0.0043
AUPR_mean: 0.7083
AUPR_std: 0.0035
0it [00:00, ?it/s]1it [23:57, 1437.82s/it]2it [47:52, 1436.22s/it]3it [1:12:50, 1464.22s/it]4it [1:37:32, 1471.17s/it]5it [2:03:15, 1497.12s/it]5it [2:03:15, 1479.08s/it]
[I 2025-04-19 16:34:24,294] Trial 34 finished with values: [0.7233119980083891, 0.7128109728655203, 0.6398419166695535, 0.6621185395179271] and parameters: {'dropout1': 0.15000000000000002, 'dropout2': 0.30000000000000004, 'hidden1': 541, 'hidden2': 154, 'hidden3': 142, 'epochs': 5900, 'heads': 4, 'activation': 'relu', 'optimizer': 'Adam', 'lr': 0.000677542342790328, 'weight_decay': 0.00016079819818505325, 'scheduler': None}.
Using device: cuda
Best model found at epoch 5900
Using device: cuda
Best model found at epoch 5900
Using device: cuda
Best model found at epoch 5900
Using device: cuda
Best model found at epoch 5900
Using device: cuda
Best model found at epoch 5900
ACC_mean: 0.6621
ACC_std: 0.0069
F1_mean: 0.6398
F1_std: 0.0207
AUROC_mean: 0.7233
AUROC_std: 0.0035
AUPR_mean: 0.7128
AUPR_std: 0.0022
0it [00:00, ?it/s]1it [07:05, 425.88s/it]2it [14:28, 435.64s/it]3it [21:51, 438.85s/it]4it [29:14, 440.52s/it]5it [36:49, 445.81s/it]5it [36:49, 441.86s/it]
[I 2025-04-19 17:11:14,924] Trial 50 finished with values: [0.7212938596208195, 0.711776710854346, 0.6433841189368044, 0.6626198357038977] and parameters: {'dropout1': 0.35, 'dropout2': 0.1, 'hidden1': 936, 'hidden2': 417, 'hidden3': 139, 'epochs': 1000, 'heads': 7, 'activation': 'gelu', 'optimizer': 'AdamW', 'lr': 0.0004493541825532845, 'weight_decay': 5.398136855290531e-05, 'scheduler': None}.
Using device: cuda
Best model found at epoch 1000
Using device: cuda
Best model found at epoch 1000
Using device: cuda
Best model found at epoch 1000
Using device: cuda
Best model found at epoch 1000
Using device: cuda
Best model found at epoch 1000
ACC_mean: 0.6626
ACC_std: 0.0051
F1_mean: 0.6434
F1_std: 0.0095
AUROC_mean: 0.7213
AUROC_std: 0.0030
AUPR_mean: 0.7118
AUPR_std: 0.0025
0it [00:00, ?it/s]0it [00:32, ?it/s]
[I 2025-04-19 17:11:48,169] Trial 57 pruned. NaN input at trial 57
Using device: cuda
Pruned trial 57: Input contains NaN
0it [00:00, ?it/s]1it [29:06, 1746.49s/it]2it [57:24, 1717.72s/it]3it [1:26:15, 1723.96s/it]4it [1:54:24, 1710.35s/it]5it [2:19:50, 1643.56s/it]5it [2:19:50, 1678.01s/it]
[I 2025-04-19 19:31:39,700] Trial 58 finished with values: [0.7111118557634366, 0.702681758887865, 0.6317560728982402, 0.6532091576010822] and parameters: {'dropout1': 0.45000000000000007, 'dropout2': 0.1, 'hidden1': 848, 'hidden2': 497, 'hidden3': 101, 'epochs': 5000, 'heads': 4, 'activation': 'relu', 'optimizer': 'AdamW', 'lr': 0.00012791054876922365, 'weight_decay': 1.792192047687095e-05, 'scheduler': None}.
Using device: cuda
Best model found at epoch 5000
Using device: cuda
Best model found at epoch 5000
Using device: cuda
Best model found at epoch 5000
Using device: cuda
Best model found at epoch 5000
Using device: cuda
Best model found at epoch 5000
ACC_mean: 0.6532
ACC_std: 0.0041
F1_mean: 0.6318
F1_std: 0.0058
AUROC_mean: 0.7111
AUROC_std: 0.0022
AUPR_mean: 0.7027
AUPR_std: 0.0012
0it [00:00, ?it/s]1it [32:47, 1967.55s/it]2it [1:05:25, 1961.79s/it]3it [1:38:08, 1962.32s/it]4it [2:10:57, 1964.98s/it]5it [2:43:51, 1968.14s/it]5it [2:43:51, 1966.21s/it]
[I 2025-04-19 22:15:32,279] Trial 74 finished with values: [0.7077058061645769, 0.6977114378272432, 0.5878479089297907, 0.646284095768512] and parameters: {'dropout1': 0.2, 'dropout2': 0.5, 'hidden1': 835, 'hidden2': 172, 'hidden3': 116, 'epochs': 7600, 'heads': 5, 'activation': 'relu', 'optimizer': 'Adam', 'lr': 0.0005413325217474958, 'weight_decay': 0.00015664511668515252, 'scheduler': None}.
Using device: cuda
Best model found at epoch 7600
Using device: cuda
Best model found at epoch 7600
Using device: cuda
Best model found at epoch 7600
Using device: cuda
Best model found at epoch 7600
Using device: cuda
Best model found at epoch 7600
ACC_mean: 0.6463
ACC_std: 0.0432
F1_mean: 0.5878
F1_std: 0.1287
AUROC_mean: 0.7077
AUROC_std: 0.0384
AUPR_mean: 0.6977
AUPR_std: 0.0371
0it [00:00, ?it/s]1it [04:24, 264.68s/it]2it [08:45, 262.65s/it]3it [13:06, 261.85s/it]4it [17:21, 259.08s/it]5it [21:34, 257.01s/it]5it [21:34, 258.99s/it]
[I 2025-04-19 22:37:08,838] Trial 95 finished with values: [0.7163275936486203, 0.7069798020908807, 0.6465332413590688, 0.657478275052165] and parameters: {'dropout1': 0.30000000000000004, 'dropout2': 0.45000000000000007, 'hidden1': 483, 'hidden2': 198, 'hidden3': 60, 'epochs': 1100, 'heads': 4, 'activation': 'relu', 'optimizer': 'Adam', 'lr': 5.880506800930795e-05, 'weight_decay': 0.0009879586281840555, 'scheduler': None}.
Using device: cuda
Best model found at epoch 1100
Using device: cuda
Best model found at epoch 1100
Using device: cuda
Best model found at epoch 1100
Using device: cuda
Best model found at epoch 1100
Using device: cuda
Best model found at epoch 1100
ACC_mean: 0.6575
ACC_std: 0.0045
F1_mean: 0.6465
F1_std: 0.0133
AUROC_mean: 0.7163
AUROC_std: 0.0029
AUPR_mean: 0.7070
AUPR_std: 0.0037
0it [00:00, ?it/s]1it [03:00, 180.89s/it]2it [06:00, 180.40s/it]3it [09:00, 180.16s/it]4it [12:00, 180.03s/it]5it [15:00, 179.97s/it]5it [15:00, 180.11s/it]
[I 2025-04-19 22:52:10,934] Trial 98 finished with values: [0.7170123497670411, 0.706881377105485, 0.6385046089792973, 0.6587590984868437] and parameters: {'dropout1': 0.15000000000000002, 'dropout2': 0.2, 'hidden1': 401, 'hidden2': 339, 'hidden3': 234, 'epochs': 500, 'heads': 6, 'activation': 'gelu', 'optimizer': 'AdamW', 'lr': 0.0007732612641831245, 'weight_decay': 9.489329069128993e-06, 'scheduler': 'Cosine', 'T_max': 170}.
Using device: cuda
Best model found at epoch 500
Using device: cuda
Best model found at epoch 500
Using device: cuda
Best model found at epoch 500
Using device: cuda
Best model found at epoch 500
Using device: cuda
Best model found at epoch 500
ACC_mean: 0.6588
ACC_std: 0.0042
F1_mean: 0.6385
F1_std: 0.0046
AUROC_mean: 0.7170
AUROC_std: 0.0026
AUPR_mean: 0.7069
AUPR_std: 0.0029
0it [00:00, ?it/s]1it [24:27, 1467.17s/it]2it [53:02, 1612.86s/it]3it [1:22:18, 1678.23s/it]4it [1:50:28, 1682.97s/it]5it [2:17:15, 1655.63s/it]5it [2:17:15, 1647.09s/it]
[I 2025-04-20 01:09:28,157] Trial 99 finished with values: [0.7223464922630543, 0.7130408333224552, 0.6377505587573087, 0.6613205627559762] and parameters: {'dropout1': 0.5, 'dropout2': 0.2, 'hidden1': 804, 'hidden2': 210, 'hidden3': 50, 'epochs': 6600, 'heads': 3, 'activation': 'gelu', 'optimizer': 'Adam', 'lr': 3.0469417994057602e-05, 'weight_decay': 3.024974097160774e-05, 'scheduler': 'Cosine', 'T_max': 1711}.
Using device: cuda
Best model found at epoch 6600
Using device: cuda
Best model found at epoch 6600
Using device: cuda
Best model found at epoch 6600
Using device: cuda
Best model found at epoch 6600
Using device: cuda
Best model found at epoch 6600
ACC_mean: 0.6613
ACC_std: 0.0046
F1_mean: 0.6378
F1_std: 0.0091
AUROC_mean: 0.7223
AUROC_std: 0.0025
AUPR_mean: 0.7130
AUPR_std: 0.0020
0it [00:00, ?it/s]1it [00:29, 29.53s/it]2it [00:59, 29.86s/it]3it [01:30, 30.30s/it]4it [02:01, 30.56s/it]5it [02:31, 30.24s/it]5it [02:31, 30.22s/it]
[I 2025-04-20 01:12:00,664] Trial 111 finished with values: [0.5450289345573303, 0.5483139045774209, 0.18990311048278702, 0.5209946055070299] and parameters: {'dropout1': 0.25, 'dropout2': 0.2, 'hidden1': 291, 'hidden2': 262, 'hidden3': 192, 'epochs': 100, 'heads': 3, 'activation': 'relu', 'optimizer': 'AdamW', 'lr': 0.002282304244755051, 'weight_decay': 3.607934923690721e-06, 'scheduler': None}.
Using device: cuda
Best model found at epoch 100
Using device: cuda
Best model found at epoch 100
Using device: cuda
Best model found at epoch 100
Using device: cuda
Best model found at epoch 100
Using device: cuda
Best model found at epoch 100
ACC_mean: 0.5210
ACC_std: 0.0284
F1_mean: 0.1899
F1_std: 0.2500
AUROC_mean: 0.5450
AUROC_std: 0.0407
AUPR_mean: 0.5483
AUPR_std: 0.0400
0it [00:00, ?it/s]1it [22:04, 1324.63s/it]2it [44:50, 1348.97s/it]3it [1:07:16, 1347.71s/it]4it [1:29:22, 1339.08s/it]5it [1:51:13, 1328.88s/it]5it [1:51:13, 1334.70s/it]
[I 2025-04-20 03:03:15,733] Trial 112 finished with values: [0.6746154013576285, 0.6658126902560204, 0.448575341286222, 0.6081842385274345] and parameters: {'dropout1': 0.15000000000000002, 'dropout2': 0.25, 'hidden1': 421, 'hidden2': 396, 'hidden3': 171, 'epochs': 3200, 'heads': 7, 'activation': 'gelu', 'optimizer': 'Adam', 'lr': 0.0018916409265358368, 'weight_decay': 7.706054150176632e-05, 'scheduler': 'Cosine', 'T_max': 1480}.
Using device: cuda
Best model found at epoch 3200
Using device: cuda
Best model found at epoch 3200
Using device: cuda
Best model found at epoch 3200
Using device: cuda
Best model found at epoch 3200
Using device: cuda
Best model found at epoch 3200
ACC_mean: 0.6082
ACC_std: 0.0753
F1_mean: 0.4486
F1_std: 0.2890
AUROC_mean: 0.6746
AUROC_std: 0.0769
AUPR_mean: 0.6658
AUPR_std: 0.0747
0it [00:00, ?it/s]1it [14:18, 858.07s/it]2it [28:56, 869.94s/it]3it [43:52, 881.85s/it]4it [59:35, 905.97s/it]5it [1:15:10, 916.54s/it]5it [1:15:10, 902.11s/it]
[I 2025-04-20 04:18:28,005] Trial 126 finished with values: [0.7139859021401269, 0.7050540405168884, 0.6387148946149962, 0.6567358363207418] and parameters: {'dropout1': 0.2, 'dropout2': 0.1, 'hidden1': 256, 'hidden2': 202, 'hidden3': 106, 'epochs': 2900, 'heads': 6, 'activation': 'gelu', 'optimizer': 'AdamW', 'lr': 0.00011903523667246613, 'weight_decay': 0.00010347828598089873, 'scheduler': None}.
Using device: cuda
Best model found at epoch 2900
Using device: cuda
Best model found at epoch 2900
Using device: cuda
Best model found at epoch 2900
Using device: cuda
Best model found at epoch 2900
Using device: cuda
Best model found at epoch 2900
ACC_mean: 0.6567
ACC_std: 0.0039
F1_mean: 0.6387
F1_std: 0.0040
AUROC_mean: 0.7140
AUROC_std: 0.0021
AUPR_mean: 0.7051
AUPR_std: 0.0012
0it [00:00, ?it/s]0it [00:05, ?it/s]
[I 2025-04-20 04:18:34,340] Trial 138 pruned. NaN input at trial 138
Using device: cuda
Pruned trial 138: Input contains NaN
0it [00:00, ?it/s]1it [26:37, 1597.85s/it]2it [52:29, 1570.61s/it]3it [1:18:06, 1555.11s/it]4it [1:41:20, 1491.85s/it]5it [2:03:07, 1424.87s/it]5it [2:03:07, 1477.41s/it]
[I 2025-04-20 06:21:42,882] Trial 139 finished with values: [0.657708441894514, 0.6403518418709006, 0.48416907553166705, 0.5942557586942858] and parameters: {'dropout1': 0.1, 'dropout2': 0.5, 'hidden1': 756, 'hidden2': 126, 'hidden3': 55, 'epochs': 5200, 'heads': 7, 'activation': 'relu', 'optimizer': 'Adam', 'lr': 0.0017829506398861184, 'weight_decay': 0.005863758516008298, 'scheduler': 'Cosine', 'T_max': 1626}.
Using device: cuda
Best model found at epoch 5200
Using device: cuda
Best model found at epoch 5200
Using device: cuda
Best model found at epoch 5200
Using device: cuda
Best model found at epoch 5200
Using device: cuda
Best model found at epoch 5200
ACC_mean: 0.5943
ACC_std: 0.0286
F1_mean: 0.4842
F1_std: 0.1027
AUROC_mean: 0.6577
AUROC_std: 0.0129
AUPR_mean: 0.6404
AUPR_std: 0.0184
0it [00:00, ?it/s]0it [00:10, ?it/s]
[I 2025-04-20 06:21:53,694] Trial 149 pruned. NaN input at trial 149
Using device: cuda
Pruned trial 149: Input contains NaN
0it [00:00, ?it/s]1it [47:23, 2843.35s/it]2it [1:36:01, 2887.35s/it]3it [2:25:12, 2916.19s/it]4it [3:14:49, 2940.42s/it]5it [4:03:35, 2935.19s/it]5it [4:03:35, 2923.10s/it]
[I 2025-04-20 10:25:30,876] Trial 150 finished with values: [0.7099987392501207, 0.6996056139994633, 0.6352726071139833, 0.6534877848718539] and parameters: {'dropout1': 0.1, 'dropout2': 0.35, 'hidden1': 401, 'hidden2': 387, 'hidden3': 147, 'epochs': 9100, 'heads': 4, 'activation': 'relu', 'optimizer': 'Adam', 'lr': 0.0007732612641831245, 'weight_decay': 0.0019001967592288684, 'scheduler': None}.
[W 2025-04-20 10:25:31,255] Trial 171 failed with parameters: {} because of the following error: ValueError('setting an array element with a sequence. The requested array has an inhomogeneous shape after 1 dimensions. The detected shape was (103,) + inhomogeneous part.').
Traceback (most recent call last):
  File "/panfs/jay/groups/33/kuangr/inoue019/conda-envs/myenv/lib/python3.10/site-packages/optuna/study/_optimize.py", line 197, in _run_trial
    value_or_values = func(trial)
  File "/users/4/inoue019/drGAT/zero_pad/t_small_GT.py", line 40, in objective
    "dropout1": trial.suggest_float("dropout1", 0.1, 0.5, step=0.05),
  File "/panfs/jay/groups/33/kuangr/inoue019/conda-envs/myenv/lib/python3.10/site-packages/optuna/trial/_trial.py", line 161, in suggest_float
    suggested_value = self._suggest(name, distribution)
  File "/panfs/jay/groups/33/kuangr/inoue019/conda-envs/myenv/lib/python3.10/site-packages/optuna/trial/_trial.py", line 627, in _suggest
    elif self._is_relative_param(name, distribution):
  File "/panfs/jay/groups/33/kuangr/inoue019/conda-envs/myenv/lib/python3.10/site-packages/optuna/trial/_trial.py", line 659, in _is_relative_param
    if name not in self.relative_params:
  File "/panfs/jay/groups/33/kuangr/inoue019/conda-envs/myenv/lib/python3.10/site-packages/optuna/trial/_trial.py", line 71, in relative_params
    self._relative_params = self.study.sampler.sample_relative(
  File "/panfs/jay/groups/33/kuangr/inoue019/conda-envs/myenv/lib/python3.10/site-packages/optuna/samplers/nsgaii/_sampler.py", line 269, in sample_relative
    parent_population = self.get_parent_population(study, generation)
  File "/panfs/jay/groups/33/kuangr/inoue019/conda-envs/myenv/lib/python3.10/site-packages/optuna/samplers/_ga/_base.py", line 176, in get_parent_population
    parent_population = self.select_parent(study, generation)
  File "/panfs/jay/groups/33/kuangr/inoue019/conda-envs/myenv/lib/python3.10/site-packages/optuna/samplers/nsgaii/_sampler.py", line 256, in select_parent
    return self._elite_population_selection_strategy(
  File "/panfs/jay/groups/33/kuangr/inoue019/conda-envs/myenv/lib/python3.10/site-packages/optuna/samplers/nsgaii/_elite_population_selection_strategy.py", line 47, in __call__
    population_per_rank = _rank_population(
  File "/panfs/jay/groups/33/kuangr/inoue019/conda-envs/myenv/lib/python3.10/site-packages/optuna/samplers/nsgaii/_elite_population_selection_strategy.py", line 126, in _rank_population
    objective_values = np.array([trial.values for trial in population], dtype=np.float64)
ValueError: setting an array element with a sequence. The requested array has an inhomogeneous shape after 1 dimensions. The detected shape was (103,) + inhomogeneous part.
[W 2025-04-20 10:25:31,322] Trial 171 failed with value None.
Using device: cuda
Best model found at epoch 9100
Using device: cuda
Best model found at epoch 9100
Using device: cuda
Best model found at epoch 9100
Using device: cuda
Best model found at epoch 9100
Using device: cuda
Best model found at epoch 9100
ACC_mean: 0.6535
ACC_std: 0.0041
F1_mean: 0.6353
F1_std: 0.0092
AUROC_mean: 0.7100
AUROC_std: 0.0031
AUPR_mean: 0.6996
AUPR_std: 0.0136
Traceback (most recent call last):
  File "/users/4/inoue019/drGAT/zero_pad/t_small_GT.py", line 162, in <module>
    study.optimize(objective, n_trials=1000)
  File "/panfs/jay/groups/33/kuangr/inoue019/conda-envs/myenv/lib/python3.10/site-packages/optuna/study/study.py", line 475, in optimize
    _optimize(
  File "/panfs/jay/groups/33/kuangr/inoue019/conda-envs/myenv/lib/python3.10/site-packages/optuna/study/_optimize.py", line 63, in _optimize
    _optimize_sequential(
  File "/panfs/jay/groups/33/kuangr/inoue019/conda-envs/myenv/lib/python3.10/site-packages/optuna/study/_optimize.py", line 160, in _optimize_sequential
    frozen_trial = _run_trial(study, func, catch)
  File "/panfs/jay/groups/33/kuangr/inoue019/conda-envs/myenv/lib/python3.10/site-packages/optuna/study/_optimize.py", line 248, in _run_trial
    raise func_err
  File "/panfs/jay/groups/33/kuangr/inoue019/conda-envs/myenv/lib/python3.10/site-packages/optuna/study/_optimize.py", line 197, in _run_trial
    value_or_values = func(trial)
  File "/users/4/inoue019/drGAT/zero_pad/t_small_GT.py", line 40, in objective
    "dropout1": trial.suggest_float("dropout1", 0.1, 0.5, step=0.05),
  File "/panfs/jay/groups/33/kuangr/inoue019/conda-envs/myenv/lib/python3.10/site-packages/optuna/trial/_trial.py", line 161, in suggest_float
    suggested_value = self._suggest(name, distribution)
  File "/panfs/jay/groups/33/kuangr/inoue019/conda-envs/myenv/lib/python3.10/site-packages/optuna/trial/_trial.py", line 627, in _suggest
    elif self._is_relative_param(name, distribution):
  File "/panfs/jay/groups/33/kuangr/inoue019/conda-envs/myenv/lib/python3.10/site-packages/optuna/trial/_trial.py", line 659, in _is_relative_param
    if name not in self.relative_params:
  File "/panfs/jay/groups/33/kuangr/inoue019/conda-envs/myenv/lib/python3.10/site-packages/optuna/trial/_trial.py", line 71, in relative_params
    self._relative_params = self.study.sampler.sample_relative(
  File "/panfs/jay/groups/33/kuangr/inoue019/conda-envs/myenv/lib/python3.10/site-packages/optuna/samplers/nsgaii/_sampler.py", line 269, in sample_relative
    parent_population = self.get_parent_population(study, generation)
  File "/panfs/jay/groups/33/kuangr/inoue019/conda-envs/myenv/lib/python3.10/site-packages/optuna/samplers/_ga/_base.py", line 176, in get_parent_population
    parent_population = self.select_parent(study, generation)
  File "/panfs/jay/groups/33/kuangr/inoue019/conda-envs/myenv/lib/python3.10/site-packages/optuna/samplers/nsgaii/_sampler.py", line 256, in select_parent
    return self._elite_population_selection_strategy(
  File "/panfs/jay/groups/33/kuangr/inoue019/conda-envs/myenv/lib/python3.10/site-packages/optuna/samplers/nsgaii/_elite_population_selection_strategy.py", line 47, in __call__
    population_per_rank = _rank_population(
  File "/panfs/jay/groups/33/kuangr/inoue019/conda-envs/myenv/lib/python3.10/site-packages/optuna/samplers/nsgaii/_elite_population_selection_strategy.py", line 126, in _rank_population
    objective_values = np.array([trial.values for trial in population], dtype=np.float64)
ValueError: setting an array element with a sequence. The requested array has an inhomogeneous shape after 1 dimensions. The detected shape was (103,) + inhomogeneous part.
