Not a conda environment: /scratch.global/inoue019/myenv
load nci
unique drugs: 177
unique genes: 251
DTI unique genes:  251
Top 90% variable genes:  2383
Total:  2582
Final gene exp shape: (60, 2582)
Final drug Act shape: (1005, 60)
  0%|          | 0/25 [00:00<?, ?it/s]  4%|▍         | 1/25 [00:02<01:02,  2.60s/it]  8%|▊         | 2/25 [00:02<00:27,  1.20s/it] 12%|█▏        | 3/25 [00:03<00:16,  1.35it/s] 16%|█▌        | 4/25 [00:03<00:10,  1.92it/s] 20%|██        | 5/25 [00:03<00:08,  2.47it/s] 24%|██▍       | 6/25 [00:03<00:06,  2.96it/s] 28%|██▊       | 7/25 [00:03<00:05,  3.24it/s] 32%|███▏      | 8/25 [00:04<00:04,  3.61it/s] 36%|███▌      | 9/25 [00:04<00:04,  3.86it/s] 40%|████      | 10/25 [00:04<00:03,  4.20it/s] 44%|████▍     | 11/25 [00:04<00:03,  4.17it/s] 48%|████▊     | 12/25 [00:04<00:03,  4.29it/s] 52%|█████▏    | 13/25 [00:05<00:02,  4.52it/s] 56%|█████▌    | 14/25 [00:05<00:02,  4.74it/s] 60%|██████    | 15/25 [00:05<00:02,  4.68it/s] 64%|██████▍   | 16/25 [00:05<00:01,  4.66it/s] 68%|██████▊   | 17/25 [00:06<00:01,  4.45it/s] 72%|███████▏  | 18/25 [00:06<00:01,  4.48it/s] 76%|███████▌  | 19/25 [00:06<00:01,  4.34it/s] 80%|████████  | 20/25 [00:06<00:01,  4.28it/s] 84%|████████▍ | 21/25 [00:06<00:00,  4.45it/s] 88%|████████▊ | 22/25 [00:07<00:00,  4.43it/s] 92%|█████████▏| 23/25 [00:07<00:00,  4.52it/s] 96%|█████████▌| 24/25 [00:07<00:00,  4.51it/s]100%|██████████| 25/25 [00:07<00:00,  4.65it/s]100%|██████████| 25/25 [00:07<00:00,  3.22it/s]
[I 2025-04-19 12:03:04,977] Using an existing study with name 'GATv2' instead of creating a new one.
Done!
0it [00:00, ?it/s]1it [07:04, 424.45s/it]2it [13:51, 414.35s/it]3it [20:39, 411.13s/it]4it [27:25, 409.37s/it]5it [34:11, 407.94s/it]5it [34:11, 410.22s/it]
[I 2025-04-19 12:37:18,254] Trial 2 finished with values: [0.7222516165028292, 0.7123896164839187, 0.6471262314636027, 0.6633440798733347] and parameters: {'dropout1': 0.35, 'dropout2': 0.5, 'hidden1': 529, 'hidden2': 330, 'hidden3': 111, 'epochs': 1000, 'heads': 8, 'activation': 'gelu', 'optimizer': 'AdamW', 'lr': 1.1680170271571963e-05, 'weight_decay': 1.0729753558504235e-05, 'scheduler': None}.
Using device: cuda
Best model found at epoch 1000
Using device: cuda
Best model found at epoch 1000
Using device: cuda
Best model found at epoch 1000
Using device: cuda
Best model found at epoch 1000
Using device: cuda
Best model found at epoch 1000
ACC_mean: 0.6633
ACC_std: 0.0047
F1_mean: 0.6471
F1_std: 0.0203
AUROC_mean: 0.7223
AUROC_std: 0.0032
AUPR_mean: 0.7124
AUPR_std: 0.0039
0it [00:00, ?it/s]1it [39:25, 2365.11s/it]2it [1:16:50, 2294.58s/it]3it [1:54:42, 2284.18s/it]4it [2:32:28, 2277.09s/it]5it [3:09:55, 2266.43s/it]5it [3:09:55, 2279.18s/it]
[I 2025-04-19 15:47:15,942] Trial 15 finished with values: [0.714716594980291, 0.7061211224433818, 0.6326207173777586, 0.6552696771035442] and parameters: {'dropout1': 0.25, 'dropout2': 0.45000000000000007, 'hidden1': 605, 'hidden2': 414, 'hidden3': 70, 'epochs': 8600, 'heads': 3, 'activation': 'relu', 'optimizer': 'AdamW', 'lr': 0.002348563755054719, 'weight_decay': 0.006185887725062761, 'scheduler': None}.
Using device: cuda
Best model found at epoch 8600
Using device: cuda
Best model found at epoch 8600
Using device: cuda
Best model found at epoch 8600
Using device: cuda
Best model found at epoch 8600
Using device: cuda
Best model found at epoch 8600
ACC_mean: 0.6553
ACC_std: 0.0041
F1_mean: 0.6326
F1_std: 0.0078
AUROC_mean: 0.7147
AUROC_std: 0.0058
AUPR_mean: 0.7061
AUPR_std: 0.0060
0it [00:00, ?it/s]1it [03:12, 193.00s/it]2it [06:25, 192.89s/it]3it [09:38, 192.74s/it]4it [12:50, 192.39s/it]5it [16:04, 193.10s/it]5it [16:04, 192.92s/it]
[I 2025-04-19 16:03:22,132] Trial 29 finished with values: [0.709063752942781, 0.6988020571539798, 0.5927206319956803, 0.638899787480901] and parameters: {'dropout1': 0.30000000000000004, 'dropout2': 0.15000000000000002, 'hidden1': 967, 'hidden2': 129, 'hidden3': 81, 'epochs': 900, 'heads': 2, 'activation': 'gelu', 'optimizer': 'Adam', 'lr': 0.0017305481617090877, 'weight_decay': 0.0002549456286365958, 'scheduler': 'Cosine', 'T_max': 266}.
Using device: cuda
Best model found at epoch 900
Using device: cuda
Best model found at epoch 900
Using device: cuda
Best model found at epoch 900
Using device: cuda
Best model found at epoch 900
Using device: cuda
Best model found at epoch 900
ACC_mean: 0.6389
ACC_std: 0.0423
F1_mean: 0.5927
F1_std: 0.1547
AUROC_mean: 0.7091
AUROC_std: 0.0194
AUPR_mean: 0.6988
AUPR_std: 0.0221
0it [00:00, ?it/s]1it [16:13, 973.80s/it]2it [32:23, 971.21s/it]3it [48:26, 967.81s/it]4it [1:04:37, 969.04s/it]5it [1:20:41, 967.07s/it]5it [1:20:42, 968.53s/it]
[I 2025-04-19 17:24:06,732] Trial 31 finished with values: [0.7129644587406795, 0.7040032345126928, 0.6313653878356609, 0.6546196306404004] and parameters: {'dropout1': 0.1, 'dropout2': 0.30000000000000004, 'hidden1': 998, 'hidden2': 139, 'hidden3': 114, 'epochs': 4300, 'heads': 3, 'activation': 'gelu', 'optimizer': 'AdamW', 'lr': 0.005955373844448557, 'weight_decay': 3.199626729012931e-05, 'scheduler': None}.
Using device: cuda
Best model found at epoch 4300
Using device: cuda
Best model found at epoch 4300
Using device: cuda
Best model found at epoch 4300
Using device: cuda
Best model found at epoch 4300
Using device: cuda
Best model found at epoch 4300
ACC_mean: 0.6546
ACC_std: 0.0064
F1_mean: 0.6314
F1_std: 0.0105
AUROC_mean: 0.7130
AUROC_std: 0.0038
AUPR_mean: 0.7040
AUPR_std: 0.0033
0it [00:00, ?it/s]1it [38:54, 2334.92s/it]2it [1:17:50, 2335.16s/it]3it [1:56:54, 2339.18s/it]4it [2:36:06, 2344.20s/it]5it [3:15:38, 2354.35s/it]5it [3:15:38, 2347.69s/it]
[I 2025-04-19 20:39:46,840] Trial 39 finished with values: [0.7134382322686217, 0.7050664852715121, 0.6389189826698308, 0.655751765813076] and parameters: {'dropout1': 0.45000000000000007, 'dropout2': 0.15000000000000002, 'hidden1': 606, 'hidden2': 71, 'hidden3': 64, 'epochs': 9600, 'heads': 8, 'activation': 'relu', 'optimizer': 'AdamW', 'lr': 0.0017563230403147621, 'weight_decay': 6.558780209031536e-05, 'scheduler': None}.
Using device: cuda
Best model found at epoch 9600
Using device: cuda
Best model found at epoch 9600
Using device: cuda
Best model found at epoch 9600
Using device: cuda
Best model found at epoch 9600
Using device: cuda
Best model found at epoch 9600
ACC_mean: 0.6558
ACC_std: 0.0070
F1_mean: 0.6389
F1_std: 0.0073
AUROC_mean: 0.7134
AUROC_std: 0.0057
AUPR_mean: 0.7051
AUPR_std: 0.0048
0it [00:00, ?it/s]1it [13:45, 825.10s/it]2it [27:29, 824.78s/it]3it [41:13, 824.46s/it]4it [54:58, 824.49s/it]5it [1:08:41, 824.18s/it]5it [1:08:41, 824.38s/it]
[I 2025-04-19 21:48:30,382] Trial 58 finished with values: [0.6887978360190397, 0.6819920225733835, 0.6372682321346755, 0.6333325512531267] and parameters: {'dropout1': 0.5, 'dropout2': 0.35, 'hidden1': 623, 'hidden2': 482, 'hidden3': 108, 'epochs': 2000, 'heads': 7, 'activation': 'relu', 'optimizer': 'AdamW', 'lr': 0.0033084570100056147, 'weight_decay': 2.5017967778145794e-05, 'scheduler': 'Cosine', 'T_max': 667}.
Using device: cuda
Best model found at epoch 2000
Using device: cuda
Best model found at epoch 2000
Using device: cuda
Best model found at epoch 2000
Using device: cuda
Best model found at epoch 2000
Using device: cuda
Best model found at epoch 2000
ACC_mean: 0.6333
ACC_std: 0.0634
F1_mean: 0.6373
F1_std: 0.0119
AUROC_mean: 0.6888
AUROC_std: 0.0736
AUPR_mean: 0.6820
AUPR_std: 0.0703
0it [00:00, ?it/s]1it [36:21, 2181.33s/it]2it [1:12:42, 2181.07s/it]3it [1:48:58, 2178.83s/it]4it [2:25:18, 2179.30s/it]5it [3:01:44, 2181.76s/it]5it [3:01:44, 2180.90s/it]
[I 2025-04-20 00:50:16,678] Trial 68 finished with values: [0.7253896144202809, 0.7170914592838955, 0.6460546297464687, 0.664123352170786] and parameters: {'dropout1': 0.4, 'dropout2': 0.30000000000000004, 'hidden1': 481, 'hidden2': 411, 'hidden3': 60, 'epochs': 5600, 'heads': 8, 'activation': 'relu', 'optimizer': 'Adam', 'lr': 0.0001574433398176978, 'weight_decay': 0.0009648005633961959, 'scheduler': None}.
Using device: cuda
Best model found at epoch 5600
Using device: cuda
Best model found at epoch 5600
Using device: cuda
Best model found at epoch 5600
Using device: cuda
Best model found at epoch 5600
Using device: cuda
Best model found at epoch 5600
ACC_mean: 0.6641
ACC_std: 0.0048
F1_mean: 0.6461
F1_std: 0.0083
AUROC_mean: 0.7254
AUROC_std: 0.0026
AUPR_mean: 0.7171
AUPR_std: 0.0027
0it [00:00, ?it/s]1it [14:23, 863.65s/it]2it [28:45, 862.60s/it]3it [43:07, 862.50s/it]4it [57:29, 862.26s/it]5it [1:11:51, 861.94s/it]5it [1:11:51, 862.23s/it]
[I 2025-04-20 02:02:09,619] Trial 82 finished with values: [0.7145186021400951, 0.705298247372634, 0.5827433583448677, 0.6372467731095054] and parameters: {'dropout1': 0.2, 'dropout2': 0.30000000000000004, 'hidden1': 419, 'hidden2': 89, 'hidden3': 58, 'epochs': 4200, 'heads': 2, 'activation': 'relu', 'optimizer': 'Adam', 'lr': 0.000364858171408734, 'weight_decay': 0.0031595773224939454, 'scheduler': 'Cosine', 'T_max': 1014}.
Using device: cuda
Best model found at epoch 4200
Using device: cuda
Best model found at epoch 4200
Using device: cuda
Best model found at epoch 4200
Using device: cuda
Best model found at epoch 4200
Using device: cuda
Best model found at epoch 4200
ACC_mean: 0.6372
ACC_std: 0.0217
F1_mean: 0.5827
F1_std: 0.0936
AUROC_mean: 0.7145
AUROC_std: 0.0081
AUPR_mean: 0.7053
AUPR_std: 0.0090
0it [00:00, ?it/s]1it [30:51, 1851.10s/it]2it [1:01:42, 1851.35s/it]3it [1:32:34, 1851.65s/it]4it [2:03:26, 1851.75s/it]5it [2:34:18, 1851.93s/it]5it [2:34:18, 1851.76s/it]
[I 2025-04-20 04:36:30,294] Trial 92 finished with values: [0.7241765466348419, 0.716199649484929, 0.6401177548794149, 0.6624157437775701] and parameters: {'dropout1': 0.5, 'dropout2': 0.35, 'hidden1': 708, 'hidden2': 299, 'hidden3': 130, 'epochs': 5000, 'heads': 8, 'activation': 'gelu', 'optimizer': 'Adam', 'lr': 0.0003797805396590148, 'weight_decay': 6.309294673446819e-05, 'scheduler': None}.
Using device: cuda
Best model found at epoch 5000
Using device: cuda
Best model found at epoch 5000
Using device: cuda
Best model found at epoch 5000
Using device: cuda
Best model found at epoch 5000
Using device: cuda
Best model found at epoch 5000
ACC_mean: 0.6624
ACC_std: 0.0033
F1_mean: 0.6401
F1_std: 0.0070
AUROC_mean: 0.7242
AUROC_std: 0.0017
AUPR_mean: 0.7162
AUPR_std: 0.0016
0it [00:00, ?it/s]1it [51:04, 3064.56s/it]2it [1:42:45, 3085.67s/it]3it [2:35:34, 3123.82s/it]4it [3:29:02, 3157.09s/it]5it [4:22:36, 3177.67s/it]5it [4:22:36, 3151.29s/it]
[I 2025-04-20 08:59:08,645] Trial 110 finished with values: [0.7116370185050028, 0.7030443871941527, 0.6329804159957702, 0.6531717624532318] and parameters: {'dropout1': 0.1, 'dropout2': 0.25, 'hidden1': 388, 'hidden2': 212, 'hidden3': 181, 'epochs': 9200, 'heads': 7, 'activation': 'relu', 'optimizer': 'AdamW', 'lr': 0.0008788084134239111, 'weight_decay': 0.00046615442073667015, 'scheduler': 'Cosine', 'T_max': 2509}.
Using device: cuda
Best model found at epoch 9200
Using device: cuda
Best model found at epoch 9200
Using device: cuda
Best model found at epoch 9200
Using device: cuda
Best model found at epoch 9200
Using device: cuda
Best model found at epoch 9200
ACC_mean: 0.6532
ACC_std: 0.0068
F1_mean: 0.6330
F1_std: 0.0089
AUROC_mean: 0.7116
AUROC_std: 0.0057
AUPR_mean: 0.7030
AUPR_std: 0.0046
0it [00:00, ?it/s]1it [32:38, 1958.98s/it]2it [1:05:14, 1956.99s/it]3it [1:38:14, 1967.32s/it]4it [2:10:26, 1953.42s/it]5it [2:41:26, 1919.82s/it]5it [2:41:26, 1937.31s/it]
[I 2025-04-20 11:40:36,999] Trial 140 finished with values: [0.6741137526179819, 0.6620528238183068, 0.43651626319773174, 0.6037419333766888] and parameters: {'dropout1': 0.1, 'dropout2': 0.2, 'hidden1': 657, 'hidden2': 204, 'hidden3': 100, 'epochs': 5600, 'heads': 8, 'activation': 'gelu', 'optimizer': 'AdamW', 'lr': 0.004735634649419025, 'weight_decay': 0.0009648005633961959, 'scheduler': None}.
Using device: cuda
Best model found at epoch 5600
Using device: cuda
Best model found at epoch 5600
Using device: cuda
Best model found at epoch 5600
Using device: cuda
Best model found at epoch 5600
Using device: cuda
Best model found at epoch 5600
ACC_mean: 0.6037
ACC_std: 0.0726
F1_mean: 0.4365
F1_std: 0.2782
AUROC_mean: 0.6741
AUROC_std: 0.0568
AUPR_mean: 0.6621
AUPR_std: 0.0628
0it [00:00, ?it/s]slurmstepd: error: *** JOB 34492515 ON aga29 CANCELLED AT 2025-04-20T12:02:34 DUE TO TIME LIMIT ***
