Not a conda environment: /scratch.global/inoue019/myenv
load nci
unique drugs: 177
unique genes: 251
DTI unique genes:  251
Top 90% variable genes:  2383
Total:  2582
Final gene exp shape: (60, 2582)
Final drug Act shape: (1005, 60)
  0%|          | 0/25 [00:00<?, ?it/s]  4%|▍         | 1/25 [00:01<00:44,  1.85s/it]  8%|▊         | 2/25 [00:01<00:19,  1.19it/s] 12%|█▏        | 3/25 [00:02<00:11,  1.90it/s] 16%|█▌        | 4/25 [00:02<00:07,  2.67it/s] 20%|██        | 5/25 [00:02<00:05,  3.36it/s] 24%|██▍       | 6/25 [00:02<00:04,  4.02it/s] 28%|██▊       | 7/25 [00:02<00:03,  4.61it/s] 32%|███▏      | 8/25 [00:02<00:03,  5.07it/s] 36%|███▌      | 9/25 [00:03<00:02,  5.59it/s] 40%|████      | 10/25 [00:03<00:02,  5.70it/s] 44%|████▍     | 11/25 [00:03<00:02,  6.12it/s] 48%|████▊     | 12/25 [00:03<00:02,  6.43it/s] 52%|█████▏    | 13/25 [00:03<00:01,  6.69it/s] 56%|█████▌    | 14/25 [00:03<00:01,  6.88it/s] 60%|██████    | 15/25 [00:03<00:01,  6.92it/s] 64%|██████▍   | 16/25 [00:04<00:01,  6.72it/s] 68%|██████▊   | 17/25 [00:04<00:01,  6.92it/s] 72%|███████▏  | 18/25 [00:04<00:01,  6.91it/s] 76%|███████▌  | 19/25 [00:04<00:00,  7.20it/s] 80%|████████  | 20/25 [00:04<00:00,  7.09it/s] 84%|████████▍ | 21/25 [00:04<00:00,  7.00it/s] 88%|████████▊ | 22/25 [00:04<00:00,  7.12it/s] 92%|█████████▏| 23/25 [00:05<00:00,  7.16it/s] 96%|█████████▌| 24/25 [00:05<00:00,  7.20it/s]100%|██████████| 25/25 [00:05<00:00,  7.27it/s]100%|██████████| 25/25 [00:05<00:00,  4.72it/s]
[I 2025-04-19 12:08:06,921] Using an existing study with name 'GATv2' instead of creating a new one.
Done!
0it [00:00, ?it/s]1it [31:49, 1909.13s/it]2it [1:03:06, 1890.52s/it]3it [1:33:54, 1871.20s/it]4it [2:03:52, 1841.98s/it]5it [2:33:33, 1820.08s/it]5it [2:33:33, 1842.65s/it]
[I 2025-04-19 14:41:42,662] Trial 8 finished with values: [0.7140543360511659, 0.7050471566641298, 0.6328865539611056, 0.6545828177460958] and parameters: {'dropout1': 0.2, 'dropout2': 0.30000000000000004, 'hidden1': 738, 'hidden2': 474, 'hidden3': 106, 'epochs': 6700, 'heads': 2, 'activation': 'relu', 'optimizer': 'AdamW', 'lr': 0.0003980766205555851, 'weight_decay': 0.00041673100147635554, 'scheduler': 'Cosine', 'T_max': 2317}.
Using device: cuda
Best model found at epoch 6700
Using device: cuda
Best model found at epoch 6700
Using device: cuda
Best model found at epoch 6700
Using device: cuda
Best model found at epoch 6700
Using device: cuda
Best model found at epoch 6700
ACC_mean: 0.6546
ACC_std: 0.0055
F1_mean: 0.6329
F1_std: 0.0048
AUROC_mean: 0.7141
AUROC_std: 0.0072
AUPR_mean: 0.7050
AUPR_std: 0.0081
0it [00:00, ?it/s]1it [22:56, 1376.64s/it]2it [45:34, 1365.47s/it]3it [1:07:28, 1341.97s/it]4it [1:30:33, 1358.84s/it]5it [1:53:38, 1368.57s/it]5it [1:53:38, 1363.76s/it]
[I 2025-04-19 16:35:23,029] Trial 23 finished with values: [0.7190842000265002, 0.7119207552416817, 0.6306595884690129, 0.6580166046308243] and parameters: {'dropout1': 0.1, 'dropout2': 0.35, 'hidden1': 336, 'hidden2': 294, 'hidden3': 133, 'epochs': 4000, 'heads': 5, 'activation': 'gelu', 'optimizer': 'Adam', 'lr': 6.981158432617779e-05, 'weight_decay': 0.0011019014945219566, 'scheduler': 'Cosine', 'T_max': 1804}.
Using device: cuda
Best model found at epoch 4000
Using device: cuda
Best model found at epoch 4000
Using device: cuda
Best model found at epoch 4000
Using device: cuda
Best model found at epoch 4000
Using device: cuda
Best model found at epoch 4000
ACC_mean: 0.6580
ACC_std: 0.0045
F1_mean: 0.6307
F1_std: 0.0105
AUROC_mean: 0.7191
AUROC_std: 0.0017
AUPR_mean: 0.7119
AUPR_std: 0.0019
0it [00:00, ?it/s]1it [58:03, 3483.89s/it]2it [1:55:29, 3461.48s/it]3it [2:50:32, 3389.13s/it]4it [3:45:43, 3358.28s/it]5it [4:41:11, 3347.40s/it]5it [4:41:11, 3374.36s/it]
[I 2025-04-19 21:16:36,443] Trial 35 finished with values: [0.711073069160441, 0.7022258019234575, 0.6289726829848076, 0.6523923144461309] and parameters: {'dropout1': 0.2, 'dropout2': 0.5, 'hidden1': 839, 'hidden2': 256, 'hidden3': 205, 'epochs': 9600, 'heads': 5, 'activation': 'relu', 'optimizer': 'Adam', 'lr': 6.399441439482874e-05, 'weight_decay': 4.595026144909725e-05, 'scheduler': None}.
Using device: cuda
Best model found at epoch 9600
Using device: cuda
Best model found at epoch 9600
Using device: cuda
Best model found at epoch 9600
Using device: cuda
Best model found at epoch 9600
Using device: cuda
Best model found at epoch 9600
ACC_mean: 0.6524
ACC_std: 0.0043
F1_mean: 0.6290
F1_std: 0.0040
AUROC_mean: 0.7111
AUROC_std: 0.0023
AUPR_mean: 0.7022
AUPR_std: 0.0012
0it [00:00, ?it/s]1it [17:44, 1064.39s/it]2it [35:14, 1056.21s/it]3it [52:50, 1055.86s/it]4it [1:10:55, 1067.47s/it]5it [1:29:53, 1092.89s/it]5it [1:29:53, 1078.71s/it]
[I 2025-04-19 22:46:31,606] Trial 61 finished with values: [0.7206181018654323, 0.7112829794686626, 0.6438863578386181, 0.6612092524153875] and parameters: {'dropout1': 0.45000000000000007, 'dropout2': 0.25, 'hidden1': 906, 'hidden2': 83, 'hidden3': 67, 'epochs': 4000, 'heads': 6, 'activation': 'relu', 'optimizer': 'AdamW', 'lr': 0.00012853351263139625, 'weight_decay': 0.00025619380276876785, 'scheduler': None}.
Using device: cuda
Best model found at epoch 4000
Using device: cuda
Best model found at epoch 4000
Using device: cuda
Best model found at epoch 4000
Using device: cuda
Best model found at epoch 4000
Using device: cuda
Best model found at epoch 4000
ACC_mean: 0.6612
ACC_std: 0.0064
F1_mean: 0.6439
F1_std: 0.0151
AUROC_mean: 0.7206
AUROC_std: 0.0047
AUPR_mean: 0.7113
AUPR_std: 0.0041
0it [00:00, ?it/s]1it [59:01, 3541.61s/it]2it [1:59:02, 3576.28s/it]3it [3:01:46, 3662.06s/it]4it [4:03:36, 3681.21s/it]5it [5:07:27, 3735.14s/it]5it [5:07:27, 3689.53s/it]
[I 2025-04-20 03:54:01,252] Trial 76 finished with values: [0.6987299801229201, 0.6847060386289001, 0.6184516050211724, 0.6415351187087504] and parameters: {'dropout1': 0.2, 'dropout2': 0.15000000000000002, 'hidden1': 917, 'hidden2': 365, 'hidden3': 166, 'epochs': 8800, 'heads': 6, 'activation': 'relu', 'optimizer': 'Adam', 'lr': 0.0008141048932454422, 'weight_decay': 0.00013987096572904464, 'scheduler': None}.
Using device: cuda
Best model found at epoch 8800
Using device: cuda
Best model found at epoch 8800
Using device: cuda
Best model found at epoch 8800
Using device: cuda
Best model found at epoch 8800
Using device: cuda
Best model found at epoch 8800
ACC_mean: 0.6415
ACC_std: 0.0343
F1_mean: 0.6185
F1_std: 0.0278
AUROC_mean: 0.6987
AUROC_std: 0.0461
AUPR_mean: 0.6847
AUPR_std: 0.0550
0it [00:00, ?it/s]1it [10:40, 640.12s/it]2it [21:13, 636.16s/it]3it [31:52, 637.61s/it]4it [42:21, 634.25s/it]5it [52:28, 624.33s/it]5it [52:28, 629.73s/it]
[I 2025-04-20 04:46:31,978] Trial 107 finished with values: [0.7184672218696777, 0.7078204677237432, 0.6212841035230614, 0.6528193578012121] and parameters: {'dropout1': 0.5, 'dropout2': 0.25, 'hidden1': 455, 'hidden2': 399, 'hidden3': 67, 'epochs': 2100, 'heads': 2, 'activation': 'gelu', 'optimizer': 'AdamW', 'lr': 2.8348711645316088e-05, 'weight_decay': 0.007950927020072739, 'scheduler': 'Cosine', 'T_max': 927}.
Using device: cuda
Best model found at epoch 2100
Using device: cuda
Best model found at epoch 2100
Using device: cuda
Best model found at epoch 2100
Using device: cuda
Best model found at epoch 2100
Using device: cuda
Best model found at epoch 2100
ACC_mean: 0.6528
ACC_std: 0.0072
F1_mean: 0.6213
F1_std: 0.0343
AUROC_mean: 0.7185
AUROC_std: 0.0051
AUPR_mean: 0.7078
AUPR_std: 0.0079
0it [00:00, ?it/s]1it [12:21, 741.56s/it]2it [24:42, 741.34s/it]3it [37:17, 747.64s/it]4it [49:55, 751.51s/it]5it [1:02:18, 748.34s/it]5it [1:02:18, 747.61s/it]
[I 2025-04-20 05:48:52,321] Trial 112 finished with values: [0.7219918443635296, 0.7130734213864317, 0.655014689165528, 0.6621742704845411] and parameters: {'dropout1': 0.45000000000000007, 'dropout2': 0.2, 'hidden1': 708, 'hidden2': 73, 'hidden3': 57, 'epochs': 2400, 'heads': 8, 'activation': 'relu', 'optimizer': 'AdamW', 'lr': 0.0004834265460398401, 'weight_decay': 0.00029983884283524287, 'scheduler': 'Cosine', 'T_max': 1193}.
Using device: cuda
Best model found at epoch 2400
Using device: cuda
Best model found at epoch 2400
Using device: cuda
Best model found at epoch 2400
Using device: cuda
Best model found at epoch 2400
Using device: cuda
Best model found at epoch 2400
ACC_mean: 0.6622
ACC_std: 0.0061
F1_mean: 0.6550
F1_std: 0.0175
AUROC_mean: 0.7220
AUROC_std: 0.0056
AUPR_mean: 0.7131
AUPR_std: 0.0055
0it [00:00, ?it/s]1it [26:59, 1619.62s/it]2it [53:54, 1616.85s/it]3it [1:20:04, 1595.30s/it]4it [1:46:49, 1599.25s/it]5it [2:13:03, 1590.32s/it]5it [2:13:03, 1596.80s/it]
[I 2025-04-20 08:01:58,274] Trial 115 finished with values: [0.7223885862708894, 0.7125537474882541, 0.6492819259097102, 0.6636963983931732] and parameters: {'dropout1': 0.5, 'dropout2': 0.35, 'hidden1': 637, 'hidden2': 380, 'hidden3': 188, 'epochs': 4000, 'heads': 5, 'activation': 'gelu', 'optimizer': 'Adam', 'lr': 6.981158432617779e-05, 'weight_decay': 9.303473603679468e-06, 'scheduler': 'Cosine', 'T_max': 1010}.
Using device: cuda
Best model found at epoch 4000
Using device: cuda
Best model found at epoch 4000
Using device: cuda
Best model found at epoch 4000
Using device: cuda
Best model found at epoch 4000
Using device: cuda
Best model found at epoch 4000
ACC_mean: 0.6637
ACC_std: 0.0055
F1_mean: 0.6493
F1_std: 0.0058
AUROC_mean: 0.7224
AUROC_std: 0.0048
AUPR_mean: 0.7126
AUPR_std: 0.0046
0it [00:00, ?it/s]1it [43:46, 2626.93s/it]2it [1:27:23, 2620.93s/it]3it [2:08:07, 2539.94s/it]4it [2:49:54, 2527.10s/it]5it [3:31:12, 2509.44s/it]5it [3:31:12, 2534.55s/it]
[I 2025-04-20 11:33:13,006] Trial 133 finished with values: [0.7198724383901698, 0.7117359956718042, 0.6336892626112093, 0.6590745937765158] and parameters: {'dropout1': 0.25, 'dropout2': 0.4, 'hidden1': 570, 'hidden2': 117, 'hidden3': 58, 'epochs': 8500, 'heads': 6, 'activation': 'relu', 'optimizer': 'AdamW', 'lr': 4.2158840523100805e-05, 'weight_decay': 1.351537083847773e-06, 'scheduler': 'Cosine', 'T_max': 2971}.
Using device: cuda
Best model found at epoch 8500
Using device: cuda
Best model found at epoch 8500
Using device: cuda
Best model found at epoch 8500
Using device: cuda
Best model found at epoch 8500
Using device: cuda
Best model found at epoch 8500
ACC_mean: 0.6591
ACC_std: 0.0042
F1_mean: 0.6337
F1_std: 0.0054
AUROC_mean: 0.7199
AUROC_std: 0.0016
AUPR_mean: 0.7117
AUPR_std: 0.0007
0it [00:00, ?it/s]slurmstepd: error: *** JOB 34492537 ON aga33 CANCELLED AT 2025-04-20T12:02:34 DUE TO TIME LIMIT ***
