Not a conda environment: /scratch.global/inoue019/myenv
load nci
unique drugs: 177
unique genes: 251
DTI unique genes:  251
Top 90% variable genes:  2383
Total:  2582
Final gene exp shape: (60, 2582)
Final drug Act shape: (1005, 60)
  0%|          | 0/25 [00:00<?, ?it/s]  4%|▍         | 1/25 [00:02<01:02,  2.62s/it]  8%|▊         | 2/25 [00:02<00:27,  1.18s/it] 12%|█▏        | 3/25 [00:02<00:15,  1.41it/s] 16%|█▌        | 4/25 [00:03<00:10,  2.00it/s] 20%|██        | 5/25 [00:03<00:07,  2.58it/s] 24%|██▍       | 6/25 [00:03<00:06,  3.09it/s] 28%|██▊       | 7/25 [00:03<00:04,  3.69it/s] 32%|███▏      | 8/25 [00:03<00:04,  4.20it/s] 36%|███▌      | 9/25 [00:03<00:03,  4.69it/s] 40%|████      | 10/25 [00:04<00:03,  4.79it/s] 44%|████▍     | 11/25 [00:04<00:02,  5.07it/s] 48%|████▊     | 12/25 [00:04<00:02,  5.22it/s] 52%|█████▏    | 13/25 [00:04<00:02,  5.26it/s] 56%|█████▌    | 14/25 [00:04<00:02,  5.39it/s] 60%|██████    | 15/25 [00:05<00:01,  5.58it/s] 64%|██████▍   | 16/25 [00:05<00:01,  5.30it/s] 68%|██████▊   | 17/25 [00:05<00:01,  5.04it/s] 72%|███████▏  | 18/25 [00:05<00:01,  4.97it/s] 76%|███████▌  | 19/25 [00:05<00:01,  5.28it/s] 80%|████████  | 20/25 [00:06<00:00,  5.38it/s] 84%|████████▍ | 21/25 [00:06<00:00,  5.43it/s] 88%|████████▊ | 22/25 [00:06<00:00,  5.48it/s] 92%|█████████▏| 23/25 [00:06<00:00,  5.60it/s] 96%|█████████▌| 24/25 [00:06<00:00,  5.49it/s]100%|██████████| 25/25 [00:06<00:00,  5.56it/s]100%|██████████| 25/25 [00:06<00:00,  3.60it/s]
[I 2025-04-19 12:03:04,740] Using an existing study with name 'GATv2' instead of creating a new one.
Done!
0it [00:00, ?it/s]1it [1:20:42, 4842.81s/it]2it [2:41:54, 4860.05s/it]3it [4:03:41, 4881.38s/it]4it [5:26:32, 4916.55s/it]5it [6:49:51, 4946.39s/it]5it [6:49:51, 4918.29s/it]
[I 2025-04-19 18:52:59,203] Trial 1 finished with values: [0.7095041793800716, 0.7011920052036094, 0.6250575592797905, 0.6509074369832845] and parameters: {'dropout1': 0.1, 'dropout2': 0.15000000000000002, 'hidden1': 571, 'hidden2': 488, 'hidden3': 163, 'epochs': 9800, 'heads': 8, 'activation': 'gelu', 'optimizer': 'AdamW', 'lr': 2.800678329002953e-05, 'weight_decay': 0.00041182083795153197, 'scheduler': 'Cosine', 'T_max': 4753}.
Using device: cuda
Best model found at epoch 9800
Using device: cuda
Best model found at epoch 9800
Using device: cuda
Best model found at epoch 9800
Using device: cuda
Best model found at epoch 9800
Using device: cuda
Best model found at epoch 9800
ACC_mean: 0.6509
ACC_std: 0.0044
F1_mean: 0.6251
F1_std: 0.0090
AUROC_mean: 0.7095
AUROC_std: 0.0023
AUPR_mean: 0.7012
AUPR_std: 0.0012
0it [00:00, ?it/s]1it [02:11, 131.95s/it]2it [04:24, 132.33s/it]3it [06:35, 131.61s/it]4it [08:46, 131.35s/it]5it [10:57, 131.29s/it]5it [10:57, 131.48s/it]
[I 2025-04-19 19:04:01,714] Trial 48 finished with values: [0.7260970619910444, 0.7187146428359569, 0.6485468832017066, 0.6644016142411087] and parameters: {'dropout1': 0.2, 'dropout2': 0.4, 'hidden1': 663, 'hidden2': 264, 'hidden3': 48, 'epochs': 400, 'heads': 7, 'activation': 'gelu', 'optimizer': 'AdamW', 'lr': 0.0005250592444218565, 'weight_decay': 0.0003525564416507599, 'scheduler': 'Cosine', 'T_max': 109}.
Using device: cuda
Best model found at epoch 400
Using device: cuda
Best model found at epoch 400
Using device: cuda
Best model found at epoch 400
Using device: cuda
Best model found at epoch 400
Using device: cuda
Best model found at epoch 400
ACC_mean: 0.6644
ACC_std: 0.0067
F1_mean: 0.6485
F1_std: 0.0097
AUROC_mean: 0.7261
AUROC_std: 0.0043
AUPR_mean: 0.7187
AUPR_std: 0.0038
0it [00:00, ?it/s]1it [26:51, 1611.66s/it]2it [53:38, 1608.89s/it]3it [1:19:40, 1587.47s/it]4it [1:47:23, 1617.33s/it]5it [2:14:56, 1630.11s/it]5it [2:14:56, 1619.29s/it]
[I 2025-04-19 21:19:00,965] Trial 50 finished with values: [0.6387274653581957, 0.6268181693701989, 0.5358647234230736, 0.5909903498882142] and parameters: {'dropout1': 0.15000000000000002, 'dropout2': 0.5, 'hidden1': 329, 'hidden2': 121, 'hidden3': 94, 'epochs': 5900, 'heads': 3, 'activation': 'gelu', 'optimizer': 'Adam', 'lr': 0.0065319789055085405, 'weight_decay': 0.002042715411298462, 'scheduler': None}.
Using device: cuda
Best model found at epoch 5900
Using device: cuda
Best model found at epoch 5900
Using device: cuda
Best model found at epoch 5900
Using device: cuda
Best model found at epoch 5900
Using device: cuda
Best model found at epoch 5900
ACC_mean: 0.5910
ACC_std: 0.0053
F1_mean: 0.5359
F1_std: 0.0264
AUROC_mean: 0.6387
AUROC_std: 0.0030
AUPR_mean: 0.6268
AUPR_std: 0.0046
0it [00:00, ?it/s]1it [29:04, 1744.23s/it]2it [58:25, 1754.25s/it]3it [1:27:08, 1740.19s/it]4it [1:55:15, 1718.92s/it]5it [2:23:29, 1709.98s/it]5it [2:23:29, 1721.88s/it]
[I 2025-04-19 23:42:32,699] Trial 62 finished with values: [0.7164110506046953, 0.7095876069209878, 0.634523358442306, 0.6572740763219326] and parameters: {'dropout1': 0.25, 'dropout2': 0.4, 'hidden1': 570, 'hidden2': 397, 'hidden3': 177, 'epochs': 4300, 'heads': 6, 'activation': 'gelu', 'optimizer': 'AdamW', 'lr': 5.8321546426750676e-05, 'weight_decay': 1.351537083847773e-06, 'scheduler': 'Cosine', 'T_max': 1806}.
Using device: cuda
Best model found at epoch 4300
Using device: cuda
Best model found at epoch 4300
Using device: cuda
Best model found at epoch 4300
Using device: cuda
Best model found at epoch 4300
Using device: cuda
Best model found at epoch 4300
ACC_mean: 0.6573
ACC_std: 0.0038
F1_mean: 0.6345
F1_std: 0.0031
AUROC_mean: 0.7164
AUROC_std: 0.0026
AUPR_mean: 0.7096
AUPR_std: 0.0018
0it [00:00, ?it/s]1it [17:35, 1055.88s/it]2it [34:27, 1029.78s/it]3it [51:43, 1032.68s/it]4it [1:08:50, 1030.40s/it]5it [1:26:04, 1031.77s/it]5it [1:26:04, 1032.92s/it]
[I 2025-04-20 01:08:39,286] Trial 78 finished with values: [0.7209758379465653, 0.712646535434456, 0.6385745839683026, 0.6602997654861873] and parameters: {'dropout1': 0.1, 'dropout2': 0.35, 'hidden1': 336, 'hidden2': 154, 'hidden3': 45, 'epochs': 4000, 'heads': 5, 'activation': 'relu', 'optimizer': 'Adam', 'lr': 6.981158432617779e-05, 'weight_decay': 0.0002853137891795306, 'scheduler': 'Cosine', 'T_max': 1231}.
Using device: cuda
Best model found at epoch 4000
Using device: cuda
Best model found at epoch 4000
Using device: cuda
Best model found at epoch 4000
Using device: cuda
Best model found at epoch 4000
Using device: cuda
Best model found at epoch 4000
ACC_mean: 0.6603
ACC_std: 0.0033
F1_mean: 0.6386
F1_std: 0.0055
AUROC_mean: 0.7210
AUROC_std: 0.0028
AUPR_mean: 0.7126
AUPR_std: 0.0023
0it [00:00, ?it/s]1it [22:33, 1353.46s/it]2it [45:13, 1357.52s/it]3it [1:08:04, 1363.35s/it]4it [1:30:13, 1349.94s/it]5it [1:52:07, 1336.97s/it]5it [1:52:07, 1345.49s/it]
[I 2025-04-20 03:00:48,701] Trial 84 finished with values: [0.6222262271470973, 0.6064620186795129, 0.5253255266479997, 0.5799622472313327] and parameters: {'dropout1': 0.4, 'dropout2': 0.30000000000000004, 'hidden1': 387, 'hidden2': 345, 'hidden3': 238, 'epochs': 4300, 'heads': 3, 'activation': 'relu', 'optimizer': 'AdamW', 'lr': 0.005955373844448557, 'weight_decay': 1.119365974246048e-05, 'scheduler': 'Cosine', 'T_max': 1232}.
Using device: cuda
Best model found at epoch 4300
Using device: cuda
Best model found at epoch 4300
Using device: cuda
Best model found at epoch 4300
Using device: cuda
Best model found at epoch 4300
Using device: cuda
Best model found at epoch 4300
ACC_mean: 0.5800
ACC_std: 0.0619
F1_mean: 0.5253
F1_std: 0.1755
AUROC_mean: 0.6222
AUROC_std: 0.0734
AUPR_mean: 0.6065
AUPR_std: 0.0706
0it [00:00, ?it/s]1it [56:27, 3387.78s/it]2it [1:51:20, 3331.80s/it]3it [2:48:18, 3371.17s/it]4it [3:44:55, 3381.27s/it]5it [4:41:56, 3395.68s/it]5it [4:41:56, 3383.28s/it]
[I 2025-04-20 07:42:48,575] Trial 97 finished with values: [0.7104970083788424, 0.7020089385236051, 0.6267344000661625, 0.6515013769435037] and parameters: {'dropout1': 0.1, 'dropout2': 0.2, 'hidden1': 571, 'hidden2': 169, 'hidden3': 127, 'epochs': 9800, 'heads': 8, 'activation': 'gelu', 'optimizer': 'AdamW', 'lr': 2.800678329002953e-05, 'weight_decay': 0.00041182083795153197, 'scheduler': 'Cosine', 'T_max': 3937}.
Using device: cuda
Best model found at epoch 9800
Using device: cuda
Best model found at epoch 9800
Using device: cuda
Best model found at epoch 9800
Using device: cuda
Best model found at epoch 9800
Using device: cuda
Best model found at epoch 9800
ACC_mean: 0.6515
ACC_std: 0.0042
F1_mean: 0.6267
F1_std: 0.0064
AUROC_mean: 0.7105
AUROC_std: 0.0021
AUPR_mean: 0.7020
AUPR_std: 0.0013
0it [00:00, ?it/s]1it [54:55, 3295.12s/it]2it [1:48:35, 3251.28s/it]3it [2:39:55, 3173.19s/it]4it [3:31:07, 3132.90s/it]slurmstepd: error: *** JOB 34492536 ON aga34 CANCELLED AT 2025-04-20T12:02:34 DUE TO TIME LIMIT ***
