Not a conda environment: /scratch.global/inoue019/myenv
load nci
unique drugs: 177
unique genes: 251
DTI unique genes:  251
Top 90% variable genes:  2383
Total:  2582
Final gene exp shape: (60, 2582)
Final drug Act shape: (1005, 60)
  0%|          | 0/25 [00:00<?, ?it/s]  4%|▍         | 1/25 [00:02<01:10,  2.92s/it]  8%|▊         | 2/25 [00:03<00:31,  1.35s/it] 12%|█▏        | 3/25 [00:03<00:18,  1.18it/s] 16%|█▌        | 4/25 [00:03<00:12,  1.65it/s] 20%|██        | 5/25 [00:03<00:09,  2.06it/s] 24%|██▍       | 6/25 [00:04<00:07,  2.50it/s] 28%|██▊       | 7/25 [00:04<00:06,  2.87it/s] 32%|███▏      | 8/25 [00:04<00:05,  3.22it/s] 36%|███▌      | 9/25 [00:04<00:04,  3.45it/s] 40%|████      | 10/25 [00:05<00:03,  3.77it/s] 44%|████▍     | 11/25 [00:05<00:03,  3.89it/s] 48%|████▊     | 12/25 [00:05<00:03,  3.88it/s] 52%|█████▏    | 13/25 [00:05<00:03,  3.81it/s] 56%|█████▌    | 14/25 [00:06<00:02,  3.82it/s] 60%|██████    | 15/25 [00:06<00:02,  3.98it/s] 64%|██████▍   | 16/25 [00:06<00:02,  3.86it/s] 68%|██████▊   | 17/25 [00:06<00:02,  3.88it/s] 72%|███████▏  | 18/25 [00:07<00:01,  3.97it/s] 76%|███████▌  | 19/25 [00:07<00:01,  4.12it/s] 80%|████████  | 20/25 [00:07<00:01,  4.36it/s] 84%|████████▍ | 21/25 [00:07<00:00,  4.36it/s] 88%|████████▊ | 22/25 [00:08<00:00,  4.26it/s] 92%|█████████▏| 23/25 [00:08<00:00,  4.16it/s] 96%|█████████▌| 24/25 [00:08<00:00,  4.19it/s]100%|██████████| 25/25 [00:08<00:00,  4.06it/s]100%|██████████| 25/25 [00:08<00:00,  2.85it/s]
[I 2025-04-19 12:03:05,914] Using an existing study with name 'GATv2' instead of creating a new one.
Done!
0it [00:00, ?it/s]1it [42:27, 2547.51s/it]2it [1:26:28, 2602.52s/it]3it [2:10:00, 2606.65s/it]4it [2:49:02, 2502.43s/it]5it [3:27:18, 2427.72s/it]5it [3:27:18, 2487.60s/it]
[I 2025-04-19 15:30:26,345] Trial 4 finished with values: [0.7105476390281315, 0.7017232328902585, 0.6307553842177391, 0.6519282101360627] and parameters: {'dropout1': 0.30000000000000004, 'dropout2': 0.2, 'hidden1': 385, 'hidden2': 219, 'hidden3': 136, 'epochs': 6500, 'heads': 4, 'activation': 'relu', 'optimizer': 'AdamW', 'lr': 0.0009797004281198423, 'weight_decay': 0.0045607762995479445, 'scheduler': 'Cosine', 'T_max': 2935}.
Using device: cuda
Best model found at epoch 6500
Using device: cuda
Best model found at epoch 6500
Using device: cuda
Best model found at epoch 6500
Using device: cuda
Best model found at epoch 6500
Using device: cuda
Best model found at epoch 6500
ACC_mean: 0.6519
ACC_std: 0.0048
F1_mean: 0.6308
F1_std: 0.0050
AUROC_mean: 0.7105
AUROC_std: 0.0019
AUPR_mean: 0.7017
AUPR_std: 0.0006
0it [00:00, ?it/s]1it [10:42, 642.76s/it]2it [21:10, 633.98s/it]3it [31:47, 635.54s/it]4it [43:42, 666.56s/it]5it [54:51, 667.49s/it]5it [54:51, 658.25s/it]
[I 2025-04-19 16:25:19,223] Trial 26 finished with values: [0.7167653812644004, 0.7070962305888617, 0.6182742986056936, 0.652893782896464] and parameters: {'dropout1': 0.25, 'dropout2': 0.15000000000000002, 'hidden1': 916, 'hidden2': 124, 'hidden3': 35, 'epochs': 2100, 'heads': 3, 'activation': 'relu', 'optimizer': 'Adam', 'lr': 1.3495813871651858e-05, 'weight_decay': 0.0003533296380038067, 'scheduler': 'Cosine', 'T_max': 538}.
Using device: cuda
Best model found at epoch 2100
Using device: cuda
Best model found at epoch 2100
Using device: cuda
Best model found at epoch 2100
Using device: cuda
Best model found at epoch 2100
Using device: cuda
Best model found at epoch 2100
ACC_mean: 0.6529
ACC_std: 0.0077
F1_mean: 0.6183
F1_std: 0.0271
AUROC_mean: 0.7168
AUROC_std: 0.0048
AUPR_mean: 0.7071
AUPR_std: 0.0053
0it [00:00, ?it/s]1it [54:30, 3270.66s/it]2it [1:44:30, 3111.58s/it]3it [2:35:54, 3098.81s/it]4it [3:27:05, 3087.70s/it]5it [4:18:04, 3077.47s/it]5it [4:18:04, 3096.90s/it]
[I 2025-04-19 20:43:25,374] Trial 33 finished with values: [0.7096574789217323, 0.7008677679846441, 0.6287381077054043, 0.6512601413752953] and parameters: {'dropout1': 0.35, 'dropout2': 0.35, 'hidden1': 750, 'hidden2': 278, 'hidden3': 50, 'epochs': 8300, 'heads': 6, 'activation': 'relu', 'optimizer': 'AdamW', 'lr': 0.0005428406547288754, 'weight_decay': 0.0014119917019591644, 'scheduler': None}.
Using device: cuda
Best model found at epoch 8300
Using device: cuda
Best model found at epoch 8300
Using device: cuda
Best model found at epoch 8300
Using device: cuda
Best model found at epoch 8300
Using device: cuda
Best model found at epoch 8300
ACC_mean: 0.6513
ACC_std: 0.0034
F1_mean: 0.6287
F1_std: 0.0041
AUROC_mean: 0.7097
AUROC_std: 0.0022
AUPR_mean: 0.7009
AUPR_std: 0.0014
0it [00:00, ?it/s]1it [45:40, 2740.00s/it]2it [1:31:41, 2752.73s/it]3it [2:17:48, 2759.18s/it]4it [3:04:34, 2777.69s/it]5it [3:51:16, 2786.28s/it]5it [3:51:16, 2775.22s/it]
[I 2025-04-20 00:34:43,136] Trial 59 finished with values: [0.711198895208877, 0.7026555863460212, 0.6286712870140935, 0.6525222121114524] and parameters: {'dropout1': 0.15000000000000002, 'dropout2': 0.4, 'hidden1': 991, 'hidden2': 165, 'hidden3': 145, 'epochs': 8300, 'heads': 4, 'activation': 'relu', 'optimizer': 'Adam', 'lr': 6.174315155287894e-05, 'weight_decay': 4.761890808096424e-06, 'scheduler': None}.
Using device: cuda
Best model found at epoch 8300
Using device: cuda
Best model found at epoch 8300
Using device: cuda
Best model found at epoch 8300
Using device: cuda
Best model found at epoch 8300
Using device: cuda
Best model found at epoch 8300
ACC_mean: 0.6525
ACC_std: 0.0046
F1_mean: 0.6287
F1_std: 0.0061
AUROC_mean: 0.7112
AUROC_std: 0.0021
AUPR_mean: 0.7027
AUPR_std: 0.0010
0it [00:00, ?it/s]1it [37:46, 2266.49s/it]2it [1:15:10, 2253.49s/it]3it [1:53:19, 2269.66s/it]4it [2:30:59, 2265.64s/it]5it [3:09:01, 2271.49s/it]5it [3:09:01, 2268.23s/it]
[I 2025-04-20 03:43:46,761] Trial 80 finished with values: [0.6852201581651962, 0.6764901671126241, 0.5140254965629485, 0.623643452596775] and parameters: {'dropout1': 0.15000000000000002, 'dropout2': 0.2, 'hidden1': 388, 'hidden2': 378, 'hidden3': 130, 'epochs': 6500, 'heads': 4, 'activation': 'relu', 'optimizer': 'AdamW', 'lr': 0.0008788084134239111, 'weight_decay': 0.00046615442073667015, 'scheduler': 'Cosine', 'T_max': 1701}.
Using device: cuda
Best model found at epoch 6500
Using device: cuda
Best model found at epoch 6500
Using device: cuda
Best model found at epoch 6500
Using device: cuda
Best model found at epoch 6500
Using device: cuda
Best model found at epoch 6500
ACC_mean: 0.6236
ACC_std: 0.0676
F1_mean: 0.5140
F1_std: 0.2722
AUROC_mean: 0.6852
AUROC_std: 0.0614
AUPR_mean: 0.6765
AUPR_std: 0.0615
0it [00:00, ?it/s]1it [29:55, 1795.29s/it]2it [58:56, 1763.29s/it]3it [1:27:44, 1747.52s/it]4it [1:58:12, 1779.15s/it]5it [2:25:40, 1731.71s/it]5it [2:25:40, 1748.04s/it]
[I 2025-04-20 06:09:29,119] Trial 105 finished with values: [0.7279150269602814, 0.719727420892016, 0.646621536787136, 0.6658495685604584] and parameters: {'dropout1': 0.35, 'dropout2': 0.4, 'hidden1': 628, 'hidden2': 72, 'hidden3': 57, 'epochs': 5700, 'heads': 5, 'activation': 'relu', 'optimizer': 'AdamW', 'lr': 2.8348711645316088e-05, 'weight_decay': 0.0007168998592706, 'scheduler': 'Cosine', 'T_max': 1800}.
Using device: cuda
Best model found at epoch 5700
Using device: cuda
Best model found at epoch 5700
Using device: cuda
Best model found at epoch 5700
Using device: cuda
Best model found at epoch 5700
Using device: cuda
Best model found at epoch 5700
ACC_mean: 0.6658
ACC_std: 0.0058
F1_mean: 0.6466
F1_std: 0.0095
AUROC_mean: 0.7279
AUROC_std: 0.0028
AUPR_mean: 0.7197
AUPR_std: 0.0025
0it [00:00, ?it/s]1it [28:53, 1733.92s/it]2it [57:40, 1729.59s/it]3it [1:26:37, 1733.01s/it]4it [1:55:28, 1732.02s/it]5it [2:24:25, 1733.88s/it]5it [2:24:25, 1733.05s/it]
[I 2025-04-20 08:33:56,200] Trial 120 finished with values: [0.7198457402330367, 0.7122210437975562, 0.6404901791608958, 0.6597058289712552] and parameters: {'dropout1': 0.30000000000000004, 'dropout2': 0.1, 'hidden1': 731, 'hidden2': 188, 'hidden3': 34, 'epochs': 5700, 'heads': 5, 'activation': 'relu', 'optimizer': 'Adam', 'lr': 7.916363957408013e-05, 'weight_decay': 0.0005810303667702086, 'scheduler': None}.
Using device: cuda
Best model found at epoch 5700
Using device: cuda
Best model found at epoch 5700
Using device: cuda
Best model found at epoch 5700
Using device: cuda
Best model found at epoch 5700
Using device: cuda
Best model found at epoch 5700
ACC_mean: 0.6597
ACC_std: 0.0032
F1_mean: 0.6405
F1_std: 0.0072
AUROC_mean: 0.7198
AUROC_std: 0.0033
AUPR_mean: 0.7122
AUPR_std: 0.0027
0it [00:00, ?it/s]1it [1:30:55, 5455.84s/it]2it [2:57:51, 5314.70s/it]slurmstepd: error: *** JOB 34492522 ON aga24 CANCELLED AT 2025-04-20T12:02:34 DUE TO TIME LIMIT ***
