Not a conda environment: /scratch.global/inoue019/myenv
load nci
unique drugs: 177
unique genes: 251
DTI unique genes:  251
Top 90% variable genes:  2383
Total:  2582
Final gene exp shape: (60, 2582)
Final drug Act shape: (1005, 60)
  0%|          | 0/25 [00:00<?, ?it/s]  4%|▍         | 1/25 [00:00<00:04,  5.54it/s]  8%|▊         | 2/25 [00:00<00:04,  5.35it/s] 12%|█▏        | 3/25 [00:00<00:04,  5.47it/s] 16%|█▌        | 4/25 [00:00<00:03,  5.73it/s] 20%|██        | 5/25 [00:00<00:03,  5.63it/s] 24%|██▍       | 6/25 [00:01<00:03,  5.71it/s] 28%|██▊       | 7/25 [00:01<00:02,  6.10it/s] 32%|███▏      | 8/25 [00:01<00:02,  6.05it/s] 36%|███▌      | 9/25 [00:01<00:02,  5.93it/s] 40%|████      | 10/25 [00:01<00:02,  5.91it/s] 44%|████▍     | 11/25 [00:01<00:02,  5.96it/s] 48%|████▊     | 12/25 [00:02<00:02,  6.04it/s] 52%|█████▏    | 13/25 [00:02<00:01,  6.01it/s] 56%|█████▌    | 14/25 [00:02<00:01,  5.82it/s] 60%|██████    | 15/25 [00:02<00:01,  5.78it/s] 64%|██████▍   | 16/25 [00:02<00:01,  5.90it/s] 68%|██████▊   | 17/25 [00:02<00:01,  6.08it/s] 72%|███████▏  | 18/25 [00:03<00:01,  6.19it/s] 76%|███████▌  | 19/25 [00:03<00:00,  6.32it/s] 80%|████████  | 20/25 [00:03<00:00,  6.53it/s] 84%|████████▍ | 21/25 [00:03<00:00,  6.44it/s] 88%|████████▊ | 22/25 [00:03<00:00,  6.45it/s] 92%|█████████▏| 23/25 [00:03<00:00,  6.25it/s] 96%|█████████▌| 24/25 [00:03<00:00,  6.26it/s]100%|██████████| 25/25 [00:04<00:00,  6.17it/s]100%|██████████| 25/25 [00:04<00:00,  6.03it/s]
[I 2025-04-19 12:31:13,482] Using an existing study with name 'GATv2' instead of creating a new one.
Done!
0it [00:00, ?it/s]1it [13:37, 817.24s/it]2it [27:15, 817.81s/it]3it [40:50, 816.40s/it]4it [54:22, 814.62s/it]5it [1:07:57, 815.04s/it]5it [1:07:57, 815.57s/it]
[I 2025-04-19 13:39:14,265] Trial 14 finished with values: [0.7161580074514047, 0.7069344235447174, 0.6381025635383797, 0.6574598255389222] and parameters: {'dropout1': 0.30000000000000004, 'dropout2': 0.2, 'hidden1': 261, 'hidden2': 260, 'hidden3': 208, 'epochs': 2300, 'heads': 4, 'activation': 'relu', 'optimizer': 'AdamW', 'lr': 0.0034456105220305624, 'weight_decay': 0.002320056545415034, 'scheduler': 'Cosine', 'T_max': 693}.
Using device: cuda
Best model found at epoch 2300
Using device: cuda
Best model found at epoch 2300
Using device: cuda
Best model found at epoch 2300
Using device: cuda
Best model found at epoch 2300
Using device: cuda
Best model found at epoch 2300
ACC_mean: 0.6575
ACC_std: 0.0031
F1_mean: 0.6381
F1_std: 0.0020
AUROC_mean: 0.7162
AUROC_std: 0.0033
AUPR_mean: 0.7069
AUPR_std: 0.0039
0it [00:00, ?it/s]1it [34:47, 2087.16s/it]2it [1:09:38, 2089.53s/it]3it [1:44:11, 2082.25s/it]4it [2:18:36, 2075.44s/it]5it [2:52:40, 2063.94s/it]5it [2:52:40, 2072.10s/it]
[I 2025-04-19 16:31:56,460] Trial 20 finished with values: [0.7196250332521263, 0.7113674700717167, 0.6334736420905169, 0.6595200969807019] and parameters: {'dropout1': 0.4, 'dropout2': 0.30000000000000004, 'hidden1': 971, 'hidden2': 432, 'hidden3': 92, 'epochs': 4900, 'heads': 6, 'activation': 'relu', 'optimizer': 'AdamW', 'lr': 2.49370059100035e-05, 'weight_decay': 0.004388699798222339, 'scheduler': 'Cosine', 'T_max': 2207}.
Using device: cuda
Best model found at epoch 4900
Using device: cuda
Best model found at epoch 4900
Using device: cuda
Best model found at epoch 4900
Using device: cuda
Best model found at epoch 4900
Using device: cuda
Best model found at epoch 4900
ACC_mean: 0.6595
ACC_std: 0.0035
F1_mean: 0.6335
F1_std: 0.0011
AUROC_mean: 0.7196
AUROC_std: 0.0036
AUPR_mean: 0.7114
AUPR_std: 0.0031
0it [00:00, ?it/s]1it [59:48, 3588.03s/it]2it [2:00:03, 3604.17s/it]3it [2:59:42, 3592.81s/it]4it [3:59:02, 3579.81s/it]5it [4:58:13, 3569.28s/it]5it [4:58:13, 3578.66s/it]
[I 2025-04-19 21:30:11,385] Trial 34 finished with values: [0.7118661656574017, 0.7030893214025146, 0.6313989611229545, 0.65291201535661] and parameters: {'dropout1': 0.5, 'dropout2': 0.2, 'hidden1': 269, 'hidden2': 210, 'hidden3': 107, 'epochs': 9500, 'heads': 8, 'activation': 'relu', 'optimizer': 'Adam', 'lr': 0.0007901091244394527, 'weight_decay': 5.608341787911756e-06, 'scheduler': None}.
Using device: cuda
Best model found at epoch 9500
Using device: cuda
Best model found at epoch 9500
Using device: cuda
Best model found at epoch 9500
Using device: cuda
Best model found at epoch 9500
Using device: cuda
Best model found at epoch 9500
ACC_mean: 0.6529
ACC_std: 0.0051
F1_mean: 0.6314
F1_std: 0.0066
AUROC_mean: 0.7119
AUROC_std: 0.0028
AUPR_mean: 0.7031
AUPR_std: 0.0021
0it [00:00, ?it/s]1it [37:52, 2272.55s/it]2it [1:15:52, 2277.05s/it]3it [1:53:57, 2280.54s/it]4it [2:32:02, 2282.47s/it]5it [3:10:11, 2284.74s/it]5it [3:10:11, 2282.33s/it]
[I 2025-04-20 00:40:24,554] Trial 65 finished with values: [0.7283447456565846, 0.7202409179005222, 0.6443881738134476, 0.6665178061403012] and parameters: {'dropout1': 0.30000000000000004, 'dropout2': 0.35, 'hidden1': 322, 'hidden2': 221, 'hidden3': 46, 'epochs': 8400, 'heads': 2, 'activation': 'relu', 'optimizer': 'AdamW', 'lr': 3.7002844423882844e-05, 'weight_decay': 3.7559526352742523e-06, 'scheduler': 'Cosine', 'T_max': 2723}.
Using device: cuda
Best model found at epoch 8400
Using device: cuda
Best model found at epoch 8400
Using device: cuda
Best model found at epoch 8400
Using device: cuda
Best model found at epoch 8400
Using device: cuda
Best model found at epoch 8400
ACC_mean: 0.6665
ACC_std: 0.0057
F1_mean: 0.6444
F1_std: 0.0089
AUROC_mean: 0.7283
AUROC_std: 0.0036
AUPR_mean: 0.7202
AUPR_std: 0.0026
0it [00:00, ?it/s]1it [16:00, 960.44s/it]2it [31:59, 959.70s/it]3it [47:59, 959.89s/it]4it [1:03:58, 959.55s/it]5it [1:19:58, 959.45s/it]5it [1:19:58, 959.61s/it]
[I 2025-04-20 02:00:24,302] Trial 81 finished with values: [0.6524951694540808, 0.6408633642119108, 0.5085760743427338, 0.6015309650704375] and parameters: {'dropout1': 0.30000000000000004, 'dropout2': 0.30000000000000004, 'hidden1': 998, 'hidden2': 407, 'hidden3': 91, 'epochs': 2100, 'heads': 8, 'activation': 'relu', 'optimizer': 'Adam', 'lr': 0.005955373844448557, 'weight_decay': 3.199626729012931e-05, 'scheduler': None}.
Using device: cuda
Best model found at epoch 2100
Using device: cuda
Best model found at epoch 2100
Using device: cuda
Best model found at epoch 2100
Using device: cuda
Best model found at epoch 2100
Using device: cuda
Best model found at epoch 2100
ACC_mean: 0.6015
ACC_std: 0.0640
F1_mean: 0.5086
F1_std: 0.2633
AUROC_mean: 0.6525
AUROC_std: 0.0808
AUPR_mean: 0.6409
AUPR_std: 0.0810
0it [00:00, ?it/s]1it [58:49, 3529.95s/it]2it [1:57:32, 3525.78s/it]3it [2:56:13, 3523.43s/it]4it [3:54:20, 3509.04s/it]5it [4:52:24, 3500.01s/it]5it [4:52:24, 3508.88s/it]
[I 2025-04-20 06:52:50,519] Trial 91 finished with values: [0.7107796257201492, 0.7024525334448837, 0.6300738455345589, 0.651928323830542] and parameters: {'dropout1': 0.30000000000000004, 'dropout2': 0.1, 'hidden1': 731, 'hidden2': 348, 'hidden3': 53, 'epochs': 8500, 'heads': 8, 'activation': 'relu', 'optimizer': 'Adam', 'lr': 1.0445268067469295e-05, 'weight_decay': 0.0005810303667702086, 'scheduler': None}.
Using device: cuda
Best model found at epoch 8500
Using device: cuda
Best model found at epoch 8500
Using device: cuda
Best model found at epoch 8500
Using device: cuda
Best model found at epoch 8500
Using device: cuda
Best model found at epoch 8500
ACC_mean: 0.6519
ACC_std: 0.0038
F1_mean: 0.6301
F1_std: 0.0076
AUROC_mean: 0.7108
AUROC_std: 0.0025
AUPR_mean: 0.7025
AUPR_std: 0.0012
0it [00:00, ?it/s]1it [12:21, 741.57s/it]2it [24:43, 741.75s/it]3it [37:05, 741.90s/it]4it [49:22, 739.89s/it]5it [1:01:40, 739.18s/it]5it [1:01:40, 740.05s/it]
[I 2025-04-20 07:54:32,469] Trial 124 finished with values: [0.7247319873171971, 0.716603350178336, 0.6369232932396273, 0.6626012966131861] and parameters: {'dropout1': 0.25, 'dropout2': 0.25, 'hidden1': 708, 'hidden2': 76, 'hidden3': 75, 'epochs': 2400, 'heads': 8, 'activation': 'relu', 'optimizer': 'Adam', 'lr': 0.0004834265460398401, 'weight_decay': 0.00025619380276876785, 'scheduler': None}.
Using device: cuda
Best model found at epoch 2400
Using device: cuda
Best model found at epoch 2400
Using device: cuda
Best model found at epoch 2400
Using device: cuda
Best model found at epoch 2400
Using device: cuda
Best model found at epoch 2400
ACC_mean: 0.6626
ACC_std: 0.0058
F1_mean: 0.6369
F1_std: 0.0086
AUROC_mean: 0.7247
AUROC_std: 0.0046
AUPR_mean: 0.7166
AUPR_std: 0.0030
0it [00:00, ?it/s]1it [07:24, 444.49s/it]2it [14:48, 444.26s/it]3it [22:12, 444.11s/it]4it [29:36, 444.22s/it]5it [37:01, 444.25s/it]5it [37:01, 444.24s/it]
[I 2025-04-20 08:31:35,246] Trial 130 finished with values: [0.723250940690257, 0.7141736557597705, 0.6358268055386571, 0.6621004758768566] and parameters: {'dropout1': 0.35, 'dropout2': 0.5, 'hidden1': 529, 'hidden2': 399, 'hidden3': 76, 'epochs': 1000, 'heads': 8, 'activation': 'gelu', 'optimizer': 'AdamW', 'lr': 1.1680170271571963e-05, 'weight_decay': 1.0729753558504235e-05, 'scheduler': None}.
Using device: cuda
Best model found at epoch 1000
Using device: cuda
Best model found at epoch 1000
Using device: cuda
Best model found at epoch 1000
Using device: cuda
Best model found at epoch 1000
Using device: cuda
Best model found at epoch 1000
ACC_mean: 0.6621
ACC_std: 0.0018
F1_mean: 0.6358
F1_std: 0.0183
AUROC_mean: 0.7233
AUROC_std: 0.0020
AUPR_mean: 0.7142
AUPR_std: 0.0018
0it [00:00, ?it/s]1it [10:43, 643.98s/it]2it [21:29, 644.74s/it]3it [32:12, 643.86s/it]4it [42:59, 645.30s/it]5it [53:40, 643.81s/it]5it [53:40, 644.15s/it]
[I 2025-04-20 09:25:17,586] Trial 136 finished with values: [0.7125898764132332, 0.7038950423765933, 0.6313799765895265, 0.6528565014430929] and parameters: {'dropout1': 0.30000000000000004, 'dropout2': 0.1, 'hidden1': 760, 'hidden2': 108, 'hidden3': 96, 'epochs': 2100, 'heads': 6, 'activation': 'gelu', 'optimizer': 'AdamW', 'lr': 0.004735634649419025, 'weight_decay': 7.827091566634695e-05, 'scheduler': None}.
Using device: cuda
Best model found at epoch 2100
Using device: cuda
Best model found at epoch 2100
Using device: cuda
Best model found at epoch 2100
Using device: cuda
Best model found at epoch 2100
Using device: cuda
Best model found at epoch 2100
ACC_mean: 0.6529
ACC_std: 0.0062
F1_mean: 0.6314
F1_std: 0.0166
AUROC_mean: 0.7126
AUROC_std: 0.0028
AUPR_mean: 0.7039
AUPR_std: 0.0022
0it [00:00, ?it/s]1it [25:00, 1500.20s/it]2it [49:18, 1475.53s/it]3it [1:12:33, 1438.83s/it]4it [1:34:26, 1389.00s/it]5it [1:56:02, 1355.48s/it]5it [1:56:02, 1392.46s/it]
[I 2025-04-20 11:21:21,498] Trial 142 finished with values: [0.7246396947115736, 0.7120408513022563, 0.6546608678684211, 0.6644573865511696] and parameters: {'dropout1': 0.4, 'dropout2': 0.30000000000000004, 'hidden1': 971, 'hidden2': 105, 'hidden3': 101, 'epochs': 4900, 'heads': 6, 'activation': 'relu', 'optimizer': 'AdamW', 'lr': 2.49370059100035e-05, 'weight_decay': 0.0010747709298753927, 'scheduler': 'Cosine', 'T_max': 2233}.
Using device: cuda
Best model found at epoch 4900
Using device: cuda
Best model found at epoch 4900
Using device: cuda
Best model found at epoch 4900
Using device: cuda
Best model found at epoch 4900
Using device: cuda
Best model found at epoch 4900
ACC_mean: 0.6645
ACC_std: 0.0058
F1_mean: 0.6547
F1_std: 0.0167
AUROC_mean: 0.7246
AUROC_std: 0.0030
AUPR_mean: 0.7120
AUPR_std: 0.0039
0it [00:00, ?it/s]1it [57:42, 3462.16s/it]slurmstepd: error: *** JOB 34492554 ON aga14 CANCELLED AT 2025-04-20T12:31:23 DUE TO TIME LIMIT ***
