Not a conda environment: /scratch.global/inoue019/myenv
load nci
unique drugs: 177
unique genes: 251
DTI unique genes:  251
Top 90% variable genes:  2383
Total:  2582
Final gene exp shape: (60, 2582)
Final drug Act shape: (1005, 60)
  0%|          | 0/25 [00:00<?, ?it/s]  4%|▍         | 1/25 [00:02<01:00,  2.53s/it]  8%|▊         | 2/25 [00:02<00:27,  1.19s/it] 12%|█▏        | 3/25 [00:03<00:16,  1.33it/s] 16%|█▌        | 4/25 [00:03<00:11,  1.79it/s] 20%|██        | 5/25 [00:03<00:08,  2.22it/s] 24%|██▍       | 6/25 [00:03<00:07,  2.58it/s] 28%|██▊       | 7/25 [00:04<00:06,  2.91it/s] 32%|███▏      | 8/25 [00:04<00:05,  3.25it/s] 36%|███▌      | 9/25 [00:04<00:04,  3.59it/s] 40%|████      | 10/25 [00:04<00:04,  3.71it/s] 44%|████▍     | 11/25 [00:04<00:03,  3.82it/s] 48%|████▊     | 12/25 [00:05<00:03,  4.05it/s] 52%|█████▏    | 13/25 [00:05<00:02,  4.14it/s] 56%|█████▌    | 14/25 [00:05<00:02,  4.12it/s] 60%|██████    | 15/25 [00:05<00:02,  3.92it/s] 64%|██████▍   | 16/25 [00:06<00:02,  3.89it/s] 68%|██████▊   | 17/25 [00:06<00:02,  3.97it/s] 72%|███████▏  | 18/25 [00:06<00:01,  4.02it/s] 76%|███████▌  | 19/25 [00:06<00:01,  4.15it/s] 80%|████████  | 20/25 [00:07<00:01,  4.33it/s] 84%|████████▍ | 21/25 [00:07<00:00,  4.30it/s] 88%|████████▊ | 22/25 [00:07<00:00,  4.24it/s] 92%|█████████▏| 23/25 [00:07<00:00,  4.22it/s] 96%|█████████▌| 24/25 [00:08<00:00,  4.14it/s]100%|██████████| 25/25 [00:08<00:00,  4.06it/s]100%|██████████| 25/25 [00:08<00:00,  2.99it/s]
[I 2025-04-19 12:03:05,863] Using an existing study with name 'GATv2' instead of creating a new one.
Done!
0it [00:00, ?it/s]1it [47:58, 2878.90s/it]2it [1:19:55, 2312.97s/it]3it [1:51:46, 2129.43s/it]4it [2:23:40, 2044.12s/it]5it [2:55:50, 2003.23s/it]5it [2:55:50, 2110.16s/it]
[I 2025-04-19 14:58:59,160] Trial 3 finished with values: [0.7210295782744535, 0.7113397356273943, 0.6488688761497439, 0.6614318524248415] and parameters: {'dropout1': 0.5, 'dropout2': 0.2, 'hidden1': 593, 'hidden2': 138, 'hidden3': 62, 'epochs': 6100, 'heads': 6, 'activation': 'gelu', 'optimizer': 'AdamW', 'lr': 0.00010649212856264876, 'weight_decay': 2.072004346159324e-06, 'scheduler': None}.
Using device: cuda
Best model found at epoch 6100
Using device: cuda
Best model found at epoch 6100
Using device: cuda
Best model found at epoch 6100
Using device: cuda
Best model found at epoch 6100
Using device: cuda
Best model found at epoch 6100
ACC_mean: 0.6614
ACC_std: 0.0067
F1_mean: 0.6489
F1_std: 0.0177
AUROC_mean: 0.7210
AUROC_std: 0.0036
AUPR_mean: 0.7113
AUPR_std: 0.0050
0it [00:00, ?it/s]1it [54:31, 3271.94s/it]2it [1:49:13, 3277.89s/it]3it [2:44:08, 3285.27s/it]4it [3:49:02, 3525.59s/it]5it [5:00:17, 3795.84s/it]5it [5:00:17, 3603.42s/it]
[I 2025-04-19 19:59:18,107] Trial 24 finished with values: [0.7194431081943751, 0.7090659818738585, 0.6397199103007103, 0.660021386276098] and parameters: {'dropout1': 0.5, 'dropout2': 0.15000000000000002, 'hidden1': 471, 'hidden2': 375, 'hidden3': 35, 'epochs': 9900, 'heads': 4, 'activation': 'relu', 'optimizer': 'AdamW', 'lr': 0.00501625638037968, 'weight_decay': 1.6203517423357887e-05, 'scheduler': None}.
Using device: cuda
Best model found at epoch 9900
Using device: cuda
Best model found at epoch 9900
Using device: cuda
Best model found at epoch 9900
Using device: cuda
Best model found at epoch 9900
Using device: cuda
Best model found at epoch 9900
ACC_mean: 0.6600
ACC_std: 0.0029
F1_mean: 0.6397
F1_std: 0.0090
AUROC_mean: 0.7194
AUROC_std: 0.0027
AUPR_mean: 0.7091
AUPR_std: 0.0052
0it [00:00, ?it/s]1it [1:12:51, 4371.34s/it]2it [2:27:02, 4418.03s/it]3it [3:41:50, 4450.26s/it]4it [4:56:46, 4468.24s/it]5it [6:12:48, 4501.99s/it]5it [6:12:48, 4473.66s/it]
[I 2025-04-20 02:12:08,748] Trial 54 finished with values: [0.6705109199732375, 0.6565652274213819, 0.4561525754737434, 0.6034275646959486] and parameters: {'dropout1': 0.30000000000000004, 'dropout2': 0.30000000000000004, 'hidden1': 657, 'hidden2': 363, 'hidden3': 90, 'epochs': 8100, 'heads': 8, 'activation': 'gelu', 'optimizer': 'AdamW', 'lr': 0.004735634649419025, 'weight_decay': 7.599170349910427e-05, 'scheduler': None}.
Using device: cuda
Best model found at epoch 8100
Using device: cuda
Best model found at epoch 8100
Using device: cuda
Best model found at epoch 8100
Using device: cuda
Best model found at epoch 8100
Using device: cuda
Best model found at epoch 8100
ACC_mean: 0.6034
ACC_std: 0.0767
F1_mean: 0.4562
F1_std: 0.2674
AUROC_mean: 0.6705
AUROC_std: 0.0664
AUPR_mean: 0.6566
AUPR_std: 0.0711
0it [00:00, ?it/s]1it [55:50, 3350.47s/it]2it [1:51:38, 3349.24s/it]3it [2:46:38, 3326.78s/it]4it [3:41:15, 3306.84s/it]5it [4:37:01, 3320.94s/it]5it [4:37:01, 3324.22s/it]
[I 2025-04-20 06:49:12,412] Trial 94 finished with values: [0.7163314942021163, 0.7079453930633101, 0.6358147549251594, 0.6569214856244012] and parameters: {'dropout1': 0.2, 'dropout2': 0.15000000000000002, 'hidden1': 917, 'hidden2': 368, 'hidden3': 64, 'epochs': 7900, 'heads': 3, 'activation': 'relu', 'optimizer': 'Adam', 'lr': 0.00014134481664742062, 'weight_decay': 0.00013987096572904464, 'scheduler': None}.
Using device: cuda
Best model found at epoch 7900
Using device: cuda
Best model found at epoch 7900
Using device: cuda
Best model found at epoch 7900
Using device: cuda
Best model found at epoch 7900
Using device: cuda
Best model found at epoch 7900
ACC_mean: 0.6569
ACC_std: 0.0033
F1_mean: 0.6358
F1_std: 0.0093
AUROC_mean: 0.7163
AUROC_std: 0.0043
AUPR_mean: 0.7079
AUPR_std: 0.0041
0it [00:00, ?it/s]1it [13:33, 813.93s/it]2it [26:56, 807.19s/it]3it [40:17, 804.45s/it]4it [53:25, 798.05s/it]5it [1:06:54, 801.73s/it]5it [1:06:54, 802.82s/it]
[I 2025-04-20 07:56:08,991] Trial 122 finished with values: [0.7167185076349112, 0.7080260137205904, 0.6566830912528372, 0.6491613998560422] and parameters: {'dropout1': 0.5, 'dropout2': 0.25, 'hidden1': 988, 'hidden2': 168, 'hidden3': 68, 'epochs': 2100, 'heads': 2, 'activation': 'relu', 'optimizer': 'AdamW', 'lr': 0.0007144243354933753, 'weight_decay': 0.006073544323151372, 'scheduler': None}.
Using device: cuda
Best model found at epoch 2100
Using device: cuda
Best model found at epoch 2100
Using device: cuda
Best model found at epoch 2100
Using device: cuda
Best model found at epoch 2100
Using device: cuda
Best model found at epoch 2100
ACC_mean: 0.6492
ACC_std: 0.0298
F1_mean: 0.6567
F1_std: 0.0238
AUROC_mean: 0.7167
AUROC_std: 0.0095
AUPR_mean: 0.7080
AUPR_std: 0.0086
0it [00:00, ?it/s]1it [1:04:07, 3847.51s/it]2it [2:08:48, 3867.49s/it]3it [3:09:14, 3756.96s/it]4it [3:51:47, 3281.59s/it]slurmstepd: error: *** JOB 34492523 ON aga24 CANCELLED AT 2025-04-20T12:02:34 DUE TO TIME LIMIT ***
